,date,stock,sent,score,comment
788,2024-05-28 02:36:20,AMZN,NEGATIVE,0.997413456439972,There is a possibility that a company like TEMU could get bought out by a very large holding company..
789,2024-05-28 02:36:20,AMZN,NEGATIVE,0.9930826425552368,"Adapting their business model to incorporate ultra cheap Chinese merchandise with name brand merchandise, and selling products at 0% profit margins like a Amazon did for it's first 15 years of operation.."
790,2024-05-28 02:36:20,AMZN,NEGATIVE,0.999705731868744,Making all of their money from shareholders and very little from sales
791,2024-05-28 02:36:20,AMZN,NEGATIVE,0.997446060180664,"(Pseudo illegal Ponzi scheme/legal grey area)    Around 2017, their prices were no longer underbidding their competition and the companies primary selling point shifted from offering the lowest prices around to offering the same prices as everyone else with the convenience of free same-day/overnight delivery"
792,2024-05-28 02:36:20,AMZN,NEGATIVE,0.9996585845947266,   Amazon wouldn't be able to cut their prices enough to compete and would see an enormous drop in revenue leading to heavy selling pressure
793,2024-05-28 02:36:20,AMZN,NEGATIVE,0.999239444732666,"  This is all completely hypothetical, and by no means a prediction of what will happen.."
794,2024-05-28 02:36:20,AMZN,POSITIVE,0.5976628661155701,Just a theory of a possible scenario that could take down Amazon.
795,2024-05-28 02:36:20,AMZN,NEGATIVE,0.9984625577926636,Unionization and union-friendly legislation are the most apparent threats to their bottom line
796,2024-05-28 02:36:20,AMZN,POSITIVE,0.9471904039382936,"But that's communist, so it's an unlikely outcome"
797,2024-05-28 02:36:20,AMZN,NEGATIVE,0.9949361085891724,  Amazon depends on the PO to do a lot of the last mile delivery services
798,2024-05-28 02:36:20,AMZN,NEGATIVE,0.7883512377738953,Especially in rural areas that amazon doesnt have routes for
799,2024-05-28 02:36:20,AMZN,NEGATIVE,0.9973624348640442,"If the PO charges amazon something that isnt straight up free delivery, costs would go up"
800,2024-05-28 02:36:20,AMZN,NEGATIVE,0.8044394254684448,"Fedex and UPS does the same thing, however, that threat affects them as much as amazon"
801,2024-05-28 02:36:20,AMZN,NEGATIVE,0.9967328310012816, AWS really has no bear case
802,2024-05-28 02:36:20,AMZN,NEGATIVE,0.9961004257202148,"Web engineering tends towards consolidation because the most popular services have the most resources, documentation, reddit/stackoverflow comments to draw from"
803,2024-05-28 02:36:20,AMZN,POSITIVE,0.6881125569343567,AWS is one of those platforms.
804,2024-05-28 02:36:20,AMZN,NEGATIVE,0.9994993209838868,Never turned a profit
805,2024-05-28 02:36:20,AMZN,POSITIVE,0.9985835552215576,Gameshire Stopaway taking their place in the magnificent 7
806,2024-05-28 02:36:20,AMZN,POSITIVE,0.9116808772087096,That AWS growth slowing down and MS Azure catching up.
807,2024-05-28 02:36:20,AMZN,POSITIVE,0.9866299629211426,Ryan Cohen in the rear view mirror
808,2024-05-28 02:36:20,AMZN,NEGATIVE,0.9781298637390136,The only bear case is if Biden wins again and DOJ breaks Amazon (I doubt though)
809,2024-05-28 02:36:20,AMZN,NEGATIVE,0.9953749775886536,Gen AI will make switching from AWS to other cloud providers much easier
810,2024-05-28 02:36:20,AMZN,POSITIVE,0.9991279244422911,I like Temu
811,2024-05-28 02:36:20,AMZN,NEGATIVE,0.990548312664032,They blocked almost all high profile m&a lately
812,2024-05-28 02:36:20,AMZN,NEGATIVE,0.9966300129890442,Didn't Rockefeller make more money after his break-up than he did when it was whole?
813,2024-05-28 02:36:20,AMZN,NEGATIVE,0.9993802309036256,That’s bullish since a split up company would be more profitable
814,2024-05-28 02:36:20,AMZN,POSITIVE,0.9946787357330322,The entirety of Congress is invested in big tech
815,2024-05-28 02:36:20,AMZN,NEGATIVE,0.9997733235359192,"Unfortunately, by the time we know they have divested, it will be a month too late."
816,2024-05-28 02:36:20,AMZN,NEGATIVE,0.9987407326698304,"I think that's the big one.  I think there are a few other minor subjects of concern (that are pretty unlikely to stop their growth) and one big one that I think may just be a matter of time, but together they could compound on one another.      First, AWS is poorly designed compared to its competitors.  It's not Amazon's fault as they were the trailblazers and their competition got to benefit from learning lessons from AWS' mistakes, but AWS in turn is stuck with all of these legacy design choices that make it more cumbersome to use and learn because they don't want to break compatibility with everything their customer base has built on top of it.      Another potential concern is they're not perceived as a leader in the AI space (albeit not as far behind as Apple but its chatbot assitant Q has drawn unfavorable comparisons), and [Bezos himself has expressed concern that most AI firms aren't choosing to host with AWS.](https://www.businessinsider.com/jeff-bezos-amazon-worried-falling-behind-ai-race-google-openai-2024-5?op=1)    Finally, a big one for me, Amazon remains vulnerable to a unionization push.  If Amazon workers succeed in unionizing it would force up their prices, reduce their retail competitiveness, and, of course, tank profitability."
817,2024-05-28 02:36:20,AMZN,POSITIVE,0.5010746121406555,"I doubt it, big tech is a tool for American soft power"
818,2024-05-28 02:36:20,AMZN,NEGATIVE,0.9866142868995668,The congress hearings is just showboating
819,2024-05-28 02:36:20,AMZN,NEGATIVE,0.9824596643447876," If the big tech isn’t out of America, it’s out of another country"
820,2024-05-28 02:36:20,AMZN,NEGATIVE,0.9997323155403136,"We saw that with TikTok, Byte Dance got on the reels before an American business could capitalise on it."
821,2024-05-28 02:36:20,AMZN,NEGATIVE,0.9983928799629213,And breaking them up is a bad thing? This is the natural order of capitalism
822,2024-05-28 02:36:20,AMZN,NEGATIVE,0.9980769157409668,"There’s still a potential bull case with the DOJ though, because AWS would likely be spun off in its own company and while AMZN may drop, holders would get (newAWSticker) and that would still be very bullish"
823,2024-05-28 02:36:20,AMZN,NEGATIVE,0.9997877478599548,The question is how bad would AMZN drop before that spinoff.
824,2024-05-28 02:36:20,AMZN,NEGATIVE,0.9876176714897156,So what happens when Trump returns to the white house next year?
825,2024-05-28 02:36:20,AMZN,POSITIVE,0.993144154548645,This
826,2024-05-28 02:36:20,AMZN,NEGATIVE,0.9989266991615297,This ETF doesn't pay.
827,2024-05-28 02:36:20,AMZN,NEGATIVE,0.9842628836631776,I wonder what the price will be in 5 years
828,2024-05-28 02:36:20,AMZN,NEGATIVE,0.9997180104255676,"Lina Khan id as prepared for the job as any millennial out there, poorly, very poorly"
829,2024-05-28 02:36:20,AMZN,NEGATIVE,0.9987584352493286,"It’s what happens when you appoint scholars for executive type of jobs, you lose case after case"
830,2024-05-28 02:36:20,AMZN,NEGATIVE,0.9963711500167848,I will bet against useless in life bureaucrats hands down.
831,2024-05-28 02:36:20,AMZN,NEGATIVE,0.9997864365577698,"Nah, there's also the fact that it's one great cloud business tied up to a barely profitable, commodified and increasingly disliked retail empire."
832,2024-05-28 02:36:20,AMZN,NEGATIVE,0.9987558126449584,Agree and wait until they start to commercialize Starlink 2.0 (Kuiper) and they disrupt Verizon & telecom mafia
833,2024-05-28 02:36:20,AMZN,NEGATIVE,0.9816164970397948,Retail and advertising revenues are sensitive to the economy and many consumer discretionary companies are seeing weakness
834,2024-05-28 02:36:20,AMZN,NEGATIVE,0.9960965514183044,"Furthermore, Amazon's retail scale is already so big it gets harder and harder to grow"
835,2024-05-28 02:36:20,AMZN,NEGATIVE,0.982175886631012," Their cloud business has significant exposure to spending by other tech companies, many of which aren't particularly profitable"
836,2024-05-28 02:36:20,AMZN,NEGATIVE,0.9996683597564696,"Should interest rates remain high, expect cloud growth to slow."
837,2024-05-28 02:36:20,AMZN,NEGATIVE,0.9997037053108216,It's very hard to find a bear case for Amazon
838,2024-05-28 02:36:20,AMZN,POSITIVE,0.9996819496154784,Jeff Bezos has achieved so much in a relatively short space of time and will be remembered as one of the greatest industrial titans to have existed in human history.
839,2024-05-28 02:36:20,AMZN,NEGATIVE,0.9996825456619264,It's not fair to say no bear case
840,2024-05-28 02:36:20,AMZN,POSITIVE,0.975395143032074,"There's always a bear case, even though it's improbable it should be a part of the understanding"
841,2024-05-28 02:36:20,AMZN,NEGATIVE,0.9944887161254884,  Let's pick out the Cloud services
842,2024-05-28 02:36:20,AMZN,NEGATIVE,0.991664469242096,  Late 2000s to mid 2010s companies were wanting to take on more distributed computing services
843,2024-05-28 02:36:20,AMZN,NEGATIVE,0.9842202067375184,"Their architectures were struggling scaling horizontally - AWS was significantly more nimble versus the current company process of provisioning servers with IT, getting approval from Finance, securing those servers and deploying the teams to manage them"
844,2024-05-28 02:36:20,AMZN,POSITIVE,0.984279215335846,AWS made it so easy
845,2024-05-28 02:36:20,AMZN,NEGATIVE,0.8935664296150208,"  But late 2010s come along and more of the AWS style functionality becomes increasingly more accessible to on premise architectures - improvements in tools like Ansible (IBM), Terraform (Hashicorp/IBM), Kubernetes (from Google) (and countless others) made it easier for on prem departments to deploy ""cloud native"" services"
846,2024-05-28 02:36:20,AMZN,NEGATIVE,0.9856094717979432,"But still, even after that, on prem IT departments need super expensive engineers to code out all of the complexities of a departments infrastructure"
847,2024-05-28 02:36:20,AMZN,NEGATIVE,0.994762361049652,And companies need a lot of those expensive engineers to reach a critical mass of knowledge to keep those services automated/running/etc
848,2024-05-28 02:36:20,AMZN,NEGATIVE,0.9889476299285888,"Documentation is arcane, solutions are complex, time and money blah blah"
849,2024-05-28 02:36:20,AMZN,POSITIVE,0.8338621258735657," But then last year gen ai hits the ground running - gen ai is not coming for people's jobs, no, but it is making certain things easier"
850,2024-05-28 02:36:20,AMZN,POSITIVE,0.9992569088935852,Gen ai is very good at writing the code that is input for these systems
851,2024-05-28 02:36:20,AMZN,POSITIVE,0.998105764389038,"These system design languages have a much more structured approach to defining system architecture (than regular development languages), and because of that it can really boost productivity"
852,2024-05-28 02:36:20,AMZN,NEGATIVE,0.9914241433143616,"So now, IT departments can develop a lot of services quickly, and might think twice before immediately defaulting to the cloud"
853,2024-05-28 02:36:20,AMZN,NEGATIVE,0.978402316570282," Additionally you have another move towards ""cloud native"" and the approach to being cloud agnostic - meaning the company can shop around cloud providers to some degree (you would still need to move the data)"
854,2024-05-28 02:36:20,AMZN,NEGATIVE,0.9935528039932252,"That's why the EU made them reduce/remove data egress fees - https://www.infoq.com/news/2024/03/aws-egress-fees/#:\~:text=AWS%20has%20recently%20announced%20free,or%20on%2Dpremises%20data%20centers"
855,2024-05-28 02:36:20,AMZN,NEGATIVE,0.9564849138259888, Cloud has high margin - but there are a lot of threats in the space that could force a reeval
856,2024-05-28 02:36:20,AMZN,POSITIVE,0.9944347739219666,  That said
857,2024-05-28 02:36:20,AMZN,NEGATIVE,0.999414324760437,I am also bullish on AMZN and AWS.
858,2024-05-28 02:36:20,AMZN,NEGATIVE,0.998305082321167,Aren't they losing ground in the cloud to Azure and Google?  Still no reason to bet against them of course.
859,2024-05-28 02:36:20,AMZN,NEGATIVE,0.9779530167579652,"Last in personal AI assistant, fastest demolishing! /s"
860,2024-05-28 02:36:20,AMZN,NEGATIVE,0.9984087347984314,Only plausible bear case I’ve heard is antitrust
861,2024-05-28 02:36:20,AMZN,POSITIVE,0.9300515055656432,"With how corporate friendly we are, it seems unlikely."
862,2024-05-28 02:36:20,AMZN,NEGATIVE,0.9997389912605286,"But you’re missing the case where if they’re already at the top, they have no room to grow."
863,2024-05-28 02:36:20,AMZN,POSITIVE,0.9998772144317628,Amazon music and Amazon video are both AMAZING and unique in their production abilities.
864,2024-05-28 02:36:20,AMZN,POSITIVE,0.6921111941337585,This is a concern
865,2024-05-28 02:36:20,AMZN,NEGATIVE,0.9996435642242432, I recently bought computer parts for a new build and they are riddled with fake listing
866,2024-05-28 02:36:20,AMZN,NEGATIVE,0.9957386255264282," Chinese ""companies"" with American sounding names, 3+ five star reviews, give fake tracking that never moves but says shipped, never ship the item, make it a hassle"
867,2024-05-28 02:36:20,AMZN,NEGATIVE,0.9988147020339966," Amazon will give it the ""Amazon's choice"" badge and make it a huge hassle and delay to resolve"
868,2024-05-28 02:36:20,AMZN,NEGATIVE,0.9851205945014954,   Other two potentital issues I haven't really seen mentioned are:  * Labor market
869,2024-05-28 02:36:20,AMZN,NEGATIVE,0.9994181394577026," I read somewhere that they have terrible retention and the working conditions are worse than competitors (UPS and the teamsters union is tough to beat), even on pace to run out of new people to hire"
870,2024-05-28 02:36:20,AMZN,NEGATIVE,0.9997604489326476, They will run out of places to move and people to hire
871,2024-05-28 02:36:20,AMZN,NEGATIVE,0.9853808283805848,* Amazon branded IOT
872,2024-05-28 02:36:20,AMZN,NEGATIVE,0.998207688331604," I personally don't use things like Echo (spycam), Fire TV (bloatware), Ring, and imagine that most people who do use those things will eventually get sick of Amazon invading their home."
873,2024-05-28 02:36:20,AMZN,NEGATIVE,0.9665320515632628,Amazon started as an online bookstore…
874,2024-05-28 02:36:20,AMZN,POSITIVE,0.9993032217025756,Look at them now I think they’ll be fine lol
875,2024-05-28 02:36:20,AMZN,POSITIVE,0.9831933975219728,Almost all “US” products
876,2024-05-28 02:36:20,AMZN,POSITIVE,0.7488167881965637,Fixed it for you.
877,2024-05-28 02:36:20,AMZN,NEGATIVE,0.9994168281555176,I was going to say recession
878,2024-05-28 02:36:20,AMZN,NEGATIVE,0.989218771457672,The only bear case for AMZN is some type of externality.
879,2024-05-28 02:36:20,AMZN,NEGATIVE,0.9998075366020204,"If you look at its multiple compared to its average, it's actually quite low"
880,2024-05-28 02:36:20,AMZN,NEGATIVE,0.993059515953064,This is the most obvious case
881,2024-05-28 02:36:20,AMZN,NEGATIVE,0.9969016313552856,It's also one of the reasons AMZN hasn't been a good investment over the last 4 years
882,2024-05-28 02:36:20,AMZN,POSITIVE,0.9068925380706788,Their P/E went from 100+ to 50 over that period
883,2024-05-28 02:36:20,AMZN,NEGATIVE,0.9918539524078368,It can just as easily contract to a 35 P/E over the next 5 years
884,2024-05-28 02:36:20,AMZN,POSITIVE,0.9811935424804688,"In line more with a MSFT, which is actually growing revenue at a higher rate currently and has grown EBITDA more over the last 4 years than AMZN as well."
885,2024-05-28 02:36:20,AMZN,POSITIVE,0.9907208681106568,You certainly don’t need 10X the employees to get 10X the earnings growth.
886,2024-05-28 02:36:20,AMZN,NEGATIVE,0.9038079977035522,What about 10x the net income though? They have HUGE revenue and many ways remaining to cut costs and increase profits + margins
887,2024-05-28 02:36:20,AMZN,POSITIVE,0.9359639883041382,With the way robotics and AI is going..
888,2024-05-28 02:36:20,AMZN,NEGATIVE,0.9648596048355104,Sky's the limit if you ask me
889,2024-05-28 02:36:20,AMZN,NEGATIVE,0.9965693950653076,That is silly
890,2024-05-28 02:36:20,AMZN,NEGATIVE,0.9997299313545228,That is not how management and scale works at all.
891,2024-05-28 02:36:20,AMZN,NEGATIVE,0.9985700845718384,The chart is the bear case: Amazon has tested the 180 range twice and both times it sank
892,2024-05-28 02:36:20,AMZN,NEGATIVE,0.9939762353897096,It has currently put in a double top on a rapidly falling RSI
893,2024-05-28 02:36:20,AMZN,NEGATIVE,0.9968692660331726,But this is the short to mid term
894,2024-05-28 02:36:20,AMZN,NEGATIVE,0.9980443716049194,I think there will be better buying opportunities(160ish)
895,2024-05-28 02:36:20,AMZN,POSITIVE,0.9880619049072266,Then it will climb again and maybe this time clear resistance
896,2024-05-28 02:36:20,AMZN,NEGATIVE,0.9997841715812684, But right now the stock is cooling off of a massive 80% run and looks weak technically
897,2024-05-28 02:36:20,AMZN,NEGATIVE,0.9701364636421204,"I will buy, but at a lower price."
898,2024-05-28 02:36:20,AMZN,NEGATIVE,0.99746572971344,actually the way to  get 10x earnings will be by cutting 10x more employees with the help of AI
899,2024-05-28 02:36:20,AMZN,POSITIVE,0.8277403712272644,Why didn’t you like Selipsky? Just curious.
900,2024-05-28 02:36:20,AMZN,NEGATIVE,0.9635809063911438,What’s your biggest position? Google?
901,2024-05-28 02:36:20,AMZN,NEGATIVE,0.986369490623474,Until you might forget you still holding it lol
902,2024-05-28 02:36:20,AMZN,NEGATIVE,0.9968013763427734,Despite their gigantic revenue they‘re growing the new market segments with AWS and especially advertising super quickly
903,2024-05-28 02:36:20,AMZN,POSITIVE,0.9556684494018556,Also it’s one thing to grow your top line and another to grow your bottom line
904,2024-05-28 02:36:20,AMZN,POSITIVE,0.9934417009353638,When it comes to profitability Amazon has huge room for improvement which is great because at some point they will be able to return huge amounts of equity back to shareholders.
905,2024-05-28 02:36:20,AMZN,POSITIVE,0.9040125608444214,Very quickly
906,2024-05-28 02:36:20,AMZN,NEGATIVE,0.9996572732925416,Bro couldn’t answer the interview question 🤣
907,2024-05-28 02:36:20,AMZN,NEGATIVE,0.9803829193115234,"Work at AWS, the motto is 2>0 but 1>10"
908,2024-05-28 02:36:20,AMZN,NEGATIVE,0.998330533504486,They’d prefer 2 teams working on the same idea and have a bake-off
909,2024-05-28 02:36:20,AMZN,NEGATIVE,0.9288246035575868,"But, once a good solution exists everyone should disagree and commit"
910,2024-05-28 02:36:20,AMZN,POSITIVE,0.9998784065246582,It works wonders for innovation
911,2024-05-28 02:36:20,AMZN,NEGATIVE,0.997215747833252, You obviously don’t understand how decentralized big tech has changed industry forever with this small concept
912,2024-05-28 02:36:20,AMZN,POSITIVE,0.96401709318161,"Yes, there is some overlap and waste but the pro is 10x more innovation and speed."
913,2024-05-28 02:36:20,AMZN,NEGATIVE,0.9934949278831482,But aren't they right? A bit of internal competition shouldn't hurt sufficiently big corporation
914,2024-05-28 02:36:20,AMZN,NEGATIVE,0.9993671774864196,"If there's a general consensus that central planning doesn't work in state economy, even in smaller couple of millions of people countries, why are you so sure not only that it works in a corporation employing 100k+ white collar workers, but that's the only way to do stuff?  How do you even coordinate 100k+ employees in creative R&D space?"
915,2024-05-28 02:36:20,AMZN,POSITIVE,0.9998440742492676,You were right
916,2024-05-28 02:36:20,AMZN,NEGATIVE,0.9993237257003784,Their AWS unit got slashed in the last layoff
917,2024-05-28 02:36:20,AMZN,NEGATIVE,0.9941667318344116,Heard even the head got replaced.
918,2024-05-28 02:36:20,AMZN,NEGATIVE,0.963619589805603,It blows my mind very few others see this
919,2024-05-28 02:36:20,AMZN,POSITIVE,0.992289125919342,I'll add AliExpress in there as well
920,2024-05-28 02:36:20,AMZN,NEGATIVE,0.9982159733772278,I can now spend 10 dollars and get free shipping
921,2024-05-28 02:36:20,AMZN,NEGATIVE,0.9972175359725952,I get the same things as Amazon (without paying the middleman tax that doubles or triples the price) and shipping times are getting faster
922,2024-05-28 02:36:20,AMZN,NEGATIVE,0.996523916721344,"5 years ago, it used to take a month anytime I ordered china direct, now it's like a week, maybe week and a half"
923,2024-05-28 02:36:20,AMZN,NEGATIVE,0.999152660369873,"As this continues to get faster and more people recognize this, Amazon will struggle in retail."
924,2024-05-28 02:36:20,AMZN,POSITIVE,0.999832272529602,Valid point
925,2024-05-28 02:36:20,AMZN,POSITIVE,0.682732880115509,"Hopefully, I'm retired by then, and Daddy jassy is printing  for years to come"
926,2024-05-28 02:36:20,AMZN,NEGATIVE,0.997722327709198,  If I had to pick the best answer here it's probably this!
927,2024-05-28 02:36:20,AMZN,NEGATIVE,0.98491632938385,But then the companies would be worth more separately
928,2024-05-28 02:36:20,AMZN,NEGATIVE,0.9995217323303224,And r/fidelity  fucking sucks
929,2024-05-28 02:36:20,AMZN,NEGATIVE,0.9997648596763612, Disband your entire gui department what the fuck kind of business model is that shit
930,2024-05-28 02:36:20,AMZN,NEGATIVE,0.9968168139457704,There are still startups that haven’t launched yet who could be the next Netflix.
931,2024-05-28 02:36:20,AMZN,NEGATIVE,0.9983273148536682,"If they’re broken up they each might be worth more, no?"
932,2024-05-28 02:36:20,AMZN,NEGATIVE,0.9989625215530396,"Turned $30 billion in profit in 2023, how is that not turning a profit?"
933,2024-05-28 02:36:20,AMZN,NEGATIVE,0.994257152080536,How?
934,2024-05-28 02:36:20,AMZN,NEGATIVE,0.9992188215255736,UNH wishes they would have been successful when they sued to stop the ChangeHealth merger
935,2024-05-28 02:36:20,AMZN,NEGATIVE,0.9997740387916564, One of the worst mergers in history
936,2024-05-28 02:36:20,AMZN,NEGATIVE,0.977222979068756,Contested* they haven’t won mostly
937,2024-05-28 02:36:20,AMZN,NEGATIVE,0.9993733763694764,Buying a 200 million dollar market cap robot vacuum company is high profile? How is that purchase anti-competitive?
938,2024-05-28 02:36:20,AMZN,POSITIVE,0.998842716217041,And also look at T.
939,2024-05-28 02:36:20,AMZN,NEGATIVE,0.9995866417884828,The uncertainty is bad though
940,2024-05-28 02:36:20,AMZN,NEGATIVE,0.7224635481834412,You want acquisitions to be quick
941,2024-05-28 02:36:20,AMZN,NEGATIVE,0.9994733929634094,The company being acquired tends to decline while everything is being hashed out in court.
942,2024-05-28 02:36:20,AMZN,NEGATIVE,0.99212908744812,Split up costs would be enormous
943,2024-05-28 02:36:20,AMZN,NEGATIVE,0.9996066689491272,"Vine was ahead of TikTok by years, they just failed to monetize it properly"
944,2024-05-28 02:36:20,AMZN,NEGATIVE,0.9995929598808287,"Then they were bought out by Twitter, who arguably had the weakest ability to monetize content out of all the social media platforms (and I’m not even talking about the Elon era, but the early 2010s)"
945,2024-05-28 02:36:20,AMZN,NEGATIVE,0.9964568018913268,  Instagram for example makes a ton of money per user by directing them to purchase things through the app
946,2024-05-28 02:36:20,AMZN,NEGATIVE,0.999783217906952,Twitter always struggled to monetize their users and their purchase of Vine arguably killed it
947,2024-05-28 02:36:20,AMZN,NEGATIVE,0.9996203184127808," If someone more competent bought Vine and properly monetized it, it would’ve had the entrenched first mover advantage and likely prevented TikTok from breaking ground in the English speaking world."
948,2024-05-28 02:36:20,AMZN,NEGATIVE,0.9998027682304382,"Nah, this is such a bad take it’s not even funny"
949,2024-05-28 02:36:20,AMZN,NEGATIVE,0.9994688630104064,The retail portion of their business is prob the lowest margin and the least important to their profitability
950,2024-05-28 02:36:20,AMZN,POSITIVE,0.9985080361366272,Amazon is …  First in Cloud services and arguably provide the backbone of the internet
951,2024-05-28 02:36:20,AMZN,NEGATIVE,0.9962813258171082,This high margin recurring revenue is only going to continue to grow as AI Boom continues
952,2024-05-28 02:36:20,AMZN,POSITIVE,0.990334928035736, Second in Streaming services with Prime which is right behind Netflix
953,2024-05-28 02:36:20,AMZN,POSITIVE,0.9866922497749328,"However, unlike a Netflix subscription; Prime is so much more than just a video streaming service which cuts down on their churn making it even more valuable"
954,2024-05-28 02:36:20,AMZN,NEGATIVE,0.9865360856056212,  Third in Advertisement
955,2024-05-28 02:36:20,AMZN,POSITIVE,0.9966502785682678,Most people (You included) overlook this and how important it is to their future growth
956,2024-05-28 02:36:20,AMZN,POSITIVE,0.998920440673828,Amazon is growing its ad revenue insanely fast and they have arguably the most targeted and effective ads of any business (Yea including Google and Meta)
957,2024-05-28 02:36:20,AMZN,NEGATIVE,0.9965025186538696,People literally go to Amazon to type into the search bar exactly what they want to buy
958,2024-05-28 02:36:20,AMZN,NEGATIVE,0.9312976002693176,"How can you get more effective advertising info than that?   All the while, still number 1 in online retail as you mentioned"
959,2024-05-28 02:36:20,AMZN,POSITIVE,0.998794674873352,Which they are finally making profits on and expanding margin
960,2024-05-28 02:36:20,AMZN,POSITIVE,0.9907754063606262,"  Oh yeah, and they are also getting into healthcare and prescription delivery"
961,2024-05-28 02:36:20,AMZN,POSITIVE,0.9150020480155944,  They have a many growth levers it would make even your little head spin.
962,2024-05-28 02:36:20,AMZN,NEGATIVE,0.5515912771224976,"Best part of Kuiper is that it will slot in directly with their other cloud services like IoT, their existing satellite ground station service, edge compute, etc"
