,date,stock,sent,score,comment
0,2024-06-11 11:29:03,MSFT,POSITIVE,0.9878380298614502,"Wow never heard of this stock, interesting"
1,2024-06-11 11:29:03,MSFT,NEGATIVE,0.6479692459106445,"11% long term gain is not ""to the moon"""
2,2024-06-11 11:29:03,MSFT,NEGATIVE,0.997575342655182,This really just feels like you asked ChatGPT to write you a bull case on MSFT
3,2024-06-11 11:29:03,MSFT,POSITIVE,0.9971501231193542," Not that I don't think Microsoft is a good long term investment,  but obviously the most valuable company in the world is going to have large swaths of institutional investors and a majority of the analyst ratings are going to be 'Buy'"
4,2024-06-11 11:29:03,MSFT,NEGATIVE,0.9972161054611206,"If your 'technical analysis' is, I'm going to buy in anytime its above some arbitrary point thats above the moving average, and anything more than 3% off ATHs is a steal, you might as well be DCA'ing every couple weeks"
5,2024-06-11 11:29:03,MSFT,NEGATIVE,0.9997918009757996,And the idea that Apple 'epically failed' on AI just tells me you don't really understand who the major AI players are and what their role will be
6,2024-06-11 11:29:03,MSFT,POSITIVE,0.8126567006111145,"Apple isn't looking to compete with ChatGPT, I'm sure they're going to be happy to have Microsoft pay them billions of dollars a year to have ChatGPT come preloaded on every iPhone while Apple focuses on AI hardware."
7,2024-06-11 11:29:03,MSFT,NEGATIVE,0.997209131717682,"Analyst targets are for twelve months, which you are stating is your short term target?"
8,2024-06-11 11:29:03,MSFT,NEGATIVE,0.9750263690948486,TLDR: buy AAPL
9,2024-06-11 11:29:03,MSFT,POSITIVE,0.9978514909744264,My calls support this post
10,2024-06-11 11:29:03,MSFT,NEGATIVE,0.9527434706687928,Dang zoomers coming in here pumping their penny stocks.
11,2024-06-11 11:29:03,MSFT,POSITIVE,0.9993133544921876,Damn do I love some good DD
12,2024-06-11 11:29:03,MSFT,NEGATIVE,0.9984970092773438,Side note I feel like this would be a better play for options not shares
13,2024-06-11 11:29:03,MSFT,POSITIVE,0.9953675270080566,To each their own though
14,2024-06-11 11:29:03,MSFT,NEGATIVE,0.9948583841323853,"Google will own AI soon, they are just the most talented developers.  Look at Microsoft teams, Microsoft's crown jewel, its terrible.  It doesn't even have tabs, you literally can't use it to edit files and chat at the same time, and it can't render Microsoft's own formats properly.  Its a joke of a company holding on by technical debt, and proprietary file formats."
15,2024-06-11 11:29:03,MSFT,NEGATIVE,0.97303569316864,That was my same thought
16,2024-06-11 11:29:03,MSFT,POSITIVE,0.9893718361854552, Does it look like a good investment?  Sure
17,2024-06-11 11:29:03,MSFT,NEGATIVE,0.9997519850730896, It’s not what I would call a “rocket” though.
18,2024-06-11 11:29:03,MSFT,POSITIVE,0.9998397827148438,Good DD..
19,2024-06-11 11:29:03,MSFT,NEGATIVE,0.995104432106018,"this is literally ""analysts say this, insiders do this, institutional investors do that and here are a handful of metrics from Yahoo finance"""
20,2024-06-11 11:29:03,MSFT,NEGATIVE,0.9997774958610536," Zero actual analysis of the company, zero comparison with their price."
21,2024-06-11 11:29:03,MSFT,NEGATIVE,0.9928874373435974,It was written with AI
22,2024-06-11 11:29:03,MSFT,NEGATIVE,0.9866851568222046,OpenAI is not MSFT.
23,2024-06-11 11:29:03,MSFT,NEGATIVE,0.9992691874504088,[deleted]
24,2024-06-11 11:29:03,MSFT,NEGATIVE,0.9964078068733216,A bigger joke of a company than Microsoft is Google
25,2024-06-11 11:29:03,MSFT,NEGATIVE,0.9723262786865234,You must be out of your mind to think they will rule the AI space.
26,2024-06-11 11:29:03,MSFT,NEGATIVE,0.9564285278320312,"Sure, but did you see the rocket emoji?"
27,2024-06-11 11:29:03,MSFT,NEGATIVE,0.9989245533943176,Also his whole point about Apple was wrong
28,2024-06-11 11:29:03,MSFT,NEGATIVE,0.98029363155365,The stock price went up after its AI event
29,2024-06-11 11:29:03,MSFT,NEGATIVE,0.9997337460517884,He claimed share price went down 3%
30,2024-06-11 11:29:03,MSFT,POSITIVE,0.8801416158676147,Share price jumped 7%
31,2024-06-11 11:29:03,MSFT,NEGATIVE,0.9983554482460022,"It was sarcasm dude, all I see now is AI written “analysis” lol"
32,2024-06-11 11:29:03,MSFT,NEGATIVE,0.9991183876991272,"Oh really, so Microsoft can read their own file formats then.  I must need to get by eyes checked."
33,2024-06-11 11:29:03,MSFT,NEGATIVE,0.9848800897598268,"Agree to disagree.  At least Google software tends to work, and interoperate between each other.  Then thing like Edge which was largely made by Google."
34,2024-06-11 11:29:03,MSFT,NEGATIVE,0.8706386089324951,Huh
35,2024-06-11 11:29:03,MSFT,NEGATIVE,0.9853581190109252,The following two sentences sounded very non-sarcastic
36,2024-06-11 11:29:03,MSFT,NEGATIVE,0.9997666478157043,"My bad, I guess."
37,2024-06-11 11:29:03,MSFT,NEGATIVE,0.9878385066986084,"No that is my bad, I can see how one would think that"
38,2024-06-11 11:29:03,MSFT,NEGATIVE,0.9992901086807252,English is not my first language
39,2024-04-26 01:23:59,MSFT,NEGATIVE,0.9850401878356934,**User Report**| | | | :--|:--|:--|:-- **Total Submissions** | 7 | **First Seen In WSB** | 4 months ago **Total Comments** | 217 | **Previous Best DD** |  **Account Age** | 2 years | |   [**Join WSB Discord**](http://discord.gg/wsbverse)
40,2024-04-26 01:23:59,MSFT,POSITIVE,0.9991632699966432,"I hope these print for you Man  But damn, you are regarded"
41,2024-04-26 01:23:59,MSFT,NEGATIVE,0.9826605916023254,He made 535k  415 after hours  Long 415-380×100×200= 700k  Short 415-400x100x110=165k  Net profit 220k not including time  Verybnice
42,2024-04-26 01:23:59,MSFT,NEGATIVE,0.9992037415504456,is that a bull call spread for 110 contracts and then just calls for 90 more? do i read this correctly?
43,2024-04-26 01:23:59,MSFT,NEGATIVE,0.9894354343414308,https://preview.redd.it/616sl83sdowc1.jpeg?width=4320&format=pjpg&auto=webp&s=2fedaf0b2257f9dd084e5af8364983d62045be16
44,2024-04-26 01:23:59,MSFT,POSITIVE,0.999447762966156,You did it
45,2024-04-26 01:23:59,MSFT,NEGATIVE,0.9846872687339784,Crazy son of bitch
46,2024-04-26 01:23:59,MSFT,POSITIVE,0.999786913394928,"well, you’re rich asf now."
47,2024-04-26 01:23:59,MSFT,NEGATIVE,0.7384534478187561,so what was your day like from 3:30 til now?
48,2024-04-26 01:23:59,MSFT,NEGATIVE,0.9846881031990052,You just might be one rich guy in a few hours
49,2024-04-26 01:23:59,MSFT,POSITIVE,0.9973607659339904,I'm rooting for you brother
50,2024-04-26 01:23:59,MSFT,POSITIVE,0.9998302459716796,"Holy, congratulations"
51,2024-04-26 01:23:59,MSFT,NEGATIVE,0.994469165802002,Duuuuuuddeeeee...
52,2024-04-26 01:23:59,MSFT,POSITIVE,0.9809712767601012,   Show us your gainz tomorrow
53,2024-04-26 01:23:59,MSFT,NEGATIVE,0.9944437146186828,Could I get the barbeque cheese burger combo with large fries?
54,2024-04-26 01:23:59,MSFT,NEGATIVE,0.6178271174430847,Well your $315K is now $1.3-1.5million!! Congrats!!!
55,2024-04-26 01:23:59,MSFT,POSITIVE,0.9967218041419984,"I’m dumb , but your rich now right?"
56,2024-04-26 01:23:59,MSFT,POSITIVE,0.9406604766845704,Gg bro bro
57,2024-04-26 01:23:59,MSFT,NEGATIVE,0.9995335340499878,Delete this now
58,2024-04-26 01:23:59,MSFT,NEGATIVE,0.9996877908706664,My calls are fucked
59,2024-04-26 01:23:59,MSFT,NEGATIVE,0.999220848083496,How much did you pay for the $380 and how much did you sell the $400 for?
60,2024-04-26 01:23:59,MSFT,NEGATIVE,0.9972405433654784,You SOB
61,2024-04-26 01:23:59,MSFT,POSITIVE,0.9978060126304626,Please post update tomorrow on how rich your are
62,2024-04-26 01:23:59,MSFT,POSITIVE,0.9692507982254028,Hope you get some frosty margs tonight at the Chili's on 45th big man.
63,2024-04-26 01:23:59,MSFT,POSITIVE,0.9947881698608398,Rich boy
64,2024-04-26 01:23:59,MSFT,POSITIVE,0.999685525894165,Congratulations:)
65,2024-04-26 01:23:59,MSFT,POSITIVE,0.999766767024994,Thanks for this
66,2024-04-26 01:23:59,MSFT,NEGATIVE,0.9892712831497192,Loading up on Puts ![img](emote|t5_2th52|8882)
67,2024-04-26 01:23:59,MSFT,NEGATIVE,0.9905986189842224,"This is so freaking nuts, i hope these print for you OP"
68,2024-04-26 01:23:59,MSFT,POSITIVE,0.9422730207443236,godspeed  RemindMe! 7 hours
69,2024-04-26 01:23:59,MSFT,NEGATIVE,0.9756160378456116,Pray to jobu for MSFT to be at $399.99
70,2024-04-26 01:23:59,MSFT,NEGATIVE,0.989246904850006,!banbet msft -5% 24h
71,2024-04-26 01:23:59,MSFT,POSITIVE,0.9983307719230652,Congrats 🎊🎈🎉
72,2024-04-26 01:23:59,MSFT,NEGATIVE,0.772972047328949,Congrats and fuck you
73,2024-04-26 01:23:59,MSFT,NEGATIVE,0.8643115162849426,This gives me the itch to start yoloing my TFSA on options ![img](emote|t5_2th52|4271)![img](emote|t5_2th52|4271) good shit man
74,2024-04-26 01:23:59,MSFT,POSITIVE,0.9918975830078124,Wowzerz
75,2024-04-26 01:23:59,MSFT,NEGATIVE,0.9894277453422546,https://preview.redd.it/0o9740a6howc1.jpeg?width=800&format=pjpg&auto=webp&s=9b24de6cd539b4cc183b7251989d2619753df493
76,2024-04-26 01:23:59,MSFT,NEGATIVE,0.6126784086227417,https://preview.redd.it/8ivgfqivlowc1.jpeg?width=890&format=pjpg&auto=webp&s=ece2b3905081623b38901042f2c0b417e3d4eca0  At least one of us will be eating tonight
77,2024-04-26 01:23:59,MSFT,POSITIVE,0.5559748411178589,GG
78,2024-04-26 01:23:59,MSFT,POSITIVE,0.9997164607048036,Congrats man you won
79,2024-04-26 01:23:59,MSFT,POSITIVE,0.9984863996505736,Nice call bro
80,2024-04-26 01:23:59,MSFT,NEGATIVE,0.9950180053710938,"Holy fuck, absolute madman  RemindMe! 5 hours"
81,2024-04-26 01:23:59,MSFT,POSITIVE,0.9664950966835022,RemindMe! 3 hours
82,2024-04-26 01:23:59,MSFT,NEGATIVE,0.5146308541297913,This will print lol
83,2024-04-26 01:23:59,MSFT,POSITIVE,0.9687970280647278,I like to think this earnings session will carry the entire market up out of this correction
84,2024-04-26 01:23:59,MSFT,POSITIVE,0.8239534497261047,#GOD SPEED REGARD
85,2024-04-26 01:23:59,MSFT,POSITIVE,0.8342374563217163,This is fucking crazy  Congrats man  Use the wheel option strategy to make income off this and don't ever gamble like this again lol
86,2024-04-26 01:23:59,MSFT,POSITIVE,0.9998151659965516,good for u man
87,2024-04-26 01:23:59,MSFT,NEGATIVE,0.998753786087036,So half are covered have are regular long calls?
88,2024-04-26 01:23:59,MSFT,NEGATIVE,0.5860416889190674,Ggs
89,2024-04-26 01:23:59,MSFT,NEGATIVE,0.8319059610366821,Lambo
90,2024-04-26 01:23:59,MSFT,NEGATIVE,0.9912309646606444,And this is what % of your portfolio? 99%?
91,2024-04-26 01:23:59,MSFT,POSITIVE,0.9998538494110109,"Nice work, you must be happy right about now."
92,2024-04-26 01:23:59,MSFT,POSITIVE,0.9995567202568054,Welcome to tendie town
93,2024-04-26 01:23:59,MSFT,NEGATIVE,0.9995118379592896,Hory shit
94,2024-04-26 01:23:59,MSFT,NEGATIVE,0.9881868958473206,Dad?
95,2024-04-26 01:23:59,MSFT,NEGATIVE,0.7990625500679016,I inversed you on microsoft gg regards
96,2024-04-26 01:23:59,MSFT,POSITIVE,0.9998190999031068,Bless you with my highest regards!
97,2024-04-26 01:23:59,MSFT,POSITIVE,0.9787248969078064,RemindMe! 6 hours
98,2024-04-26 01:23:59,MSFT,NEGATIVE,0.98862224817276,We’ll gentleman time to buy some puts
99,2024-04-26 01:23:59,MSFT,NEGATIVE,0.9986475110054016,"If I prayed for you like a mad man, will you send me $200 from our profit![img](emote|t5_2th52|8882)"
100,2024-04-26 01:23:59,MSFT,POSITIVE,0.9996415376663208,I think you have a good shot here man
101,2024-04-26 01:23:59,MSFT,POSITIVE,0.9989632368087769,Fingers crossed for you.
102,2024-04-26 01:23:59,MSFT,NEGATIVE,0.6970565319061279,👀
103,2024-04-26 01:23:59,MSFT,POSITIVE,0.9969730377197266,Remind me! 2 hours
104,2024-04-26 01:23:59,MSFT,POSITIVE,0.9997039437294006,Godspeed my good man
105,2024-04-26 01:23:59,MSFT,NEGATIVE,0.9485690593719482,Just but some puts at 365
106,2024-04-26 01:23:59,MSFT,NEGATIVE,0.9943048357963562,"i know this might not be the place, but can someone explain to me whats going on exactly here? eli5 if you want"
107,2024-04-26 01:23:59,MSFT,POSITIVE,0.9998106360435486,Good luck mate !
108,2024-04-26 01:23:59,MSFT,POSITIVE,0.9674724340438844,RemindMe! 2 hours
109,2024-04-26 01:23:59,MSFT,NEGATIVE,0.99870502948761,Guy just made MSFT earnings tank
110,2024-04-26 01:23:59,MSFT,POSITIVE,0.6567001938819885,Jesus Christ
111,2024-04-26 01:23:59,MSFT,POSITIVE,0.97136789560318,RemindMe! 5 hours
112,2024-04-26 01:23:59,MSFT,NEGATIVE,0.9902593493461608,If you’re so confident why not just get the weeklies?
113,2024-04-26 01:23:59,MSFT,NEGATIVE,0.9914047718048096,"I'll also buying call...single, just one call."
114,2024-04-26 01:23:59,MSFT,NEGATIVE,0.998607575893402,Would puts even be a good idea today?
115,2024-04-26 01:23:59,MSFT,NEGATIVE,0.8083049058914185,Wow ! You are betting $315k on a single trade ?
116,2024-04-26 01:23:59,MSFT,POSITIVE,0.984310746192932,RemindMe! 21 hours
117,2024-04-26 01:23:59,MSFT,NEGATIVE,0.6232203841209412,u/RemindMeBot remind me in 24 hrs
118,2024-04-26 01:23:59,MSFT,POSITIVE,0.9950856566429138,"Phew, finally the markets going to go in the right direction"
119,2024-04-26 01:23:59,MSFT,POSITIVE,0.9943007230758668,"Thank you 🙏, we need more sacrifices like yours every now and then"
120,2024-04-26 01:23:59,MSFT,POSITIVE,0.9996848106384276,The hero we needed and got
121,2024-04-26 01:23:59,MSFT,POSITIVE,0.9998736381530762, But in all honesty good luck
122,2024-04-26 01:23:59,MSFT,NEGATIVE,0.6970565319061279,👍
123,2024-04-26 01:23:59,MSFT,NEGATIVE,0.9653743505477904,"Hell, I'll root for ya, kid."
124,2024-04-26 01:23:59,MSFT,NEGATIVE,0.9988346695899964,"watch msft print and then pce send us to the depths of hell, dragging msft along with it ![img](emote|t5_2th52|4640)"
125,2024-04-26 01:23:59,MSFT,POSITIVE,0.9996337890625,"For the sake of my calls and your play, I hope we are right"
126,2024-04-26 01:23:59,MSFT,POSITIVE,0.9995636343955994,IN MICROSOFT WE TRUST
127,2024-04-26 01:23:59,MSFT,POSITIVE,0.9998143315315248,Good luck pal
128,2024-04-26 01:23:59,MSFT,NEGATIVE,0.808280348777771,Please visit your local Wendy's after this so that I can either serve you or start teaching you about our work process.
129,2024-04-26 01:23:59,MSFT,POSITIVE,0.9997987151145936,![img](emote|t5_2th52|8882) so far so good
130,2024-04-26 01:23:59,MSFT,POSITIVE,0.999439775943756,Congrats
131,2024-04-26 01:23:59,MSFT,POSITIVE,0.999649167060852,Wow!
132,2024-04-26 01:23:59,MSFT,POSITIVE,0.9103890657424928,MSFT beats estimates
133,2024-04-26 01:23:59,MSFT,NEGATIVE,0.5329375267028809,Grats dude
134,2024-04-26 01:23:59,MSFT,NEGATIVE,0.9976295232772828,Micro...hard 🍆🍆💦💦
135,2024-04-26 01:23:59,MSFT,NEGATIVE,0.901189386844635,"Holy FUCK man, congrats"
136,2024-04-26 01:23:59,MSFT,NEGATIVE,0.5681107640266418,Niceeeeee
137,2024-04-26 01:23:59,MSFT,NEGATIVE,0.9901763796806335,These r printingggt
138,2024-04-26 01:23:59,MSFT,POSITIVE,0.9927899837493896,jesus you are richer than god off this earnings
139,2024-04-26 01:23:59,MSFT,POSITIVE,0.9973674416542052,"is it a debit call spread? damn, you will be rich.Congrats"
140,2024-04-26 01:23:59,MSFT,POSITIVE,0.9998410940170288,Well done.
141,2024-04-26 01:23:59,MSFT,POSITIVE,0.9531176686286926,printing
142,2024-04-26 01:23:59,MSFT,POSITIVE,0.9998531341552734,Good moves my friend.
143,2024-04-26 01:23:59,MSFT,POSITIVE,0.9951093792915344,Grats on your win OP
144,2024-04-26 01:23:59,MSFT,POSITIVE,0.9982652068138124,Congratulations and fuck you 🍻
145,2024-04-26 01:23:59,MSFT,POSITIVE,0.9308411478996276,HE CAN FLY?!
146,2024-04-26 01:23:59,MSFT,POSITIVE,0.9204636812210084,"BRUH, POST THE GAINS TOMORROW"
147,2024-04-26 01:23:59,MSFT,NEGATIVE,0.997165024280548,This dude is a market mover now ![img](emote|t5_2th52|4271)  Congrats and fuck you
148,2024-04-26 01:23:59,MSFT,NEGATIVE,0.9989566802978516,I’m too regarded someone give me the translation other than op dropped a shit ton
149,2024-04-26 01:23:59,MSFT,POSITIVE,0.9994718432426452,"Hopefully PCE numbers are solid so these print nice, you have huge balls."
150,2024-04-26 01:23:59,MSFT,NEGATIVE,0.98593670129776,Nice move! How did you build your long bias ? Because after earnings the stock could have moved either way
151,2024-04-26 01:23:59,MSFT,NEGATIVE,0.9961048364639282,Did you follow a pattern?
152,2024-04-26 01:23:59,MSFT,POSITIVE,0.9890479445457458,Good luck buddy! Print that up and get some stripers!
153,2024-04-26 01:23:59,MSFT,POSITIVE,0.9950331449508668,Right now it's up $16
154,2024-04-26 01:23:59,MSFT,POSITIVE,0.9997318387031556,Not bad!
155,2024-04-26 01:23:59,MSFT,POSITIVE,0.5750569105148315,Congs
156,2024-04-26 01:23:59,MSFT,POSITIVE,0.9998589754104614,Very nice job
157,2024-04-26 01:23:59,MSFT,POSITIVE,0.9998384714126588,Well done
158,2024-04-26 01:23:59,MSFT,NEGATIVE,0.6418653130531311,It is a long call spread
159,2024-04-26 01:23:59,MSFT,NEGATIVE,0.9727711081504822,Just a little bit in the money
160,2024-04-26 01:23:59,MSFT,POSITIVE,0.5009704232215881,It is relatively safe comparing higher strike long call spread.
161,2024-04-26 01:23:59,MSFT,POSITIVE,0.946188986301422,Since you hit the lottery can you help me achieve a pc
162,2024-04-26 01:23:59,MSFT,NEGATIVE,0.9635736346244812,1.4 million is insane
163,2024-04-26 01:23:59,MSFT,POSITIVE,0.9995505213737488,Congrats.
164,2024-04-26 01:23:59,MSFT,POSITIVE,0.9998552799224854,Nice
165,2024-04-26 01:23:59,MSFT,POSITIVE,0.9826031923294068,Did the same
166,2024-04-26 01:23:59,MSFT,NEGATIVE,0.9997313618659972,Though not nearly that much money!
167,2024-04-26 01:23:59,MSFT,NEGATIVE,0.6747496724128723,I’m sure ur printing now
168,2024-04-26 01:23:59,MSFT,POSITIVE,0.9992188215255736,Wowz
169,2024-04-26 01:23:59,MSFT,POSITIVE,0.9992345571517944,I have a feeling this is going to print big time my friend
170,2024-04-26 01:23:59,MSFT,POSITIVE,0.9789222478866576,God speed
171,2024-04-26 01:23:59,MSFT,POSITIVE,0.9971377849578856,That’s a bold strategy Cotton let’s see if it pays off
172,2024-04-26 01:23:59,MSFT,POSITIVE,0.9990276098251344,"Well, as always: congratulations and fuck you"
173,2024-04-26 01:23:59,MSFT,NEGATIVE,0.9962975382804872,Whats the max profit you can make here? If lets say the call option you sold got exercised?
174,2024-04-26 01:23:59,MSFT,NEGATIVE,0.99921452999115,Can anybody explains to me how does this bull call spread strategy actually works? In simple english?
175,2024-04-26 01:23:59,MSFT,POSITIVE,0.989562213420868,Waiting to see the gains sir
176,2024-04-26 01:23:59,MSFT,NEGATIVE,0.9986079335212708,Hard to watcg
177,2024-04-26 01:23:59,MSFT,NEGATIVE,0.9943864345550536,Hows the position?
178,2024-04-26 01:23:59,MSFT,NEGATIVE,0.999667763710022,Jesus fuck I don't understand anything about anything
179,2024-04-26 01:23:59,MSFT,NEGATIVE,0.9841784834861756,Brain fried.
180,2024-04-26 01:23:59,MSFT,POSITIVE,0.8267633318901062,Wow this is just what i needed to throw my money into calls
181,2024-04-26 01:23:59,MSFT,NEGATIVE,0.9956958293914796,I guess if your balsy enough to risk 300k i can risk 500$
182,2024-04-26 01:23:59,MSFT,NEGATIVE,0.9902788996696472,https://preview.redd.it/fy7gsqlilowc1.png?width=1080&format=pjpg&auto=webp&s=c8c07810931ab826d6cfedc55f59e14ed065ab54
183,2024-04-26 01:23:59,MSFT,NEGATIVE,0.9903631806373596,RIP
184,2024-04-26 01:23:59,MSFT,NEGATIVE,0.999497413635254,"Not expecting a fade is as usual, very stupid"
185,2024-04-26 01:23:59,MSFT,NEGATIVE,0.999496340751648,Moreover GDP tomorrow the crap sinks
186,2024-04-26 01:23:59,MSFT,NEGATIVE,0.9955518841743468,"It is easy if you dont care of what you hold abundant, sake of your hineritance"
187,2024-04-26 01:23:59,MSFT,POSITIVE,0.9997484087944032,House win
188,2024-04-26 01:23:59,MSFT,NEGATIVE,0.999755561351776,Sell to open is not Yolo !! Worst case you will get assignment
189,2024-04-26 01:23:59,MSFT,NEGATIVE,0.9973986148834229,Bro calls on MSFT today?? No bro
190,2024-04-26 01:23:59,MSFT,POSITIVE,0.581998348236084,You fked it.
191,2024-04-26 01:23:59,MSFT,NEGATIVE,0.9995446801185608,"I have puts, you will lose regard"
192,2024-04-26 01:23:59,MSFT,NEGATIVE,0.999531388282776,"WHAT IS THIS SPREAD SHIT ? ALL IN OR GTFO WITH UR FANCY PANTS SPREADS, SPREAD THOSE CHEECKS!!"
193,2024-04-26 01:23:59,MSFT,NEGATIVE,0.9876013398170472,If I die… I die
194,2024-04-26 01:23:59,MSFT,POSITIVE,0.6509831547737122,Those are May 10th expiry
195,2024-04-26 01:23:59,MSFT,NEGATIVE,0.9978581070899964,"There’s a good chance that the $415 absolute value will be sold at premium and not including tomorrows gains, he should be looking at at least $750k"
196,2024-04-26 01:23:59,MSFT,NEGATIVE,0.972263753414154,"Yes, this is debit spread"
197,2024-04-26 01:23:59,MSFT,POSITIVE,0.9749123454093932,"ideally, 220k profit"
198,2024-04-26 01:23:59,MSFT,NEGATIVE,0.96322101354599,"but in reality, it won't."
199,2024-04-26 01:23:59,MSFT,POSITIVE,0.999772012233734,Correct.
200,2024-04-26 01:23:59,MSFT,POSITIVE,0.8554674983024597,Can you explain how this works? Just curious
201,2024-04-26 01:23:59,MSFT,NEGATIVE,0.5459110140800476,"F it, I'm in."
202,2024-04-26 01:23:59,MSFT,POSITIVE,0.9997921586036682,You’re a gentleman
203,2024-04-26 01:23:59,MSFT,POSITIVE,0.8235341906547546,"1000 bucks will only get you FDs on Microsoft, premiums are lofty"
204,2024-04-26 01:23:59,MSFT,POSITIVE,0.5085781812667847,TBH he already was rich
205,2024-04-26 01:23:59,MSFT,POSITIVE,0.999760925769806,He’s just richer now.
206,2024-04-26 01:23:59,MSFT,POSITIVE,0.5401792526245117,And a Frosty
207,2024-04-26 01:23:59,MSFT,POSITIVE,0.9863640666007996,Should be around there if it holds up until tomorrow
208,2024-04-26 01:23:59,MSFT,POSITIVE,0.999812662601471,Thanks.
209,2024-04-26 01:23:59,MSFT,POSITIVE,0.9734758734703064,"He was already rich, but yes, rich as fuck now."
210,2024-04-26 01:23:59,MSFT,NEGATIVE,0.6886467933654785,"Premium received $10.6, premium paid $21.9"
211,2024-04-26 01:23:59,MSFT,POSITIVE,0.9090102314949036,Ha… Just might do that!
212,2024-04-26 01:23:59,MSFT,NEGATIVE,0.9903631806373596,Rip
213,2024-04-26 01:23:59,MSFT,POSITIVE,0.985693335533142,RemindMe! 12 hours
214,2024-04-26 01:23:59,MSFT,NEGATIVE,0.9860391616821288,I will be messaging you in 7 hours on [**2024-04-26 00:33:37 UTC**](http://www.wolframalpha.com/input/?i=2024-04-26%2000:33:37%20UTC%20To%20Local%20Time) to remind you of [**this link**](https://www.reddit.com/r/wallstreetbets/comments/1ccw989/msft_315k_yolo/l184iex/?context=3)  [**2 OTHERS CLICKED THIS LINK**](https://www.reddit.com/message/compose/?to=RemindMeBot&subject=Reminder&message=%5Bhttps%3A%2F%2Fwww.reddit.com%2Fr%2Fwallstreetbets%2Fcomments%2F1ccw989%2Fmsft_315k_yolo%2Fl184iex%2F%5D%0A%0ARemindMe%21%202024-04-26%2000%3A33%3A37%20UTC) to send a PM to also be reminded and to reduce spam
215,2024-04-26 01:23:59,MSFT,NEGATIVE,0.9976073503494264, ^(Parent commenter can ) [^(delete this message to hide from others.)](https://www.reddit.com/message/compose/?to=RemindMeBot&subject=Delete%20Comment&message=Delete%21%201ccw989)  *****  |[^(Info)](https://www.reddit.com/r/RemindMeBot/comments/e1bko7/remindmebot_info_v21/)|[^(Custom)](https://www.reddit.com/message/compose/?to=RemindMeBot&subject=Reminder&message=%5BLink%20or%20message%20inside%20square%20brackets%5D%0A%0ARemindMe%21%20Time%20period%20here)|[^(Your Reminders)](https://www.reddit.com/message/compose/?to=RemindMeBot&subject=List%20Of%20Reminders&message=MyReminders%21)|[^(Feedback)](https://www.reddit.com/message/compose/?to=Watchful1&subject=RemindMeBot%20Feedback)| |-|-|-|-|
216,2024-04-26 01:23:59,MSFT,NEGATIVE,0.9969723224639891,Definitely don’t do that
217,2024-04-26 01:23:59,MSFT,NEGATIVE,0.9838275909423828,"In all seriousness, this was a very calculated risk rather than a yolo"
218,2024-04-26 01:23:59,MSFT,NEGATIVE,0.9996088147163392,By no means was my entire account at play
219,2024-04-26 01:23:59,MSFT,NEGATIVE,0.9940548539161682,I add to my professionally managed retirement account every month and never ever move funds out of it
220,2024-04-26 01:23:59,MSFT,POSITIVE,0.7262971997261047,I have a set amount of money that I trade with and I do my best to manage risk.
221,2024-04-26 01:23:59,MSFT,NEGATIVE,0.8784732818603516,Oof
222,2024-04-26 01:23:59,MSFT,NEGATIVE,0.9950100183486938,![img](emote|t5_2th52|4267)
223,2024-04-26 01:23:59,MSFT,NEGATIVE,0.9696874618530272,Oof bro
224,2024-04-26 01:23:59,MSFT,NEGATIVE,0.9971055388450624,if I'm reading this right you bought 137 puts for 13.90 strike price at 402.5?
225,2024-04-26 01:23:59,MSFT,NEGATIVE,0.999610960483551,RevolutionaryCream77 and their ilk are delusional idiots and not worth worrying about
226,2024-04-26 01:23:59,MSFT,POSITIVE,0.9948535561561584,Earn your keep if you want to climb out of the gutter.
227,2024-04-26 01:23:59,MSFT,POSITIVE,0.9997805953025818,Yes
228,2024-04-26 01:23:59,MSFT,NEGATIVE,0.9942821264266968,Bull spread.
229,2024-04-26 01:23:59,MSFT,POSITIVE,0.9989826083183287,Technically it’s infinity.
230,2024-04-26 01:23:59,MSFT,NEGATIVE,0.9807568192481996,"The first leg I sold covered calls to collect a premium of $116,600"
231,2024-04-26 01:23:59,MSFT,NEGATIVE,0.9994564652442932,"I used that credit received to lower the premium paid for the 200 long calls for a net debit of $315,200"
232,2024-04-26 01:23:59,MSFT,NEGATIVE,0.9942613840103148,"To answer your question of profit potential… If my short position get exercised, that will be the $116,600 minimum"
233,2024-04-26 01:23:59,MSFT,NEGATIVE,0.980011820793152,The profit on my long position will be whatever I sell the contracts for above my purchased strike minus the premium paid
234,2024-04-26 01:23:59,MSFT,NEGATIVE,0.997512698173523,"If I were to close my longs right now and get exercised 328,600 + 116,600 = $445,200"
235,2024-04-26 01:23:59,MSFT,POSITIVE,0.993871808052063,"There’s also some value added for time but for the sake of simplicity, this is your answer."
236,2024-04-26 01:23:59,MSFT,NEGATIVE,0.997702658176422,Microsoft had an IV crush
237,2024-04-26 01:23:59,MSFT,NEGATIVE,0.999498724937439,OP didn't do well probably
