,date,stock,sent,score,comment
963,2024-05-28 02:36:20,AMZN,POSITIVE,0.8807899355888367,So it won’t be just a consumer focused product.
964,2024-05-28 02:36:20,AMZN,NEGATIVE,0.9997813105583192,I’m long Amazon but I have a feeling Kuiper is going to be a flop
965,2024-05-28 02:36:20,AMZN,POSITIVE,0.9907457828521729,They are several years behind
966,2024-05-28 02:36:20,AMZN,POSITIVE,0.8079212307929993,  Unless they make the price so attractive that is hard to pass up
967,2024-05-28 02:36:20,AMZN,NEGATIVE,0.9963353872299194,If they reduce my cable bill to under 20 bucks I’m in!
968,2024-05-28 02:36:20,AMZN,POSITIVE,0.993893265724182,AMZN retail is big in the US
969,2024-05-28 02:36:20,AMZN,NEGATIVE,0.9687909483909608,"Even then, online retail only represents about 15% of retail and people are shifting more and more towards it"
970,2024-05-28 02:36:20,AMZN,POSITIVE,0.9988897442817688,Then it is expanding rapidly in other locations
971,2024-05-28 02:36:20,AMZN,POSITIVE,0.7823869585990906,"So it could easily still 4x in the US and likely x10 in other countries - that is revenue, EPS could soar much more"
972,2024-05-28 02:36:20,AMZN,NEGATIVE,0.788688063621521,"  For the Cloud, it is the same"
973,2024-05-28 02:36:20,AMZN,POSITIVE,0.9990513920783995,People are still mainly using on premise and the secular shift to Cloud is enough to fuel at least a decade of growth
974,2024-05-28 02:36:20,AMZN,NEGATIVE,0.996225118637085,Crazy they have over 1 million employees it’s a frigggggin army!  Guy is Dr evil lmao
975,2024-05-28 02:36:20,AMZN,POSITIVE,0.9977961778640748,Ceo entrepreneur  Born in 1964
976,2024-05-28 02:36:20,AMZN,POSITIVE,0.9978336691856384,"I listened to the behind the bastards on him, and while he’s a terrible person, I also came out of it realizing he actually might be a genius in certain areas, and his success is very much earned"
977,2024-05-28 02:36:20,AMZN,NEGATIVE,0.9636505842208862,"He may have had a good dose of luck, but he turned it into way more than it would have been if he was just a trust fund baby."
978,2024-05-28 02:36:20,AMZN,NEGATIVE,0.9954860806465148,Wouldn't a bear case be Chinese companies outselling Amazon?
979,2024-05-28 02:36:20,AMZN,NEGATIVE,0.8050532341003418,"Probably true, but Jeff hasn't been CEO or president for ~3 years now."
980,2024-05-28 02:36:20,AMZN,NEGATIVE,0.986493706703186,"You do not seem to understand the main benefits of Cloud :   - no upfront costs and almost immediate time to market   - incredible software which runs the Cloud -> easy deployment, scalability, security, easy insights, analysis, traceability   - accessibility anywhere    AMZN also sells AWS Outposts, Storage Gateways and such for people who want to keep most of their infrastructure on premise"
981,2024-05-28 02:36:20,AMZN,POSITIVE,0.9998608827590942, Imagine you create a new successful business
982,2024-05-28 02:36:20,AMZN,NEGATIVE,0.9988127946853638,"Do you want pay a few 100k upfront to buy all your hardware, hire specialists, handle your own security, networking etc., buy new hardware every 3 months because your business is growing ? Or do you want to just hire a couple of guys who will set up a serverless architecture on AWS which you can create in less than 1 hour, will scale automatically and be up and running ASAP ?"
983,2024-05-28 02:36:20,AMZN,NEGATIVE,0.9938410520553588,GenAI can't prevision on-prem servers and databases though
984,2024-05-28 02:36:20,AMZN,NEGATIVE,0.9798415899276732,It speeds up cloud development more than it speeds up on prem I'd argue because it can just shit out terraform code for you.
985,2024-05-28 02:36:20,AMZN,POSITIVE,0.9794030785560608,"In terms of market share, a little"
986,2024-05-28 02:36:20,AMZN,POSITIVE,0.7614431381225586,They still add more $ than either every quarter to top and bottom line
987,2024-05-28 02:36:20,AMZN,POSITIVE,0.9982684850692748,I partly agree
988,2024-05-28 02:36:20,AMZN,NEGATIVE,0.9834227561950684,"As an investor though, it could be a short term benefit if there were a break-up though, the cumulative stock prices would likely be higher"
989,2024-05-28 02:36:20,AMZN,NEGATIVE,0.9933027029037476,"More than regulation, I would say increased taxes could hurt"
990,2024-05-28 02:36:20,AMZN,NEGATIVE,0.9997560381889344,That is just misguided
991,2024-05-28 02:36:20,AMZN,POSITIVE,0.931418240070343,More and more people are shopping online
992,2024-05-28 02:36:20,AMZN,POSITIVE,0.9717084169387816,More and more people are migrating to the Cloud
993,2024-05-28 02:36:20,AMZN,POSITIVE,0.9922263622283936,More and more people are streaming entertainment
994,2024-05-28 02:36:20,AMZN,NEGATIVE,0.9751826524734496,There are secular trends which are tailwinds for AMZN
995,2024-05-28 02:36:20,AMZN,POSITIVE,0.9988126754760742,Most of their businesses are growing 15% a year which is huge
996,2024-05-28 02:36:20,AMZN,POSITIVE,0.9993189573287964,"Even with lower revenue growth, FCF and EPS growth is what matters most"
997,2024-05-28 02:36:20,AMZN,NEGATIVE,0.994520664215088,"Well, someone has to I guess."
998,2024-05-28 02:36:20,AMZN,NEGATIVE,0.9707830548286438,They went from online bookstore to online retailer to cloud provider giant
999,2024-05-28 02:36:20,AMZN,POSITIVE,0.9998599290847778,Impressive really
1000,2024-05-28 02:36:20,AMZN,NEGATIVE,0.9921148419380188,But what’s the next play?
1001,2024-05-28 02:36:20,AMZN,POSITIVE,0.7810279726982117,"Oddly enough, Amazon has the top economists in the world working for them only behind the fed"
1002,2024-05-28 02:36:20,AMZN,POSITIVE,0.881854772567749," With their data at the economists hands, I’d suspect they are able to forecast 1000x better than anyone can"
1003,2024-05-28 02:36:20,AMZN,NEGATIVE,0.9915502071380616," In fact, I wouldn’t be surprised if the FED was tapping them for their insights."
1004,2024-05-28 02:36:20,AMZN,NEGATIVE,0.9995726943016052,Their growth rate is also much lower now compared to its historical average
1005,2024-05-28 02:36:20,AMZN,NEGATIVE,0.999613344669342,Their revenue is growing slower than MSFT
1006,2024-05-28 02:36:20,AMZN,POSITIVE,0.859869122505188,It's not absurd for AMZN to slowly contract to a 35 P/E over the next 5 years.
1007,2024-05-28 02:36:20,AMZN,POSITIVE,0.964651346206665,Likewise you don’t need 10x revenue to achieve 10x earnings.
1008,2024-05-28 02:36:20,AMZN,NEGATIVE,0.9992042183876038,You don’t want to know (it’s not Nvidia or game lol)
1009,2024-05-28 02:36:20,AMZN,NEGATIVE,0.9958022236824036,still salty about not getting the job at amazon lol
1010,2024-05-28 02:36:20,AMZN,NEGATIVE,0.99891459941864,Temu can't match amazon shipping speeds yet at all
1011,2024-05-28 02:36:20,AMZN,NEGATIVE,0.9915069937705994,Also temu is nothing name brand
1012,2024-05-28 02:36:20,AMZN,NEGATIVE,0.9905745387077332,I can order virtually order any brand with next day shipping with Amazon
1013,2024-05-28 02:36:20,AMZN,NEGATIVE,0.9985259175300598,Not saying temu couldn't eventually do that but that's a long ways away
1014,2024-05-28 02:36:20,AMZN,NEGATIVE,0.9987885355949402,The amazon killer will be another usa company and may not even be born yet.
1015,2024-05-28 02:36:20,AMZN,NEGATIVE,0.99565589427948,Not if the company was bought out by an American holding firm.
1016,2024-05-28 02:36:20,AMZN,NEGATIVE,0.9990098476409912,https://www.forbes.com/sites/jonmarkman/2017/05/23/the-amazon-era-no-profits-no-problem/?sh=75a31496437a   I guess I stopped paying attention to them
1017,2024-05-28 02:36:20,AMZN,NEGATIVE,0.9913018941879272,135B in debt -  85B cash makes them around 50B in debt?  30 M in profit is a drop in a debt bucket.
1018,2024-05-28 02:36:20,AMZN,POSITIVE,0.7986323237419128,"High profile doesn’t necessarily need to be pricy, it just needs to be something everyone knows."
1019,2024-05-28 02:36:20,AMZN,NEGATIVE,0.9993714690208436,It is when Roomba was/is the top-brand for robotic vacuum cleaners that run off wifi/GPS  Roomba>Shark>100s of Chinese knockoffs.
1020,2024-05-28 02:36:20,AMZN,NEGATIVE,0.966697871685028,"When a small M&A deal such as this one got shot down, it proved that Amazon is in the DOJ's crosshairs"
1021,2024-05-28 02:36:20,AMZN,POSITIVE,0.9998040795326232,What makes TikTok successful is its content recommendation engine
1022,2024-05-28 02:36:20,AMZN,NEGATIVE,0.9996708631515504,Vine is not a fair comparison to TikTok at all
1023,2024-05-28 02:36:20,AMZN,POSITIVE,0.9987986087799072,"With that being said, I still agreed with your main point"
1024,2024-05-28 02:36:20,AMZN,POSITIVE,0.9988725781440736,Competition is necessary to keep us moving forward
1025,2024-05-28 02:36:20,AMZN,NEGATIVE,0.9996492862701416,"When big tech keeps scooping up small companies before they get their big shots, we lose innovation over time"
1026,2024-05-28 02:36:20,AMZN,POSITIVE,0.9771385192871094,TikTok's success should be US's wake up call
1027,2024-05-28 02:36:20,AMZN,NEGATIVE,0.993727207183838,US needs to implement more favorate laws and financial incentives to encourage small companeis to grow on their own rather than gunning for an acquisition.
1028,2024-05-28 02:36:20,AMZN,NEGATIVE,0.999520182609558,"You are basically repeating what I just said: great cloud business, bad retail activity"
1029,2024-05-28 02:36:20,AMZN,NEGATIVE,0.9992764592170716," > still number 1 in online retail as you mentioned  Being number 1 is pointless if it doesn't bring big profits, in fact plenty of businesses forgo market share for profits (eg the iPhone)"
1030,2024-05-28 02:36:20,AMZN,NEGATIVE,0.999014973640442,So many words I know but don’t understand when they are next to each other in a sentence   Bullish
1031,2024-05-28 02:36:20,AMZN,NEGATIVE,0.9991775155067444,"The problem is SpaceX is the only one who can affordably launch their satellites, and they run the largest Kuiper competitor."
1032,2024-05-28 02:36:20,AMZN,NEGATIVE,0.9508809447288512,Have you considered prime air drones and the need for network to operate?  Amazon has always done the long game
1033,2024-05-28 02:36:20,AMZN,NEGATIVE,0.9818388223648072,"I think there's a reasonable chance that once consumers and small businesses experience satellite connectivity demand will grow like PC memory, storage and modems did back in the 1990s"
1034,2024-05-28 02:36:20,AMZN,NEGATIVE,0.996265947818756,  If that's the case the market could be too big and grow too quickly for a winner takes all scenario - being third to market could have some advantages in that case.
1035,2024-05-28 02:36:20,AMZN,NEGATIVE,0.874914824962616,Amazon has been around for over 20 years
1036,2024-05-28 02:36:20,AMZN,NEGATIVE,0.9791589975357056,"If people haven't shifted their buying to Amazon by now, I doubt you'll see much change in behavior anytime soon"
1037,2024-05-28 02:36:20,AMZN,POSITIVE,0.9922199845314026,"Moreover, every retailer now offers online shopping"
1038,2024-05-28 02:36:20,AMZN,NEGATIVE,0.6570436954498291,That's significant competition for Amazon
1039,2024-05-28 02:36:20,AMZN,NEGATIVE,0.9625200629234314,Saying it could easily quadruple in the US is ridiculously optimistic
1040,2024-05-28 02:36:20,AMZN,NEGATIVE,0.9616457223892212," As for the cloud, tons of companies have already shifted to cloud, particularly during the pandemic which supercharged digital transformation efforts"
1041,2024-05-28 02:36:20,AMZN,NEGATIVE,0.9933695793151855,Now many companies are looking to cut cloud spending
1042,2024-05-28 02:36:20,AMZN,NEGATIVE,0.9308664202690125,"Indeed, some are bringing their data back in-house."
1043,2024-05-28 02:36:20,AMZN,POSITIVE,0.8982700705528259,I don't think many people get to the top and stay at the top without being partially or fully a terrible person
1044,2024-05-28 02:36:20,AMZN,NEGATIVE,0.9112860560417176,  Some say these billionaires are actors when they get to a certain level
1045,2024-05-28 02:36:20,AMZN,NEGATIVE,0.9952933192253112,"Let's have a think how the military protects our business supply chains, for example, near the Suez canal"
1046,2024-05-28 02:36:20,AMZN,NEGATIVE,0.998824179172516,No way a private business can afford to secure their supply chains like that on their own back
1047,2024-05-28 02:36:20,AMZN,POSITIVE,0.9975518584251404,"So yes a bit of luck, but when you get to a certain level, your destiny is secured by the defacto world peace keeping forces."
1048,2024-05-28 02:36:20,AMZN,POSITIVE,0.9071107506752014,It can be anything..
1049,2024-05-28 02:36:20,AMZN,NEGATIVE,0.9735759496688844,there's always unknown unknowns
1050,2024-05-28 02:36:20,AMZN,NEGATIVE,0.9073161482810974,There was a time when the railways were unstoppable..
1051,2024-05-28 02:36:20,AMZN,NEGATIVE,0.9458733201026917,"but for the forseeble, Amazon will remain an industrial behemoth"
1052,2024-05-28 02:36:20,AMZN,NEGATIVE,0.9911472201347352,  What isn't talked about is AWS
1053,2024-05-28 02:36:20,AMZN,POSITIVE,0.9732484221458436,"You don't have to shop with amazon, but you may be a customer indirectly"
1054,2024-05-28 02:36:20,AMZN,NEGATIVE,0.5259107351303101, AWS contributed to 17% to Amazon Revenues.
1055,2024-05-28 02:36:20,AMZN,POSITIVE,0.822016179561615,"I agree with you on those points - however the threat I'm discussing isn't about new customers, the threat is existing customers - who are evaluating what to do with their already operating architectures - them moving is the threat, not the startups"
1056,2024-05-28 02:36:20,AMZN,NEGATIVE,0.9996211528778076,"When you’re growing 2 different highly profitable businesses (AWS and Advertising) at around 20% gains annually, there is no real reason to have a next play within the next 5 to 10 years"
1057,2024-05-28 02:36:20,AMZN,NEGATIVE,0.9690768122673036,Especially when cloud computing is just starting and the retail market in international countries is yet to grow significantly (which in turn results in more advertising revenue)
1058,2024-05-28 02:36:20,AMZN,NEGATIVE,0.998744249343872,They are disrupting healthcare and auto industries at the moment.
1059,2024-05-28 02:36:20,AMZN,NEGATIVE,0.9995476603507996,Their revenue may grow slower because it's triple MSFT's
1060,2024-05-28 02:36:20,AMZN,POSITIVE,0.954479157924652,The profit margin is slowly expanding though as AWS and advertising become a larger share of revenue
1061,2024-05-28 02:36:20,AMZN,NEGATIVE,0.9836692214012146,"Never said they would equal the speed and am in no way saying it's a total substitute, especially for name brand products"
1062,2024-05-28 02:36:20,AMZN,NEGATIVE,0.9987187385559082,"However, a ton of what is on Amazon is just generic Chinese imports"
1063,2024-05-28 02:36:20,AMZN,NEGATIVE,0.993398904800415,"Within the next couple years, buying China direct will be about 5 days"
1064,2024-05-28 02:36:20,AMZN,NEGATIVE,0.9883406162261964,"Amazon is currently 1-2 days and getting faster than that is very challenging, though let's assume it all becomes 1 day"
1065,2024-05-28 02:36:20,AMZN,NEGATIVE,0.9975239634513856,"Even still, waiting 5 days just isn't that long if you are saving 60-80%"
1066,2024-05-28 02:36:20,AMZN,NEGATIVE,0.9806370735168456,"Personally, I'm fine with the 7-10 days and never buy the generic products on Amazon anymore"
1067,2024-05-28 02:36:20,AMZN,NEGATIVE,0.9991637468338012,"This also means that I don't buy enough for me to care to buy prime; if I really need something quick (like a car part, which I usually get on Rock Auto anyway), then I can pay for faster shipping one time."
1068,2024-05-28 02:36:20,AMZN,NEGATIVE,0.9154495000839232,It does not matter
1069,2024-05-28 02:36:20,AMZN,NEGATIVE,0.9951481223106384,All they need to do is take some market share
1070,2024-05-28 02:36:20,AMZN,POSITIVE,0.9968693852424622,Those who invested in that vision in 2017 made over 300%
1071,2024-05-28 02:36:20,AMZN,POSITIVE,0.9672849178314208,"30 Billion, with a B"
1072,2024-05-28 02:36:20,AMZN,POSITIVE,0.9803438186645508,"Xiaomi robot vacuums are much better imo, in fact, most of their home tech is top notch."
1073,2024-05-28 02:36:20,AMZN,NEGATIVE,0.998511016368866,Roomba is not top of the chain anymore
1074,2024-05-28 02:36:20,AMZN,NEGATIVE,0.940097987651825,I don’t think shark ever was
1075,2024-05-28 02:36:20,AMZN,NEGATIVE,0.9946879148483276,At least for robo vacs
1076,2024-05-28 02:36:20,AMZN,POSITIVE,0.9993288516998292,Except they are finally increasing margins on their retail And generating meaningful profits from it now
1077,2024-05-28 02:36:20,AMZN,POSITIVE,0.9967215657234192,"Also, being the largest online retailer has other benefits too, like allowing them to become the 3rd largest advertiser in the world"
1078,2024-05-28 02:36:20,AMZN,NEGATIVE,0.971677541732788,Their advertising is extremely high margin and only going to continue to grow that high margin revenue larger
1079,2024-05-28 02:36:20,AMZN,POSITIVE,0.9904542565345764,I also mentioned how they have turned Amazon prime into the second biggest player in the streaming industry
1080,2024-05-28 02:36:20,AMZN,NEGATIVE,0.9997352957725524,  I think you must have missed alot of what I said if you think I just repeated your comment lol.
1081,2024-05-28 02:36:20,AMZN,NEGATIVE,0.9890161156654358,Enter Bezos backed Blue Origin
1082,2024-05-28 02:36:20,AMZN,POSITIVE,0.999470055103302,"Very true, probably lots of internal use cases."
1083,2024-05-28 02:36:20,AMZN,NEGATIVE,0.999636173248291,"They need low-cost rockets for Kuiper to work, and they aren't anywhere close to that."
1084,2024-05-28 02:36:20,AMZN,NEGATIVE,0.999373972415924,What are advantages of satellite over current internet set up?  From what I gathered signal isn’t as stable and strong
1085,2024-05-28 02:36:20,AMZN,NEGATIVE,0.9987443685531616, Weather knocks it out
1086,2024-05-28 02:36:20,AMZN,POSITIVE,0.9781394600868224,"that's not true,the shift to e-commerce is on the making,it's a slow shift,it's generational and the service 20 years ago was nothing compared to today,it will improve even more"
1087,2024-05-28 02:36:20,AMZN,POSITIVE,0.9996227025985718,For sure
1088,2024-05-28 02:36:20,AMZN,NEGATIVE,0.999396800994873,"I tried to make it clear, but he is still terrible"
1089,2024-05-28 02:36:20,AMZN,POSITIVE,0.9978965520858764,"  But he’s actually really smart, and not just some “I’m rich so I do what I want” idiot"
1090,2024-05-28 02:36:20,AMZN,NEGATIVE,0.9518165588378906,"  He actually worked his way up from middle class circumstances, busted his ass running his own business that barely survived, and had the vision to make the right thing at the right time"
1091,2024-05-28 02:36:20,AMZN,NEGATIVE,0.9996459484100342,"  There was a joke I saw recently that if PayPal hadn’t exploded, Musk would probably be running a failed vape shop by now"
1092,2024-05-28 02:36:20,AMZN,NEGATIVE,0.9751408100128174,The only reason he’s successful is people *around him* are successful and he can leech
1093,2024-05-28 02:36:20,AMZN,NEGATIVE,0.9916223883628844,"  I fully believe that if Bezos’ first venture had failed, he would have turned around and found something else that worked."
1094,2024-05-28 02:36:20,AMZN,NEGATIVE,0.9811885952949524,"In my opinion, I don’t see existing companies jumping ship to another competing cloud service like Azure or GCP"
1095,2024-05-28 02:36:20,AMZN,NEGATIVE,0.9987242817878724,"It becomes extremely expensive, very quickly, to move an already entrenched business, to a competitor"
1096,2024-05-28 02:36:20,AMZN,NEGATIVE,0.9931148886680604,Especially ones that are considered inferior to AWS already
1097,2024-05-28 02:36:20,AMZN,NEGATIVE,0.9980785846710204,"Not saying Azure won’t keep growing, which it should, but AWS’s market share is already about 12-15% more than Azure already, and I just don’t see massive companies picking up and moving"
1098,2024-05-28 02:36:20,AMZN,POSITIVE,0.9981964230537416," Again, anything could happen, but AWS is so big already, I just see it continuing to grow."
1099,2024-05-28 02:36:20,AMZN,NEGATIVE,0.9985137581825256,"If you think moving from one cloud to another is easy , you don’t know much about cloud - cloud agnostic is nearly impossible to achieve without downgrading your infrastructure to the lowest common denominator  Source - work in tech for one of the big cloud providers"
1100,2024-05-28 02:36:20,AMZN,NEGATIVE,0.9901731014251708,Cloud computing is just starting? Everyone and their mother has their web stuff on Azure or AWS nowadays.
1101,2024-05-28 02:36:20,AMZN,POSITIVE,0.9997929930686952,Healthcare sounds intriguing
1102,2024-05-28 02:36:20,AMZN,NEGATIVE,0.9994730353355408,"Cars, I don’t see how they can provide better service than manufacturers do."
1103,2024-05-28 02:36:20,AMZN,NEGATIVE,0.9088422060012816,Too big to fail is welfare for slavery inheritances
1104,2024-05-28 02:36:20,AMZN,NEGATIVE,0.9982959628105164, I only invested in GameStop
1105,2024-05-28 02:36:20,AMZN,NEGATIVE,0.9922032356262208,Dam they broke even after inflation
1106,2024-05-28 02:36:20,AMZN,POSITIVE,0.6503836512565613,Ok so Just 20 B more they will be out of the red.
1107,2024-05-28 02:36:20,AMZN,POSITIVE,0.6807774305343628,"BO hasn't even reached orbit yet, much less proven they can affordably manage hundreds of launches."
1108,2024-05-28 02:36:20,AMZN,POSITIVE,0.9277228116989136,They all must launch by 2026 per the federal govt
1109,2024-05-28 02:36:20,AMZN,POSITIVE,0.9974431991577148," They are opening a plant in Everett, Washington to support"
1110,2024-05-28 02:36:20,AMZN,NEGATIVE,0.9987159967422484, Seems it’s “cleared  to go” to be cheesy
1111,2024-05-28 02:36:20,AMZN,POSITIVE,0.9990853071212769,It brings connection to undeveloped nations that lack infrastructure
1112,2024-05-28 02:36:20,AMZN,POSITIVE,0.9267801642417908,I see that as a huge use case to support their streaming media and nearly everything they do really.
1113,2024-05-28 02:36:20,AMZN,NEGATIVE,0.9882045984268188,It’s faster to send the signal up through space than through a fiber on the ground
1114,2024-05-28 02:36:20,AMZN,NEGATIVE,0.987619161605835,Light travels much slower in fiber than through air/space
1115,2024-05-28 02:36:20,AMZN,NEGATIVE,0.9952118396759032,Reddit's hate boner for Musk is insane.
1116,2024-05-28 02:36:20,AMZN,POSITIVE,0.9933157563209534,"I've architected and implemented large systems in both Azure and AWS (and smaller stuff in GCP), and I prefer AWS by a very large margin"
1117,2024-05-28 02:36:20,AMZN,NEGATIVE,0.9986935257911682,I liked GCP a lot but it was obviously less mature when I used it 3-4 years ago
1118,2024-05-28 02:36:20,AMZN,POSITIVE,0.9994198083877563,"  I have plenty of issues with Amazon and AWS, but I still enjoy working with it much more than Azure overall"
1119,2024-05-28 02:36:20,AMZN,NEGATIVE,0.9898234009742736,"Note: am AWS solutions architect, use it with my clients, and hold a pretty small position in AMZN"
1120,2024-05-28 02:36:20,AMZN,NEGATIVE,0.6726719737052917,"I am much more a fan of Google, which speaks even more to me preferring AWS."
1121,2024-05-28 02:36:20,AMZN,POSITIVE,0.9987454414367676,Yes - that would be a huge project
1122,2024-05-28 02:36:20,AMZN,POSITIVE,0.989387035369873,"But it is easier now than ever - and it's not about shifting everything, just carving out bits and pieces and moving to multi cloud."
1123,2024-05-28 02:36:20,AMZN,NEGATIVE,0.9994198083877563,Are we going to pretend an 18 year old industry that is expected to have a 21% CAGR until 2030    is running out of steam?
1124,2024-05-28 02:36:20,AMZN,NEGATIVE,0.9982738494873048,They are selling cars on their retail site disrupting dealerships.
1125,2024-05-28 02:36:20,AMZN,NEGATIVE,0.9842432737350464,Total inflation since 2017 is 20% 🤷‍♂️
1126,2024-05-28 02:36:20,AMZN,NEGATIVE,0.992295265197754,Rofl! They make 30b per year…they keep cheap debt for a reason
1127,2024-05-28 02:36:20,AMZN,NEGATIVE,0.9990768432617188,Maybe Elon will mass fire his propulsion team.
1128,2024-05-28 02:36:20,AMZN,NEGATIVE,0.9990384578704834,So basically all of Africa would have this and stream Prime video?  South America too?  Vs building out landlines?
1129,2024-05-28 02:36:20,AMZN,POSITIVE,0.9316731691360474,That was basically my point as a whole
1130,2024-05-28 02:36:20,AMZN,NEGATIVE,0.907796025276184,"Just speaking with people who work or worked with AWS, they almost ALWAYS prefer it over Azure or GCP"
1131,2024-05-28 02:36:20,AMZN,POSITIVE,0.96016263961792,"I remember someone telling me “it’s not just better, it’s MILES ahead of both and it’s not close” (i’m paraphrasing slightly because it was a while ago, but you obviously get it)"
1132,2024-05-28 02:36:20,AMZN,NEGATIVE,0.999277651309967,"I just have a feeling that as the years go on and AWS continues to get better and grow, I just don’t see any of the competitors “taking over” first place in the cloud game"
1133,2024-05-28 02:36:20,AMZN,NEGATIVE,0.8785063624382019,"Again, it’s always a guess, but it seems more likely that AWS stays as the leader"
1134,2024-05-28 02:36:20,AMZN,NEGATIVE,0.9973904490470886,"Just my opinion (because I don’t own a massive business), but if I did, I personally don’t think i’d move different parts of it to different cloud providers"
1135,2024-05-28 02:36:20,AMZN,POSITIVE,0.9323543310165404,I’d like to keep things housed under one “roof” (cloud)
1136,2024-05-28 02:36:20,AMZN,NEGATIVE,0.9988312125205994,"I don’t see a reason to offload various parts of it to different providers like Azure and GCP, if AWS’s services are pretty much better in every way."
1137,2024-05-28 02:36:20,AMZN,NEGATIVE,0.9993891716003418,How many companies do you know that can fit an AWS bill don’t already have one?
1138,2024-05-28 02:36:20,AMZN,NEGATIVE,0.993798553943634,You are really rolling on the floor laughing about plutocracy?
1139,2024-05-28 02:36:20,AMZN,NEGATIVE,0.9971740245819092,And they don’t make 30b a year
1140,2024-05-28 02:36:20,AMZN,NEGATIVE,0.9990235567092896, 2022 they lost 2 billion
1141,2024-05-28 02:36:20,AMZN,NEGATIVE,0.948296070098877,Trustfunders can do that
