,date,stock,sent,score,comment
238,2024-04-26 01:23:59,MSFT,NEGATIVE,0.991450846195221,https://preview.redd.it/rd88c6orbowc1.png?width=864&format=pjpg&auto=webp&s=1288bc4cb2cf3629d0daa3f135bea485c67c3745
239,2024-04-26 01:23:59,MSFT,NEGATIVE,0.9914146065711976,https://preview.redd.it/bf6hv40klowc1.png?width=1080&format=pjpg&auto=webp&s=8a9ad267dba0e5194a277c104af118b33236445f
240,2024-04-26 01:23:59,MSFT,NEGATIVE,0.6660158634185791,GDP came out this morning.
241,2024-04-26 01:23:59,MSFT,NEGATIVE,0.91585111618042,Yikes
242,2024-04-26 01:23:59,MSFT,POSITIVE,0.9997453093528748,At least you played it well
243,2024-04-26 01:23:59,MSFT,NEGATIVE,0.987902581691742,"If I understand the pic correctly, you avoid the IV crush but if the 400 calls are ITM after earnings and get exercised it will eat a lot of profits"
244,2024-04-26 01:23:59,MSFT,NEGATIVE,0.9847235679626464,On the flipside if it tanks at least you collected some premium
245,2024-04-26 01:23:59,MSFT,NEGATIVE,0.9988941550254822, Maybe you could've gone with selling a bit further OTM calls
246,2024-04-26 01:23:59,MSFT,NEGATIVE,0.9938708543777466,"But that's just my opinion, maybe I'm not seeing something."
247,2024-04-26 01:23:59,MSFT,NEGATIVE,0.9991450309753418,I'm die
248,2024-04-26 01:23:59,MSFT,POSITIVE,0.9998699426651,Thank you for ever.
249,2024-04-26 01:23:59,MSFT,POSITIVE,0.9980607628822328,Today…
250,2024-04-26 01:23:59,MSFT,NEGATIVE,0.9907729625701904,"Yea I made an edit but guess it didn't take, ""without time expiration added in"""
251,2024-04-26 01:23:59,MSFT,NEGATIVE,0.9957771301269532,Isn’t there risk of being exercised on the sold calls?
252,2024-04-26 01:23:59,MSFT,POSITIVE,0.9852918386459352,What u mean it wont?
253,2024-04-26 01:23:59,MSFT,NEGATIVE,0.9962959885597228,Do they make special Chairs to contain your big balls ?
254,2024-04-26 01:23:59,MSFT,POSITIVE,0.9998378753662108,🫡 good luck
255,2024-04-26 01:23:59,MSFT,POSITIVE,0.9964131712913512,I have a regard question for you
256,2024-04-26 01:23:59,MSFT,NEGATIVE,0.9806404113769532,Are you hoping it goes up or down or sideways? What is the best case scenario?
257,2024-04-26 01:23:59,MSFT,NEGATIVE,0.9971405267715454,"not sure who downvoted you, but you basically buy a call at a specific strike price and then sell a call at a higher strike price."
258,2024-04-26 01:23:59,MSFT,NEGATIVE,0.9864130020141602,  this is meant for when you think the stock goes higher
259,2024-04-26 01:23:59,MSFT,NEGATIVE,0.9955565333366394,"this way you do limit your maximum gains by selling a higher call, but you also get the premium and therefore need less capital to enter that position"
260,2024-04-26 01:23:59,MSFT,NEGATIVE,0.9970998764038086,Quick answer is it’s a slight hedge to the downside with a limited cap to the upside.
261,2024-04-26 01:23:59,MSFT,NEGATIVE,0.9893310070037842,https://preview.redd.it/ah97n8xogowc1.png?width=864&format=pjpg&auto=webp&s=d16a0bbd277d9529ec7b783733fc8570a99e72d1
262,2024-04-26 01:23:59,MSFT,NEGATIVE,0.9854333996772766,Me too bro but I can only afford 1 call hehd
263,2024-04-26 01:23:59,MSFT,POSITIVE,0.9863337874412536,"yeah, we knew he was already rich being able to place that trade"
264,2024-04-26 01:23:59,MSFT,POSITIVE,0.998218595981598, NOW he’s rich asf 😉
265,2024-04-26 01:23:59,MSFT,NEGATIVE,0.9793899655342102,Excuse me sir
266,2024-04-26 01:23:59,MSFT,NEGATIVE,0.944152295589447,"Can you tell me the size and brand of that wheelbarrow? Yes, that one your currently using to carry around those giga-nuts."
267,2024-04-26 01:23:59,MSFT,NEGATIVE,0.5955759286880493,What’s your profit sir?
268,2024-04-26 01:23:59,MSFT,NEGATIVE,0.9841138124465942,Never loaded tbh
269,2024-04-26 01:23:59,MSFT,NEGATIVE,0.9902235865592957,Only GOT GOOGL BRRRRR
270,2024-04-26 01:23:59,MSFT,NEGATIVE,0.9961135387420654,"I know it was just a tongue in cheek joke, my TFSA holds dividend paying stock and I sell covered calls on it"
271,2024-04-26 01:23:59,MSFT,POSITIVE,0.9970058798789978,"This shit is wild though, good call though"
272,2024-04-26 01:23:59,MSFT,POSITIVE,0.9996511936187744,Microsoft has a great portfolio of products
273,2024-04-26 01:23:59,MSFT,NEGATIVE,0.9982413053512572,That's a lot of shit eating
274,2024-04-26 01:23:59,MSFT,NEGATIVE,0.9967601895332336,Hey dumb ass how about you get a clue
275,2024-04-26 01:23:59,MSFT,NEGATIVE,0.9909262657165528,"Yea like an altered debit spread, both your long and short calls are ITM rn though congrats"
276,2024-04-26 01:23:59,MSFT,NEGATIVE,0.9981845021247864,You are wrong
277,2024-04-26 01:23:59,MSFT,NEGATIVE,0.9566904306411744,It doesn’t need to increase at all for him to profit
278,2024-04-26 01:23:59,MSFT,NEGATIVE,0.9987903237342834,It can stay flat and his buy to open calls will be worth $20 which he paid $15-$16 ish avg for
279,2024-04-26 01:23:59,MSFT,NEGATIVE,0.9964436888694764,It’s a call spread… the max profit he has on the spread for the 110 bought and 110 sold calls is $20/share (if stock stays at or above $400)
280,2024-04-26 01:23:59,MSFT,NEGATIVE,0.9902631044387816,The additional 90 calls have high profit potential if stock goes up and he has max 100% risk if stock falls below 380
281,2024-04-26 01:23:59,MSFT,NEGATIVE,0.9978559613227844,"All of course by the expiration date, of which you do not need to wait up until in order to exit positions."
282,2024-04-26 01:23:59,MSFT,NEGATIVE,0.9983174800872804,Is it because you are selling only lesser number of contracts than you bought? If the contracts you bought and sold were of equal in amount then the profits you could make would be limited to the difference in the strike prices??? Am i right? Or please correct me if i am wrong here.
283,2024-04-26 01:23:59,MSFT,POSITIVE,0.9994309544563292,"Got itt, Thankssss!!"
284,2024-04-26 01:23:59,MSFT,POSITIVE,0.9974768757820128,Let's go dude
285,2024-04-26 01:23:59,MSFT,NEGATIVE,0.8963041305541992,"I'm curious how this strangle is gonna do overall tmrw morning, exciting times"
286,2024-04-26 01:23:59,MSFT,NEGATIVE,0.9951602816581726,Hoq was the gdp?
287,2024-04-26 01:23:59,MSFT,NEGATIVE,0.9980009198188782,"Again, I should stop doing this but I can't"
288,2024-04-26 01:23:59,MSFT,NEGATIVE,0.9994946718215942,ohh boy I should stop doing this hahah
289,2024-04-26 01:23:59,MSFT,NEGATIVE,0.9992796778678894,If this prints I’ll have plenty of time to roll out or buy to close.
290,2024-04-26 01:23:59,MSFT,NEGATIVE,0.9962956309318542,"I agree, they should have gone further ootm"
291,2024-04-26 01:23:59,MSFT,NEGATIVE,0.9972310662269592,  This is functionally a flat line play? Like best case it increases by 1%? Why not stretch that gap a bit too 3%?
292,2024-04-26 01:23:59,MSFT,NEGATIVE,0.9608725905418396,I sold 425 calls and 370 puts
293,2024-04-26 01:23:59,MSFT,NEGATIVE,0.9526825547218324,I was much more conservative lol
294,2024-04-26 01:23:59,MSFT,NEGATIVE,0.9719558954238892,"my bad, didn't notice you mentioned ""not including time."""
295,2024-04-26 01:23:59,MSFT,NEGATIVE,0.9947422742843628,"no, because the broker will exercise the long calls, resulting in $20\*100 per contract profit"
296,2024-04-26 01:23:59,MSFT,NEGATIVE,0.9826244711875916,this is the whole point of a vertical spread: to cap exposure in exchange for capping gain potential.
297,2024-04-26 01:23:59,MSFT,POSITIVE,0.9992706179618835,"The higher, the better."
298,2024-04-26 01:23:59,MSFT,NEGATIVE,0.9995844960212708,"So basically you can profit more in the given range before it reaches the higher strike than you otherwise couldn’t, because of smaller position size, because you lack the money from selling the higher calls?"
299,2024-04-26 01:23:59,MSFT,NEGATIVE,0.9942968487739564,Actually if MSFT goes above 400 he is net long 90 calls @ 380 with no cap on the upside
300,2024-04-26 01:23:59,MSFT,POSITIVE,0.9998677968978882, Very profitable
301,2024-04-26 01:23:59,MSFT,NEGATIVE,0.9909971952438354," If MSFT closes below 400 but above 380, the 400s expire worthless (keep the premium) and the 380s profit"
302,2024-04-26 01:23:59,MSFT,POSITIVE,0.9990583062171936, But what actually happened is even more profitable
303,2024-04-26 01:23:59,MSFT,POSITIVE,0.9991219639778136,Overall this was a very good trade on a risk/reward basis
304,2024-04-26 01:23:59,MSFT,NEGATIVE,0.9997044205665588, Obv Yolo on the 380s alone would be most profitable but you could have lost everything if MSFT reacted like META
305,2024-04-26 01:23:59,MSFT,NEGATIVE,0.9843944907188416," The premium on the 400s (maybe $110000? would be his to keep, offsetting any losses on the 380s)"
306,2024-04-26 01:23:59,MSFT,NEGATIVE,0.9217217564582824,Why all you regards ITM.
307,2024-04-26 01:23:59,MSFT,POSITIVE,0.9990323781967164,Yeah I’m curious
308,2024-04-26 01:23:59,MSFT,NEGATIVE,0.9946233034133912,Imagine above a certain point your profits on the calls bought are negated by the calls sold
309,2024-04-26 01:23:59,MSFT,NEGATIVE,0.998458743095398,So you’ll collect $10.60 per contract sold and $20 per contract (ish) on the first 110 calls and maybe another $35 on the other 90?  I could be way off though lol
310,2024-04-26 01:23:59,MSFT,NEGATIVE,0.9942291975021362,Either way it paid off for him/her
311,2024-04-26 01:23:59,MSFT,NEGATIVE,0.9848661422729492,"Good for you, my mistake was chickening out and not doing anything lol"
312,2024-04-26 01:23:59,MSFT,NEGATIVE,0.9912251830101012,"I was expecting the short to be ITM, it was also a covered call and not capping my long positions."
313,2024-04-26 01:23:59,MSFT,NEGATIVE,0.99691903591156,So this guy is now set for life? MS at 420 rn
314,2024-04-26 01:23:59,MSFT,POSITIVE,0.6674855947494507,"It is because I bought more calls, but also, I didn’t use my short position against my long"
315,2024-04-26 01:23:59,MSFT,NEGATIVE,0.993813157081604,My long positions are not capped
316,2024-04-26 01:23:59,MSFT,NEGATIVE,0.9930694699287416,"Typically when people open a bull call spread, they’ll sell to open against their long"
317,2024-04-26 01:23:59,MSFT,NEGATIVE,0.9922406673431396,[Read this.](https://www.investopedia.com/terms/b/bullcallspread.asp)
318,2024-04-26 01:23:59,MSFT,NEGATIVE,0.9835622906684875,I sold this for a $19 credit
319,2024-04-26 01:23:59,MSFT,NEGATIVE,0.6480557322502136,"So as long as it does go above 440, should be good"
320,2024-04-26 01:23:59,MSFT,NEGATIVE,0.9969402551651,Did he mean pce?
321,2024-04-26 01:23:59,MSFT,POSITIVE,0.9817294478416444,One win from hitting it big remember that
322,2024-04-26 01:23:59,MSFT,NEGATIVE,0.9993011951446532,"I don't understand why you think the broker will exercise the long calls, he has the option to exercise them so his broker doesn't really have an obligation to do so unless he goes into severe margin call territory"
323,2024-04-26 01:23:59,MSFT,NEGATIVE,0.9966180920600892, If his short calls get assigned he'll have a bunch of shares shorted and if he's got enough margin it will just stay that way.
324,2024-04-26 01:23:59,MSFT,POSITIVE,0.9996302127838136,Thanks for the reply
325,2024-04-26 01:23:59,MSFT,POSITIVE,0.9996510744094848,I wish you the best.
326,2024-04-26 01:23:59,MSFT,POSITIVE,0.9983307719230652,Congrats 🤴
327,2024-04-26 01:23:59,MSFT,POSITIVE,0.9983307719230652,Congrats 🎉
328,2024-04-26 01:23:59,MSFT,POSITIVE,0.9204803705215454,I guess a congrats and Fuck you are in order.
329,2024-04-26 01:23:59,MSFT,NEGATIVE,0.982992708683014,"yes, the short call with a higher strike allows you to cover some of the cost of the long call, and your maximum profit is the width of the spread \*100 - premium paid"
330,2024-04-26 01:23:59,MSFT,NEGATIVE,0.5843269228935242,"Op also bought 90 additional calls, adding extra exposure to the upside."
331,2024-04-26 01:23:59,MSFT,POSITIVE,0.6728792786598206,Premium credited was 10.6
332,2024-04-26 01:23:59,MSFT,POSITIVE,0.9957083463668824,"Honestly idk hehe I bought stocks, this is my first time playing options and this was the top when I clicked trade options in Robinhood, figured might as well try it"
333,2024-04-26 01:23:59,MSFT,POSITIVE,0.9557409286499025,so let's see what happens 🤷‍♂️
334,2024-04-26 01:23:59,MSFT,POSITIVE,0.8507680892944336,Buying an ITM call and selling an OTM call is how the bull call spread works
335,2024-04-26 01:23:59,MSFT,NEGATIVE,0.9878159165382384,Total profit as it stands right now is about $464K
336,2024-04-26 01:23:59,MSFT,POSITIVE,0.9974326491355896,"I’m hoping for at least a 1.5% movement upwards and that should bring me close to $600k, but we’ll see what happens."
337,2024-04-26 01:23:59,MSFT,NEGATIVE,0.8387628197669983,"My short calls are covered, not sold against my longs"
338,2024-04-26 01:23:59,MSFT,NEGATIVE,0.9692886471748352,They aren’t capping the 200 calls.
339,2024-04-26 01:23:59,MSFT,NEGATIVE,0.9985931515693665,I chickened out of MSFT and i dont blame you
340,2024-04-26 01:23:59,MSFT,NEGATIVE,0.9989184141159058,I thought MSFT was gonna drop like META so i stayed out.
341,2024-04-26 01:23:59,MSFT,NEGATIVE,0.9944207072257996,The 110 calls that had the 110 calls sold against them will be worth $20 (remember avg cost of all of the 200 buy to open calls is about $15 when you take into consideration the credit he received from the premiums collected on the sold calls)
342,2024-04-26 01:23:59,MSFT,NEGATIVE,0.9962399005889891,The 90 contracts left don’t have a cap on profit as they didn’t have calls sold against them
343,2024-04-26 01:23:59,MSFT,POSITIVE,0.9800065159797668,They’ll be worth the difference of $380 and the current stock price
344,2024-04-26 01:23:59,MSFT,NEGATIVE,0.98470276594162,So if msft stays at $415 they’re worth $35 + a tad of time value as they don’t expire until 5/10
345,2024-04-26 01:23:59,MSFT,NEGATIVE,0.9961284399032592,"  If Msft is $415 $35 - $15 cost = $20 profit x 9,000 shares = $180,000 $20 - $15 cost = $5 profit x 11,000 shares = $55,000 Which equals $235,000 in gains if Msft is at $415  Roughly, time value not taken into consideration"
346,2024-04-26 01:23:59,MSFT,NEGATIVE,0.9968817234039308,Few more variables that go into this as buying the sold calls back if wanting to close the 110 contract spread out early etc etc
347,2024-04-26 01:23:59,MSFT,POSITIVE,0.9642583727836608,"  If msft continues up, his 90 contracts will continue to add gains"
348,2024-04-26 01:23:59,MSFT,NEGATIVE,0.9995083808898926,His 110 contracts of the call spread will not.
349,2024-04-26 01:23:59,MSFT,NEGATIVE,0.7646890878677368,Will look more on the latter one you have mentioned
350,2024-04-26 01:23:59,MSFT,POSITIVE,0.9979023933410645,Got an idea now
351,2024-04-26 01:23:59,MSFT,NEGATIVE,0.6425117254257202,Thanks for taking the time to explain.🥂 Just a 19 year old finance undergrad looking forward to learn more about the markets.
352,2024-04-26 01:23:59,MSFT,NEGATIVE,0.9990841150283812,:D Should use more leverage next time
353,2024-04-26 01:23:59,MSFT,NEGATIVE,0.8906282186508179,"he dropped 315k on a single trade, dudes already rich."
354,2024-04-26 01:23:59,MSFT,NEGATIVE,0.996887505054474,"So, he’s is out partying ATM?"
355,2024-04-26 01:23:59,MSFT,NEGATIVE,0.961919128894806,Thank you for explaining! I am new to this and still learning before I actually try something myself
356,2024-04-26 01:23:59,MSFT,POSITIVE,0.989459991455078,That seems very advanced and definitely something very different from the degenerate gambling I see here normally 😃
357,2024-04-26 01:23:59,MSFT,POSITIVE,0.9998216032981871,Lmao good luck!!!
358,2024-04-26 01:23:59,MSFT,NEGATIVE,0.9921693205833436,Yea I got some Msft calls after the drop today but sold before close for a small profit so small win? Lol 😭
359,2024-04-26 01:23:59,MSFT,NEGATIVE,0.6252800226211548,"Honestly, only the rich should be allowed to trade..."
360,2024-04-26 01:23:59,MSFT,NEGATIVE,0.9969891905784608,My short call was covered
361,2024-04-26 01:23:59,MSFT,POSITIVE,0.9765095710754396,They’re not against my 200 long.
362,2024-04-26 01:23:59,MSFT,POSITIVE,0.9997119307518004,Take your time and be smart
363,2024-04-26 01:23:59,MSFT,POSITIVE,0.999656081199646,Best to you.
364,2024-04-26 01:23:59,MSFT,NEGATIVE,0.9989758729934692,I mean it really depends if he closes them or not
365,2024-04-26 01:23:59,MSFT,NEGATIVE,0.9883528351783752, He could be insane and see if it goes up more by may 10.
366,2024-04-26 01:23:59,MSFT,POSITIVE,0.993843674659729,Undeniable trading logic
367,2024-04-26 01:23:59,MSFT,POSITIVE,0.990844428539276,Buy the first contract that Robinhood shows you
368,2024-04-26 01:23:59,MSFT,POSITIVE,0.93024343252182, This guy is gonna go far.
369,2024-04-26 01:23:59,MSFT,POSITIVE,0.6083874702453613,did we win? It seems like it's up 5% after hours
370,2024-04-26 01:23:59,MSFT,POSITIVE,0.999846339225769,Win is a win
371,2024-04-26 01:23:59,MSFT,POSITIVE,0.9716666340827942,"https://preview.redd.it/olplbfpabrwc1.jpeg?width=1179&format=pjpg&auto=webp&s=ab86aa053337ae7c7f315ec60389bdf11c77520e  Solid, I’ll be on the gains train with ya"
372,2024-04-26 01:23:59,MSFT,NEGATIVE,0.5477268099784851,For a much smaller amount 😅
373,2024-04-26 01:23:59,MSFT,POSITIVE,0.9921958446502686,"Honestly, I think so."
374,2024-04-26 01:23:59,MSFT,NEGATIVE,0.9767926335334778,"To be completely honest, I've been watching spy and nothing else"
375,2024-04-26 01:23:59,MSFT,NEGATIVE,0.9973852038383484,I had my alarms triggered by spy when it pumped with Google and Microsoft
376,2024-04-26 01:23:59,MSFT,NEGATIVE,0.9985439777374268,Those alarms were set so that I would buy puts when they were hit
377,2024-04-26 01:23:59,MSFT,NEGATIVE,0.9984980821609496,But looking at the chart I don't know if I want to touch calls or puts right now
378,2024-04-26 01:23:59,MSFT,POSITIVE,0.988028049468994,I want to see where the market is going to go and play the breakout next week
379,2024-04-26 01:23:59,MSFT,NEGATIVE,0.9615915417671204,Hell yea man… Keep on keeping on
380,2024-07-25 23:24:14,MSFT,NEGATIVE,0.9841501116752625,**User Report**| | | | :--|:--|:--|:-- **Total Submissions** | 1 | **First Seen In WSB** | 3 years ago **Total Comments** | 1 | **Previous Best DD** |  **Account Age** | 3 years | |   [**Join WSB Discord**](http://discord.gg/wsbverse)
381,2024-07-25 23:24:14,MSFT,NEGATIVE,0.995344579219818,Microsoft is highly exposed to AI
382,2024-07-25 23:24:14,MSFT,NEGATIVE,0.9991928935050964,The AI bubble may be starting to deflate
383,2024-07-25 23:24:14,MSFT,NEGATIVE,0.5316827297210693, Position: 1150 shares MSFT
384,2024-07-25 23:24:14,MSFT,POSITIVE,0.9971000552177428,Who knows nowadays
385,2024-07-25 23:24:14,MSFT,NEGATIVE,0.9983565211296082,Either way we are fucked
386,2024-07-25 23:24:14,MSFT,NEGATIVE,0.955286979675293,"It’s been beaten down a lot, good entry point"
387,2024-07-25 23:24:14,MSFT,NEGATIVE,0.9995761513710022,MSFT was already beaten down even before the CRWD thing happened
388,2024-07-25 23:24:14,MSFT,POSITIVE,0.9988777041435242,"I've had a couple shares for years  with a cost basis of $247, MSFT is a slow but consistent long term grower"
389,2024-07-25 23:24:14,MSFT,NEGATIVE,0.9893910884857178,"Sure it'll dip with the market but overall, MSFT will go up for years to come unless there is an overarching economic issue."
390,2024-07-25 23:24:14,MSFT,POSITIVE,0.9980862140655518,"Long term, yes"
391,2024-07-25 23:24:14,MSFT,POSITIVE,0.9943498969078064,"The entire world economy runs on Windows, Outlook and Excel"
392,2024-07-25 23:24:14,MSFT,POSITIVE,0.998927891254425,Everything
393,2024-07-25 23:24:14,MSFT,POSITIVE,0.8350971937179565,I've never seen an organization not using MS products
394,2024-07-25 23:24:14,MSFT,NEGATIVE,0.9990911483764648,And I don't even live in the US
395,2024-07-25 23:24:14,MSFT,POSITIVE,0.9994447827339172,It's global
396,2024-07-25 23:24:14,MSFT,NEGATIVE,0.8046755194664001,I'm not sure about AI but Windows+Office are a world dominating killer
397,2024-07-25 23:24:14,MSFT,NEGATIVE,0.7857677936553955,Don’t bet against Bill
398,2024-07-25 23:24:14,MSFT,NEGATIVE,0.987186312675476,MSFT will pay long with shares
399,2024-07-25 23:24:14,MSFT,NEGATIVE,0.9898967742919922,Lumn buy
400,2024-07-25 23:24:14,MSFT,NEGATIVE,0.5852373838424683,Google is the better play
401,2024-07-25 23:24:14,MSFT,NEGATIVE,0.9771105051040648,Buy it on more weakness.
402,2024-07-25 23:24:14,MSFT,NEGATIVE,0.9986685514450072,If it wasn't Ai I would be shorting the f out of it
403,2024-07-25 23:24:14,MSFT,NEGATIVE,0.9995844960212708,Their acquisitions suck and didn't materialize into anything
404,2024-07-25 23:24:14,MSFT,NEGATIVE,0.9989655017852784,The only good thing going for them is their brand name Windows and now Openai
405,2024-07-25 23:24:14,MSFT,NEGATIVE,0.9985297918319702,"Overpaying for a trash company like blizzard that was on its way out of gaming, then the geniuses who work there thought a game like baldurs gate 3 was a 1 million dollar game while suicide squad was a 250 mil"
406,2024-07-25 23:24:14,MSFT,NEGATIVE,0.9898245930671692,They have clowns working in their gaming department.
407,2024-07-25 23:24:14,MSFT,NEGATIVE,0.9990726709365844,The main opinion behind AI bubble is that there are many companies which invests in them and most likely will not be getting returns for their investments
408,2024-07-25 23:24:14,MSFT,NEGATIVE,0.9987918734550476,"MSFT is huge, they are already killing it with Copilot among different platforms"
409,2024-07-25 23:24:14,MSFT,POSITIVE,0.9995390176773072,"For the first time ever, Bing has some spotlight"
410,2024-07-25 23:24:14,MSFT,NEGATIVE,0.9995710253715516,"Position: 4 shares MSFT ( it is my biggest single stock investment, I am just poor)"
411,2024-07-25 23:24:14,MSFT,NEGATIVE,0.996266782283783,Hot damn I didn't expect this drop from June ath ![img](emote|t5_2th52|4260)![img](emote|t5_2th52|4260)![img](emote|t5_2th52|4260)![img](emote|t5_2th52|52627)![img](emote|t5_2th52|52627)
412,2024-07-25 23:24:14,MSFT,NEGATIVE,0.9959871172904968,You Sir know nothing about $MSFT
413,2024-07-25 23:24:14,MSFT,NEGATIVE,0.999421000480652,It's clearly not
414,2024-07-25 23:24:14,MSFT,NEGATIVE,0.9990708827972412,Their ad revenue guidance on youtube showed there's weakness
415,2024-07-25 23:24:14,MSFT,NEGATIVE,0.9925352334976196,if msft managed to nail earnings (which they will) and guidance (that's a maybe) then MSFT will be the better play despite the PE.
416,2024-07-25 23:24:14,MSFT,NEGATIVE,0.9682615995407104,The Azure cloud business is all the rage in the Fed / DoD space
417,2024-07-25 23:24:14,MSFT,NEGATIVE,0.9623235464096068,They have been eating AWS and GCP ice cream for years now
418,2024-07-25 23:24:14,MSFT,POSITIVE,0.6547215580940247,"So, they acquired Activision/blizzard and zenimax(bethesda).."
419,2024-07-25 23:24:14,MSFT,POSITIVE,0.9789092540740968,i wonder if this trend continues
420,2024-07-25 23:24:14,MSFT,NEGATIVE,0.9996097683906556,Sony doesn't seem to be interested into buying other game studios
421,2024-07-25 23:24:14,MSFT,NEGATIVE,0.9948306679725648,Microsoft might win the console wars slowly and steadily due to exlusivitiy alone
422,2024-07-25 23:24:14,MSFT,NEGATIVE,0.9976460337638856,imagine 2040 and the only consoles left will be nintendo and microsoft
423,2024-07-25 23:24:14,MSFT,POSITIVE,0.9599751830101012," \*Some notable franchises now owned by Microsoft include Halo, Forza, Minecraft, The Elder Scrolls, Fallout, Doom, Call of Duty, World of Warcraft, and Candy Crush"
424,2024-07-25 23:24:14,MSFT,POSITIVE,0.9964686632156372,"because jelhmb48 overlooked that the entire world does not only run on windows, outlook and excel, but also on AZURE, which is gigantic, ever growing an second place after Amazon's AWS"
425,2024-07-25 23:24:14,MSFT,NEGATIVE,0.9987592697143556,"Amazon by the way, as you noticed is declining"
426,2024-07-25 23:24:14,MSFT,NEGATIVE,0.9991312623023988,Guess what that means for MSFT.
427,2024-07-25 23:24:14,MSFT,POSITIVE,0.9670128226280212,"Actually, i just read up on it"
428,2024-07-25 23:24:14,MSFT,NEGATIVE,0.994902491569519,sony an nintendo are paying licencing fees to microsoft to get call of duty onto their consoles.
429,2024-07-25 23:24:14,MSFT,POSITIVE,0.9998794794082642,"As an investor, I love that!"
430,2024-07-13 09:24:53,MSFT,NEGATIVE,0.9832286834716796,**User Report**| | | | :--|:--|:--|:-- **Total Submissions** | 1 | **First Seen In WSB** | 10 months ago **Total Comments** | 26 | **Previous Best DD** |  **Account Age** | 6 years | |   [**Join WSB Discord**](http://discord.gg/wsbverse)
431,2024-07-13 09:24:53,MSFT,POSITIVE,0.6911110877990723,Is that really a YOLO? Those numbers are almost guaranteed to be profitable
432,2024-07-13 09:24:53,MSFT,NEGATIVE,0.9940348267555236,Only a question of how much profit you consider to be good enough.
433,2024-07-13 09:24:53,MSFT,POSITIVE,0.999778687953949,Im with you 
434,2024-07-13 09:24:53,MSFT,NEGATIVE,0.999535083770752,I instantly regretted it 
435,2024-07-13 09:24:53,MSFT,POSITIVE,0.9855263233184814,YOLO
436,2024-07-13 09:24:53,MSFT,NEGATIVE,0.9923668503761292,https://preview.redd.it/ov802sv4vccd1.jpeg?width=1170&format=pjpg&auto=webp&s=eb66a38e01b5fabba47096496f0d7c7b0bc8c631  Rooting for you ![img](emote|t5_2th52|4258)
437,2024-07-13 09:24:53,MSFT,POSITIVE,0.9985761642456056,This will print
438,2024-07-13 09:24:53,MSFT,NEGATIVE,0.9930976033210754, MSFT isn't a 0dte play
439,2024-07-13 09:24:53,MSFT,NEGATIVE,0.9989068508148192,  It has little to no hype like an Nvidia or Tesla so long term calls are the play
440,2024-07-13 09:24:53,MSFT,POSITIVE,0.5557945966720581,"  It just goes up, slowly."
441,2024-07-13 09:24:53,MSFT,NEGATIVE,0.9724941253662108,How much do you think I can make?
442,2024-07-13 09:24:53,MSFT,POSITIVE,0.9150240421295166,I think ER will be good and the contract can go up to 23.
443,2024-07-13 09:24:53,MSFT,NEGATIVE,0.991329550743103,"I am a little stoned, is this reflecting you have 941 shares of MSFT?  Rooting for you too, friend, let's get moderately rich! ![img](emote|t5_2th52|4276)![img](emote|t5_2th52|8882)![img](emote|t5_2th52|4271)"
