,date,stock,sent,score,comment
0,2024-06-24 05:14:34,AMZN,NEGATIVE,0.9884316921234132,**User Report**| | | | :--|:--|:--|:-- **Total Submissions** | 1 | **First Seen In WSB** | just now **Total Comments** | 0 | **Previous Best DD** |  **Account Age** | 7 months | |   [**Join WSB Discord**](http://discord.gg/wsbverse)
1,2024-06-24 05:14:34,AMZN,POSITIVE,0.5852753520011902,Thesis: it’s undervalued   Evidence : trust me bro
2,2024-06-24 05:14:34,AMZN,NEGATIVE,0.9945312142372132,Amazon's paid Alexa subscription will basically be some guy in India who's remotely listening to you and answering your questions
3,2024-06-24 05:14:34,AMZN,POSITIVE,0.9969379901885986,AI = Always Indian
4,2024-06-24 05:14:34,AMZN,NEGATIVE,0.7646819353103638,I’ve held AMZN for a long time
5,2024-06-24 05:14:34,AMZN,POSITIVE,0.9979434609413148,I have 1000+ shares
6,2024-06-24 05:14:34,AMZN,NEGATIVE,0.9238331317901612,Because of this I see its price action every day
7,2024-06-24 05:14:34,AMZN,NEGATIVE,0.9996511936187744,"Without a massive catalyst, I can confidently say AMZN will likely not hit $230 by mid October"
8,2024-06-24 05:14:34,AMZN,NEGATIVE,0.9734915494918824,"This stock moves slow as molasses, but steadily"
9,2024-06-24 05:14:34,AMZN,NEGATIVE,0.9765443801879884,It’s a slow melt up.
10,2024-06-24 05:14:34,AMZN,NEGATIVE,0.9986830353736876,TLDR: it’ll negatively affect Amazon stock eventually but not near term because the drivers aren’t unionizing only the warehouse workers who are paid much much less
11,2024-06-24 05:14:34,AMZN,NEGATIVE,0.9894835352897644,  Unionized UPS big rig driver here
12,2024-06-24 05:14:34,AMZN,POSITIVE,0.9997193217277528,"The Teamsters, who are unionizing amazons warehouses, is a strong union"
13,2024-06-24 05:14:34,AMZN,NEGATIVE,0.5540818572044373,"UPS drivers make $120,000-$200,000 with no college required, excellent pension and full medical benefits…"
14,2024-06-24 05:14:34,AMZN,NEGATIVE,0.9980894923210144," Point I’m trying to make is, the teamsters are unionizing the warehouse workers not the drivers"
15,2024-06-24 05:14:34,AMZN,NEGATIVE,0.9978896975517272,Amazon drivers are third party contractors
16,2024-06-24 05:14:34,AMZN,NEGATIVE,0.9985777139663696,"For example if you get hit and killed by an Amazon sprinter van or package car your family  won’t sue Amazon itself, you’d sue the third party contractor who was in charge of that driver"
17,2024-06-24 05:14:34,AMZN,POSITIVE,0.6907113790512085,"  Because there’s a disconnect between Amazon drivers and the division the teamsters are unionizing, I don’t believe the unionization push will be as damaging as some people think UNTIL this push includes drivers particularly the Class A (big rig) drivers"
18,2024-06-24 05:14:34,AMZN,NEGATIVE,0.99910968542099," By the time Amazon loses the battle to the IBT and has all its warehouse shops unionized, AI and its AWS services will far outstrip / outpace the damage done from unions"
19,2024-06-24 05:14:34,AMZN,NEGATIVE,0.9875006675720216, There’s also different tiers of union - for example at UPS we get paid $45 an hour but often get overtime roughly 67 an hour
20,2024-06-24 05:14:34,AMZN,POSITIVE,0.9981698989868164,We pay very very little for full medical for our entire family and the medical insurance is insanely good
21,2024-06-24 05:14:34,AMZN,NEGATIVE,0.982065737247467,Copays are $0 or $5 for almost everything
22,2024-06-24 05:14:34,AMZN,NEGATIVE,0.9664958715438844,"  Pension? Work 10 years as a driver and get $3,000 a month"
23,2024-06-24 05:14:34,AMZN,NEGATIVE,0.9964160919189452,"Work 30 years (average for a UPS driver) you’re looking at $9,000 a month until you die"
24,2024-06-24 05:14:34,AMZN,POSITIVE,0.9952087998390198,(In addition to 401K / Social Security etc.)  McKesson is also part of our union right down the street from us
25,2024-06-24 05:14:34,AMZN,NEGATIVE,0.9997405409812928,When I used to deliver there as a package car driver they’d tell me how their medical and pension was garbage
26,2024-06-24 05:14:34,AMZN,POSITIVE,0.9854073524475098,"  So furthermore, just because the union and UPS has negotiated good benefits and pay it doesn’t mean doom and gloom for Amazon stockholders - there is a different caliber to which a company will be unionized"
27,2024-06-24 05:14:34,AMZN,NEGATIVE,0.9983162879943848," Even as a member of the union that’s attempting to bring Amazon into the fold, I am very bullish on Amazon."
28,2024-06-24 05:14:34,AMZN,POSITIVE,0.9804625511169434,"$230 by october, someone is a little optimistic"
29,2024-06-24 05:14:34,AMZN,NEGATIVE,0.9983794689178468,I think this year Amazon stock/calls price is pretty overvalued atm
30,2024-06-24 05:14:34,AMZN,NEGATIVE,0.9938521385192872, My guess is they will not crush any labor unions and have weak revenue growth this year
31,2024-06-24 05:14:34,AMZN,NEGATIVE,0.930671751499176, My play is buying $130 puts exp 10/15 trading at $6.9 when market opens tomorrow   These are my thoughts.
32,2024-06-24 05:14:34,AMZN,NEGATIVE,0.91961270570755,Well I have $190 calls for August and September so I fucking agree.
33,2024-06-24 05:14:34,AMZN,POSITIVE,0.9998552799224854,Nice
34,2024-06-24 05:14:34,AMZN,NEGATIVE,0.9959989786148072,Another way to play is 2x’s Amazon stock so if if you don’t wanna gamble with options
35,2024-06-24 05:14:34,AMZN,NEGATIVE,0.9729686975479126,AMZU.
36,2024-06-24 05:14:34,AMZN,NEGATIVE,0.9992691874504088,[deleted]
37,2024-06-24 05:14:34,AMZN,POSITIVE,0.8641112446784973,I’m betting against you
38,2024-06-24 05:14:34,AMZN,NEGATIVE,0.756736159324646,Prediction by end of 2026:  1
39,2024-06-24 05:14:34,AMZN,NEGATIVE,0.8505735993385315,NVDA 2
40,2024-06-24 05:14:34,AMZN,NEGATIVE,0.7815051078796387,MSFT 3
41,2024-06-24 05:14:34,AMZN,NEGATIVE,0.8415190577507019,AMZN 4
42,2024-06-24 05:14:34,AMZN,POSITIVE,0.9672130942344666,AAPL 5
43,2024-06-24 05:14:34,AMZN,NEGATIVE,0.995466947555542,GOOG 6
44,2024-06-24 05:14:34,AMZN,POSITIVE,0.9824376702308656,META 7
45,2024-06-24 05:14:34,AMZN,POSITIVE,0.913240373134613,LLY  The new mag7
46,2024-06-24 05:14:34,AMZN,NEGATIVE,0.9940106272697448,![img](emote|t5_2th52|4258)
47,2024-06-24 05:14:34,AMZN,POSITIVE,0.9998051524162292,I like this play
48,2024-06-24 05:14:34,AMZN,NEGATIVE,0.9987022876739502,Last week I was looking at AMZN chart and entered some shorter term options.
49,2024-06-24 05:14:34,AMZN,NEGATIVE,0.992746889591217,I hope not
50,2024-06-24 05:14:34,AMZN,NEGATIVE,0.998386025428772,I got some 7/5 190/195 call credit spreads thst I need to make some money on.
51,2024-06-24 05:14:34,AMZN,POSITIVE,0.9965516328811646,"Bruh, Amazon is at an all time high."
52,2024-06-24 05:14:34,AMZN,NEGATIVE,0.9967502355575562,Wanted to ask (don't chew me up) what are your thoughts about Amazon getting into the car market? And will it have any affect of their share price during their Hyundai event on 6/25?
53,2024-06-24 05:14:34,AMZN,POSITIVE,0.9397005438804626,I also think it’s fair to undervalued
54,2024-06-24 05:14:34,AMZN,POSITIVE,0.9532657265663148,I hold shares and plan to buy some LEAPS
55,2024-06-24 05:14:34,AMZN,POSITIVE,0.998799443244934,But I like this play and may well join you (contracts are less capital intensive than I expected.)
56,2024-06-24 05:14:34,AMZN,NEGATIVE,0.9166918992996216,Price target $211
57,2024-06-24 05:14:34,AMZN,NEGATIVE,0.9996445178985596,No one cares about the retail part of Amazon
58,2024-06-24 05:14:34,AMZN,POSITIVE,0.9945586323738098,It's all about how they can monetize AI
59,2024-06-24 05:14:34,AMZN,NEGATIVE,0.7379119396209717,"agree, but not buying options"
60,2024-06-24 05:14:34,AMZN,NEGATIVE,0.8037943243980408,just buying stock
61,2024-06-24 05:14:34,AMZN,NEGATIVE,0.9965820908546448,"amazon crushed the q1 estimate, which was already described as many analysts as ""ambitious"""
62,2024-06-24 05:14:34,AMZN,POSITIVE,0.711126446723938,I don't see them slowing down
63,2024-06-24 05:14:34,AMZN,POSITIVE,0.9858189821243286,Don’t forget Amazon is also in the chip business
64,2024-06-24 05:14:34,AMZN,POSITIVE,0.7709497213363647,"I made 100% on amazon calls this week, amazon is still undervalued, not intrinsically but relatively"
65,2024-06-24 05:14:34,AMZN,NEGATIVE,0.9857999086380004,“I think”  “My guess”  All the DD I need.
66,2024-06-24 05:14:34,AMZN,NEGATIVE,0.9875587224960328,You guess
67,2024-06-24 05:14:34,AMZN,POSITIVE,0.9998076558113098,Nice man
68,2024-06-24 05:14:34,AMZN,NEGATIVE,0.9929896593093872,I’m a very picky consumer but when I need stuff I shop Amazon
69,2024-06-24 05:14:34,AMZN,POSITIVE,0.9529850482940674,Shaq once said to invest in what you consume.
70,2024-06-24 05:14:34,AMZN,POSITIVE,0.9994768500328064,"Since I work here, I'm hoping you're right."
71,2024-06-24 05:14:34,AMZN,NEGATIVE,0.984128475189209,"I think amzn has a bit more downside to come especially since I predict there will be a soft market crash this week, but yes, it is undervalued and if it hits 180 again it's a go"
72,2024-06-24 05:14:34,AMZN,NEGATIVE,0.9980003237724304,Crush labor union why the fuck are you hoping for that..
73,2024-06-24 05:14:34,AMZN,POSITIVE,0.9836214780807496,"Well, it's about time"
74,2024-06-24 05:14:34,AMZN,NEGATIVE,0.6970565319061279,🎉
75,2024-06-24 05:14:34,AMZN,NEGATIVE,0.9965341091156006,I don't know man
76,2024-06-24 05:14:34,AMZN,NEGATIVE,0.9983892440795898,"Their primary business doesn't have a ton of moat, and AliExpress just started shipping from US distribution centers"
77,2024-06-24 05:14:34,AMZN,NEGATIVE,0.99536395072937,I can see consumer money flowing away from Amazon.
78,2024-06-24 05:14:34,AMZN,POSITIVE,0.9994068145751952,I am in agreement
79,2024-06-24 05:14:34,AMZN,NEGATIVE,0.99947589635849,"I feel that amazon is probably heading for a new ATH within the next month, unless the bottom of the market falls out."
80,2024-06-24 05:14:34,AMZN,NEGATIVE,0.7353652119636536,The AI chat in Amazon app could be a plus
81,2024-06-24 05:14:34,AMZN,NEGATIVE,0.9993883371353148,The problem is the consumer is getting weak and so to will the earnings for amazon to reflect that
82,2024-06-24 05:14:34,AMZN,NEGATIVE,0.9964597821235656,This is my sign for putts on AMZN
83,2024-06-24 05:14:34,AMZN,NEGATIVE,0.9926597476005554,"Ehh, nah"
84,2024-06-24 05:14:34,AMZN,POSITIVE,0.999360740184784,I’m already long a handsome amount of Amazon and I keep adding to the position into strength
85,2024-06-24 05:14:34,AMZN,POSITIVE,0.8691136837005615,I think it’ll really start to pick up momentum around the second or third week of July and keep moving to the upside
86,2024-06-24 05:14:34,AMZN,POSITIVE,0.99947589635849,Everything lines up for a multi year breakout
87,2024-06-24 05:14:34,AMZN,NEGATIVE,0.9893028140068054,Jeff sold 4 bil in stock
88,2024-06-24 05:14:34,AMZN,NEGATIVE,0.9991300702095032,Am just going for amazon commons and then selling calls for my target
89,2024-06-24 05:14:34,AMZN,POSITIVE,0.9994044303894044, I am thinking as zoox progress now it will go high.
90,2024-06-24 05:14:34,AMZN,POSITIVE,0.9760082960128784,Calls above 191
91,2024-06-24 05:14:34,AMZN,NEGATIVE,0.9997159838676452,they will crush their own workforce = bullish business case ![img](emote|t5_2th52|4267)![img](emote|t5_2th52|4267)  we are all so fucked ![img](emote|t5_2th52|4271)![img](emote|t5_2th52|4271)![img](emote|t5_2th52|4271)
92,2024-06-24 05:14:34,AMZN,NEGATIVE,0.9991808533668518,Unions don’t really matter
93,2024-06-24 05:14:34,AMZN,NEGATIVE,0.991270899772644,They make all their money from AWS anyway
94,2024-06-24 05:14:34,AMZN,POSITIVE,0.7579728960990906,"The little online store is a hobby side business, like your aunt selling candles at festivals."
95,2024-06-24 05:14:34,AMZN,POSITIVE,0.8591694831848145,I’m an Amazon investor myself
96,2024-06-24 05:14:34,AMZN,POSITIVE,0.999674916267395,Bought right after the stock split and I’ve had pretty slow but decent gains
97,2024-06-24 05:14:34,AMZN,NEGATIVE,0.9964091181755066,Might sell around 200$ a share    I’m concerned for the future of Amazon’s website
98,2024-06-24 05:14:34,AMZN,NEGATIVE,0.9990524649620056,I think it can easily be replaced down the road with a bigger platform   If Amazon could somehow come up with a quicker and more efficient way to ship packages like a Amazon bullet train or some shit lmao I don’t know    I think the company is kind of overvalued
99,2024-06-24 05:14:34,AMZN,NEGATIVE,0.9956015348434448,It’s just a website that offers people to leave reviews on a product kind of like a form of social media
100,2024-06-24 05:14:34,AMZN,NEGATIVE,0.9979934692382812,"Amazon fulfillment, a shitty Alexa and just a big shipping carrier    It’s a safe stock and investment long term and that’s why I’m personally invested   If I wanted a riskier speculative investment short term with AI development similar to Amazon"
101,2024-06-24 05:14:34,AMZN,NEGATIVE,0.9902445077896118,I’d buy a shit ton of Pinterest shares
102,2024-06-24 05:14:34,AMZN,NEGATIVE,0.9980620741844176,"Banbet it, or ban"
103,2024-06-24 05:14:34,AMZN,NEGATIVE,0.9996888637542723,Idk about AWS but their retail side is dead this year
104,2024-06-24 05:14:34,AMZN,NEGATIVE,0.9993835687637328,WAY down
105,2024-06-24 05:14:34,AMZN,NEGATIVE,0.9956108927726746,No one has cared YET
106,2024-06-24 05:14:34,AMZN,POSITIVE,0.998949944972992,But eventually they will.
107,2024-06-24 05:14:34,AMZN,POSITIVE,0.998784601688385,What an in depth analysis
108,2024-06-24 05:14:34,AMZN,NEGATIVE,0.9234207272529602,"After the Bed Bath & Beyond debacle, puts it is then."
109,2024-06-24 05:14:34,AMZN,POSITIVE,0.9996035695075988,Yes buy the top
110,2024-06-24 05:14:34,AMZN,POSITIVE,0.9992903470993042,Source: Trust me bro
111,2024-06-24 05:14:34,AMZN,NEGATIVE,0.7838473320007324,"Joined you, but November and near TM."
112,2024-06-24 05:14:34,AMZN,NEGATIVE,0.9905173182487488,Way undervalued
113,2024-06-24 05:14:34,AMZN,NEGATIVE,0.9988956451416016,Where is the AI boost?
114,2024-06-24 05:14:34,AMZN,NEGATIVE,0.9982193112373352,AMZN was stagnating around 182-184 price for over a month now...
115,2024-06-24 05:14:34,AMZN,NEGATIVE,0.9990027546882628,"Strangle it is bois, nothing gonna happenz"
116,2024-06-24 05:14:34,AMZN,NEGATIVE,0.9969760179519652,AMZN is $2 away from ATH so that means it's undervalued
117,2024-06-24 05:14:34,AMZN,POSITIVE,0.9929543137550354,Buying puts now
118,2024-06-24 05:14:34,AMZN,POSITIVE,0.5395329594612122,Thx
119,2024-06-24 05:14:34,AMZN,POSITIVE,0.9962581396102904,"""My guess is they will crush any labor unions"" made me laugh..."
120,2024-06-24 05:14:34,AMZN,NEGATIVE,0.9932720065116882,ugh the pitfalls of capitalism...
121,2024-06-24 05:14:34,AMZN,POSITIVE,0.9281455278396606,Mmm maybe …
122,2024-06-24 05:14:34,AMZN,NEGATIVE,0.9997807145118712,It doesn’t really move that much.
123,2024-06-24 05:14:34,AMZN,POSITIVE,0.9991732239723206,Thanks for helping me plan my next trade strategy
124,2024-06-24 05:14:34,AMZN,NEGATIVE,0.9733881950378418,Sell AMZN.
125,2024-06-24 05:14:34,AMZN,NEGATIVE,0.997936487197876,So I guess I should get puts then
126,2024-06-24 05:14:34,AMZN,POSITIVE,0.9994376301765442,High quality DD
127,2024-06-24 05:14:34,AMZN,POSITIVE,0.997093677520752,I'm going all in.
128,2024-06-24 05:14:34,AMZN,NEGATIVE,0.9957809448242188,Load up!!!
129,2024-06-24 05:14:34,AMZN,NEGATIVE,0.9840743541717528,"The thesis is always with ""my guess"", ""I think"", ""I reckon"", ""I feel""."
130,2024-06-24 05:14:34,AMZN,NEGATIVE,0.9992306232452391,without an actual DD
131,2024-06-24 05:14:34,AMZN,NEGATIVE,0.9739171266555786,NVDA is the undervalued stock actually
132,2024-06-24 05:14:34,AMZN,POSITIVE,0.9995855689048768,trust me!!!
133,2024-06-24 05:14:34,AMZN,NEGATIVE,0.9859274625778198,Secret sauce is out
134,2024-06-24 05:14:34,AMZN,NEGATIVE,0.95076584815979, Amzn puts
135,2024-06-24 05:14:34,AMZN,NEGATIVE,0.998071789741516,I thought it was AI = Anonymous Indian.
136,2024-06-24 05:14:34,AMZN,NEGATIVE,0.9954903721809388,Let me write those calls up op
137,2024-06-24 05:14:34,AMZN,NEGATIVE,0.9956542253494264,Price of pizzas went up so AMZN can no longer afford 2 pizza teams
138,2024-06-24 05:14:34,AMZN,NEGATIVE,0.975083589553833,"Thankfully, one cheese pizza goes far in India."
139,2024-06-24 05:14:34,AMZN,POSITIVE,0.9468868374824524,"Affordable Indians you mean, way better margins."
140,2024-06-24 05:14:34,AMZN,NEGATIVE,0.6970565319061279,😂😂😂
141,2024-06-24 05:14:34,AMZN,NEGATIVE,0.6970565319061279,😭😭😭😭😭
142,2024-06-24 05:14:34,AMZN,NEGATIVE,0.6970565319061279,🤣🤣🤣🤣🤣
143,2024-06-24 05:14:34,AMZN,POSITIVE,0.7200352549552917,It’ll probably be from Canada since Canada is now the India of the west.
144,2024-06-24 05:14:34,AMZN,NEGATIVE,0.9950401186943054,![img](emote|t5_2th52|27189)
145,2024-06-24 05:14:34,AMZN,NEGATIVE,0.8060681223869324,"I’ve been telling people this for months, it might and that’s a strong might, break $200/share this year"
146,2024-06-24 05:14:34,AMZN,NEGATIVE,0.9978883862495422,The investor trust just isn’t back yet after 2022/2023 debacle.
147,2024-06-24 05:14:34,AMZN,NEGATIVE,0.6891731023788452,Just want to clarify something
148,2024-06-24 05:14:34,AMZN,NEGATIVE,0.9975212216377258,You will sue amazon and the service provider both if something happens
149,2024-06-24 05:14:34,AMZN,NEGATIVE,0.9906921982765198,"Even though the truck is operated by a third party, amazon will still take some part of the liability."
150,2024-06-24 05:14:34,AMZN,POSITIVE,0.9942471981048584,And you guys still manage to break my package every single fucking time
151,2024-06-24 05:14:34,AMZN,NEGATIVE,0.9914608001708984,"9K/month pension?  Thats seems rather high, and this is coming from someone who is part of a Union and will also get a pension and medical insurance for life when I retire."
152,2024-06-24 05:14:34,AMZN,NEGATIVE,0.9929392337799072,"And by the time big rig drivers push for unions, self driving trucks will be taking market share and driving down demand"
153,2024-06-24 05:14:34,AMZN,NEGATIVE,0.9968234300613404,Holy shit
154,2024-06-24 05:14:34,AMZN,POSITIVE,0.9959791898727416,It's Chad Dickens
155,2024-06-24 05:14:34,AMZN,NEGATIVE,0.5409507751464844," *I am a bot, and this action was performed automatically"
156,2024-06-24 05:14:34,AMZN,NEGATIVE,0.9943631887435912,Please [contact the moderators of this subreddit](/message/compose/?to=/r/wallstreetbets) if you have any questions or concerns.*
157,2024-06-24 05:14:34,AMZN,NEGATIVE,0.9951454997062684,"Teamsters aint shit, Costco union Teamsters 542 is full of pussies who wouldnt stand up for me while I was obviously being retaliated against"
158,2024-06-24 05:14:34,AMZN,POSITIVE,0.9550816416740416,I hope the anti-union people on here read this and think..
159,2024-06-24 05:14:34,AMZN,NEGATIVE,0.9782684445381165,hang on..
160,2024-06-24 05:14:34,AMZN,POSITIVE,0.9998371601104736,I'd like that.
161,2024-06-24 05:14:34,AMZN,NEGATIVE,0.988933801651001,"Exactly, I (as an investor) don't give a shit about unionisation"
162,2024-06-24 05:14:34,AMZN,NEGATIVE,0.9934625625610352,AWS is where Amazon makes money.
163,2024-06-24 05:14:34,AMZN,NEGATIVE,0.9991689920425416,Man how the fuck do they pay those pensions
164,2024-06-24 05:14:34,AMZN,NEGATIVE,0.999357283115387,"Insanity, what shareholder in their right mind would invest in that"
165,2024-06-24 05:14:34,AMZN,NEGATIVE,0.9798659682273864,Teamsters such a great union UPS cut thousands of positions after their amazing contract
166,2024-06-24 05:14:34,AMZN,NEGATIVE,0.998853325843811,"where are you getting this information that Amazon has 3rd party drivers? they may have a few that I'm not aware of but as far as I know, Amazon employs their own drivers and use their own vans"
167,2024-06-24 05:14:34,AMZN,NEGATIVE,0.9976713061332704,Amazon in general is trying to get away from 3rd party contractors and is trying to do as much as it can in house
168,2024-06-24 05:14:34,AMZN,NEGATIVE,0.9963366985321044,I got AMZN finishing at least $210 by the end of the year
169,2024-06-24 05:14:34,AMZN,NEGATIVE,0.99649977684021,Only way it will go bananas is if it offers dividends which won’t happen
170,2024-06-24 05:14:34,AMZN,POSITIVE,0.996963918209076,Regards took you seriously ![img](emote|t5_2th52|4271)
171,2024-06-24 05:14:34,AMZN,POSITIVE,0.9871941208839417,Classic 🏳️‍🌈 Regard
172,2024-06-24 05:14:34,AMZN,POSITIVE,0.999154806137085,Remind me
173,2024-06-24 05:14:34,AMZN,NEGATIVE,0.9434653520584106,By July 19 Amazon @ $200.
174,2024-06-24 05:14:34,AMZN,POSITIVE,0.9980962872505188,"lol, sure bud"
175,2024-06-24 05:14:34,AMZN,NEGATIVE,0.9982287287712096,So I should do a 200 call then??
176,2024-06-24 05:14:34,AMZN,NEGATIVE,0.9969286322593688,How are you not including Raytheon? They are going to be making bank after the first year of WW3
177,2024-06-24 05:14:34,AMZN,POSITIVE,0.9998632669448853,You absolutely nailed it
178,2024-06-24 05:14:34,AMZN,NEGATIVE,0.9981745481491088,Couldn’t agree more.
179,2024-06-24 05:14:34,AMZN,NEGATIVE,0.9992058873176576,Forgot about LLY..
180,2024-06-24 05:14:34,AMZN,POSITIVE,0.571769654750824,"options beginner here...did you trade a ""bear"" credit call spread with 7/5 exp, sold call at 190, bought call 195, you collect all premium if AMZN stays below 190 at exp and lose entire width of spread (5.00 x 100) if expires above 195?  thanks!!!!"
181,2024-06-24 05:14:34,AMZN,NEGATIVE,0.9896294474601746,Same 😥
182,2024-06-24 05:14:34,AMZN,POSITIVE,0.999537706375122,It’s at a huge multi year breakout
183,2024-06-24 05:14:34,AMZN,POSITIVE,0.8325831890106201,"I canceled my prime account 4 years ago, and never looked back"
184,2024-06-24 05:14:34,AMZN,NEGATIVE,0.7608008980751038,I was just buying stuff I didn’t need at all.
185,2024-06-24 05:14:34,AMZN,NEGATIVE,0.9986365437507628,"Does Bezos still work there? He stepped down as CEO, guess he's probably on the board or something"
186,2024-06-24 05:14:34,AMZN,NEGATIVE,0.9996236562728882,I think he spends most of his time banging his clown-faced girlfriend on his mega yacht
187,2024-06-24 05:14:34,AMZN,POSITIVE,0.9998137354850768,  The dream
188,2024-06-24 05:14:34,AMZN,POSITIVE,0.9936699271202089,What leaps?
189,2024-06-24 05:14:34,AMZN,POSITIVE,0.9528233408927916,"Agreed on both points, I think Mon / Wed will be down days, and late Wed will be a great time to dive into some July calls"
190,2024-06-24 05:14:34,AMZN,NEGATIVE,0.94069105386734,Then again I'm a bull for July and bear for August and September
191,2024-06-24 05:14:34,AMZN,NEGATIVE,0.9996497631072998, Just another degenerate though so who knows.
192,2024-06-24 05:14:34,AMZN,NEGATIVE,0.9951443076133728,Is this a joke ? Amazon logistics is unparalleled
193,2024-06-24 05:14:34,AMZN,NEGATIVE,0.9689013957977296,"They are eating in to advertising revenue of Meta, Google"
194,2024-06-24 05:14:34,AMZN,NEGATIVE,0.9965897798538208,AWS is stagnating but is $100B+.
195,2024-06-24 05:14:34,AMZN,POSITIVE,0.992685079574585,"Consolidating, it will pop over $200 soon enough"
196,2024-06-24 05:14:34,AMZN,NEGATIVE,0.9995748400688172,Post screenshot or shut up
197,2024-06-24 05:14:34,AMZN,NEGATIVE,0.999184787273407,What is DD? Is it research and analisis?
198,2024-06-24 05:14:34,AMZN,NEGATIVE,0.9986590147018432,“Amazon saves hundreds of billions not developing AI and just pays some Indian guy that actually gives better results”   Stock price drops by 10%
199,2024-06-24 05:14:34,AMZN,NEGATIVE,0.9438177943229676,Lol
200,2024-06-24 05:14:34,AMZN,POSITIVE,0.999777376651764,India's doing alright
201,2024-06-24 05:14:34,AMZN,POSITIVE,0.9993082284927368,Well money wise
202,2024-06-24 05:14:34,AMZN,NEGATIVE,0.8793351054191589,Heat they are dropping like flies
203,2024-06-24 05:14:34,AMZN,NEGATIVE,0.9983166456222534,Someone's gotta make all those air conditioners they will be buying.
204,2024-06-24 05:14:34,AMZN,POSITIVE,0.9998589754104614,Good to know!
205,2024-06-24 05:14:34,AMZN,NEGATIVE,0.992037296295166,Your attorney will \*try to sue Amazon
206,2024-06-24 05:14:34,AMZN,NEGATIVE,0.9970508813858032,"Their attorneys will hide behind employer-employee independent contractor language and assert that there is no negligent supervision since they are not an employee, then file to be dismissed."
207,2024-06-24 05:14:34,AMZN,NEGATIVE,0.9991463422775269,They suck and is why they get not a duckin penny of my money unless i purchase their stock
208,2024-06-24 05:14:34,AMZN,POSITIVE,0.996049702167511,And always deliver late...
209,2024-06-24 05:14:34,AMZN,NEGATIVE,0.997162401676178,It’s after 30 years of being a full time driver starting this contract
210,2024-06-24 05:14:34,AMZN,NEGATIVE,0.9990612864494324,So the other folks who have been driving for 30 years and retiring today wouldn’t make that much
211,2024-06-24 05:14:34,AMZN,NEGATIVE,0.9924115538597108,"A 35 year vet retiring told me his number is currently at $9,300 a month, though, so maybe it is retro but I don’t think so"
212,2024-06-24 05:14:34,AMZN,NEGATIVE,0.9957515001296996, The major change in this contract is when we used to retire the medical insurance dropped the cancer clause or it had really low limits on how much it would help before it shut off
213,2024-06-24 05:14:34,AMZN,NEGATIVE,0.999009609222412,It’s gone from $1M limit to $2M limit to no limit on this contract
214,2024-06-24 05:14:34,AMZN,NEGATIVE,0.9988638162612916,So a bunch of folks are retiring on this contract to take advantage of it
215,2024-06-24 05:14:34,AMZN,POSITIVE,0.9992327690124512," And yes, our union is one of the strongest / best unions so that’s why our pension is so high"
216,2024-06-24 05:14:34,AMZN,POSITIVE,0.9904344081878662," It’s common knowledge amongst union workers that UPSers make alot for no college, but yeah our pension reached pretty solid numbers on this latest contract"
217,2024-06-24 05:14:34,AMZN,POSITIVE,0.8618459701538086,lmao
218,2024-06-24 05:14:34,AMZN,POSITIVE,0.9940290451049804,But that’s my point
