,date,stock,sent,score,comment
412,2024-07-13 07:29:19,AMZN,POSITIVE,0.9819305539131165,Not to mention nearly forty businesses in development as I type.
413,2024-07-13 07:29:19,AMZN,NEGATIVE,0.8204693794250488,Nvdia is the backbone to chat GPT among other things
414,2024-07-13 07:29:19,AMZN,NEGATIVE,0.9981942772865297,Without Nvdias chips it would still be in very early trial phases instead of where it is today
415,2024-07-13 07:29:19,AMZN,POSITIVE,0.9960216879844666,"Nvdia has a pretty good back bone to continue to grow and being among the very few between AMD, INTEL,and  NVDIA even being top competitors for those types of capabilities, its very possible that they could compete or beat Amazon"
416,2024-07-13 07:29:19,AMZN,POSITIVE,0.9739338159561156,  Amazon does good by diversifying their business where nvdia sells their product for higher margins per sale simply because no one else has caught up to their capabilities yet
417,2024-07-13 07:29:19,AMZN,POSITIVE,0.6127442121505737,Until AMD and Intel catch up or find their own niche nvdia is going to be top market
418,2024-07-13 07:29:19,AMZN,NEGATIVE,0.9938228130340576,It's going to take one of those two to catch up in order to stabilize this area of the market
419,2024-07-13 07:29:19,AMZN,NEGATIVE,0.9819452166557312,Then nvdia will really drop
420,2024-07-13 07:29:19,AMZN,POSITIVE,0.9998453855514526, In the end they will all grow In value
421,2024-07-13 07:29:19,AMZN,NEGATIVE,0.9759073853492736,Tech stocks dropped a ton but recovered by almost 50% already
422,2024-07-13 07:29:19,AMZN,NEGATIVE,0.9988223910331726,I'm pretty sure most of it has to do with dividend payouts coming up and alot of people pulling out to influence others to pull out so they can buy more shares for less money yielding a higher dividend payout
423,2024-07-13 07:29:19,AMZN,POSITIVE,0.9895161390304564,"Was also aware that in my portfolio, I hadn't lost a single day until Thursday"
424,2024-07-13 07:29:19,AMZN,NEGATIVE,0.9981657862663268,So it wasn't surprising to see it drop
425,2024-07-13 07:29:19,AMZN,POSITIVE,0.9951712489128112,Still came out green overall even with the sell off
426,2024-07-13 07:29:19,AMZN,POSITIVE,0.999553382396698,So it is what it is
427,2024-07-13 07:29:19,AMZN,NEGATIVE,0.9993876218795776,I buy and hold so fluctuations like that don't really phase me
428,2024-07-13 07:29:19,AMZN,NEGATIVE,0.999683141708374,I just stop looking for the day
429,2024-07-13 07:29:19,AMZN,POSITIVE,0.9965636134147644,As long as I don't lose my initial investment.
430,2024-07-13 07:29:19,AMZN,NEGATIVE,0.9911531805992126,"If they paid a dividend, then they wouldn't be to reinvest their free cash flow as effectively has they have done"
431,2024-07-13 07:29:19,AMZN,POSITIVE,0.9382940530776978,"Thus, it's far better that they don't issue a dividend so long as they maintain this level of efficiency."
432,2024-07-13 07:29:19,AMZN,POSITIVE,0.9997685551643372,"You are right, there is a lot priced in"
433,2024-07-13 07:29:19,AMZN,NEGATIVE,0.9509714841842652, The thing is the sky is the limit
434,2024-07-13 07:29:19,AMZN,NEGATIVE,0.9967262744903564, I can see it going to 215 before a pullback or maybe this is it
435,2024-07-13 07:29:19,AMZN,POSITIVE,0.999736487865448," It's fine, I am not worried"
436,2024-07-13 07:29:19,AMZN,NEGATIVE,0.995739221572876," Of course I wouldn't be buying too much here, I'd gamble and wait but hey if it's long term why gamble and just buy it"
437,2024-07-13 07:29:19,AMZN,POSITIVE,0.910096287727356,   Eventually this market will top then distribute but with AI hype good luck timing that - that's what I tell myself anyways.
438,2024-07-13 07:29:19,AMZN,NEGATIVE,0.7309178709983826,This is already the case
439,2024-07-13 07:29:19,AMZN,NEGATIVE,0.9991801381111144,Why do they chose to dilute the shares?
440,2024-07-13 07:29:19,AMZN,POSITIVE,0.7465893030166626,"They increased share count by like 14% over 10 years, 1% compounded annually"
441,2024-07-13 07:29:19,AMZN,POSITIVE,0.985421359539032,"Definitely something, but nothing to worry about."
442,2024-07-13 07:29:19,AMZN,NEGATIVE,0.9997381567955016,How are they increasing share count? Bezos selling shares that are already part of the total number of shares in existence does not increase the number of shares
443,2024-07-13 07:29:19,AMZN,NEGATIVE,0.9937803149223328,"If you're talking about the split, that is something that nearly every growing company does, which again, does not dilute value"
444,2024-07-13 07:29:19,AMZN,NEGATIVE,0.9981942772865297,How exactly are they adding shares?
445,2024-07-13 07:29:19,AMZN,POSITIVE,0.9998125433921814,That makes sense to me
446,2024-07-13 07:29:19,AMZN,POSITIVE,0.9998206496238708,Thank you for this explanation
447,2024-07-13 07:29:19,AMZN,POSITIVE,0.99667489528656,lol its always a top
448,2024-07-13 07:29:19,AMZN,NEGATIVE,0.9995456337928772,Today’s top is the bottom in 3 years
449,2024-07-13 07:29:19,AMZN,NEGATIVE,0.999543845653534,Stop trying to TIme it
450,2024-07-13 07:29:19,AMZN,POSITIVE,0.9894816875457764,That
451,2024-07-13 07:29:19,AMZN,POSITIVE,0.9968659281730652,"As long as it doesn't become a risk to your diversified portfolio, hold as much as you like"
452,2024-07-13 07:29:19,AMZN,NEGATIVE,0.997385561466217,I have several other positions that need to be harvested before I get around to trimming my Amazon shares.
453,2024-07-13 07:29:19,AMZN,POSITIVE,0.9989680051803588,Is azure really cheaper though
454,2024-07-13 07:29:19,AMZN,NEGATIVE,0.9909217953681946,Also from what I understand Netflix had some pretty cutting edge stuff for streaming built in AWS that would be hard to replicate on Azure.
455,2024-07-13 07:29:19,AMZN,POSITIVE,0.7465072274208069,Sell 1% of stock every year
456,2024-07-13 07:29:19,AMZN,POSITIVE,0.9974820017814636,Congrats you have a dividend
457,2024-07-13 07:29:19,AMZN,POSITIVE,0.9310169816017152,Ditto for me
458,2024-07-13 07:29:19,AMZN,POSITIVE,0.9995902180671692, The moat on  cloud services is astounding.
459,2024-07-13 07:29:19,AMZN,NEGATIVE,0.810809314250946,And this was the other decision we all made!
460,2024-07-13 07:29:19,AMZN,POSITIVE,0.9944873452186584,"And even if they didn't have competitors in both spaces, they are still both very separate businesses"
461,2024-07-13 07:29:19,AMZN,NEGATIVE,0.99933522939682,Standard Oil got broken up because it was all oil
462,2024-07-13 07:29:19,AMZN,NEGATIVE,0.9983566403388976,AT&T got broken up because it was all phone lines
463,2024-07-13 07:29:19,AMZN,NEGATIVE,0.998847484588623, Breaking up Amazon into retail and AWS does quite literally nothing to each business' monopoly status (if there was one)
464,2024-07-13 07:29:19,AMZN,NEGATIVE,0.9986054301261902,"If anything Amazon would get broken up into, idk, general retail and pharmacy or something."
465,2024-07-13 07:29:19,AMZN,NEGATIVE,0.6782529354095459,"I'm greedy, I just want more"
466,2024-07-13 07:29:19,AMZN,POSITIVE,0.9514649510383606,   No fear on Amazon
467,2024-07-13 07:29:19,AMZN,NEGATIVE,0.9995637536048888, Zero
468,2024-07-13 07:29:19,AMZN,POSITIVE,0.9989965558052064, It's the Johnson and Johnson of 2024.
469,2024-07-13 07:29:19,AMZN,NEGATIVE,0.9923039078712464,No it isn't.
470,2024-07-13 07:29:19,AMZN,NEGATIVE,0.9677777886390686,SBC
471,2024-07-13 07:29:19,AMZN,NEGATIVE,0.9833385944366456,"A lot of employee compensation is stock based which is basically free from Amazon, since they pay no dividends, outside of it diluting existing shareholders."
472,2024-07-13 07:29:19,AMZN,NEGATIVE,0.9939548373222352,"Reading comprehension isn't your thing, huh?"
473,2024-07-13 07:29:19,AMZN,NEGATIVE,0.995955228805542,why would you build a platform and hand over billions of dollars to a company that decides to enter the market place as a direct competitor to you.
474,2024-07-13 07:29:19,AMZN,NEGATIVE,0.9969574213027954,"But instead of having increasingly more shares via DRIP, your share count is continually reduced."
475,2024-07-13 07:29:19,AMZN,NEGATIVE,0.9985719919204712,I think we can agree this isn’t quite the same
476,2024-07-13 07:29:19,AMZN,NEGATIVE,0.999314308166504,But you can then sell the shares of the retail business and use the money to buy more shares of the cloud business so you can choose it'll just be a couple extra steps to choose.
477,2024-07-13 07:29:19,AMZN,POSITIVE,0.972239315509796,"Respectfully, your point of view on their retail business is little dated"
478,2024-07-13 07:29:19,AMZN,NEGATIVE,0.9980626702308656, Their operating margins on retail have exploded over the last 4-5 quarters due to leveraging AI
479,2024-07-13 07:29:19,AMZN,POSITIVE,0.949167788028717," But either way, a company doesn't get broken up because one part of their business is high margin while another is not"
480,2024-07-13 07:29:19,AMZN,NEGATIVE,0.9991926550865172," Do you think Meta should be broken up because their advertising arm subsidizes the metaverse?  Amazon has major competitors in both spaces, creating an advantage over your competitors is business 101, it's not a reason to get broken up."
481,2024-07-13 07:29:19,AMZN,NEGATIVE,0.880483090877533,Profits from retail paid to build AWS
482,2024-07-13 07:29:19,AMZN,POSITIVE,0.9996218681335448,The retail is plenty profitable on its own
483,2024-07-13 07:29:19,AMZN,NEGATIVE,0.9984024167060852,AWS subsidizes nothing.
484,2024-07-13 07:29:19,AMZN,NEGATIVE,0.9954818487167358,I lumped a lot and several times from summer 22 until fall 23
485,2024-07-13 07:29:19,AMZN,POSITIVE,0.741942286491394,"  I don't usually go bananas like that and put up big numbers on a single stock, but like you I had zero fear"
486,2024-07-13 07:29:19,AMZN,POSITIVE,0.996599018573761,No hesitation
487,2024-07-13 07:29:19,AMZN,POSITIVE,0.9950220584869384,It was a no brainer
488,2024-07-13 07:29:19,AMZN,POSITIVE,0.999245285987854,  It's performed very well!   Now I need to decide if I buy more
489,2024-07-13 07:29:19,AMZN,POSITIVE,0.9997020363807678,Interesting theory you have
490,2024-07-13 07:29:19,AMZN,NEGATIVE,0.9930363297462464,So you think it will take a while to breakout and stay above 200-220?
491,2024-07-13 07:29:19,AMZN,POSITIVE,0.9996708631515504,Yes it is
492,2024-07-13 07:29:19,AMZN,NEGATIVE,0.9996410608291626,Market share is down 30% from 2017.
493,2024-07-13 07:29:19,AMZN,NEGATIVE,0.999788224697113,That's not correct
494,2024-07-13 07:29:19,AMZN,NEGATIVE,0.9898114800453186,They are not just creating shares out of the ether to use as employee compensation
495,2024-07-13 07:29:19,AMZN,NEGATIVE,0.9983914494514464,They use share buybacks for that or else dispense shares that the company already holds
496,2024-07-13 07:29:19,AMZN,NEGATIVE,0.9993127584457396,There is no net increase in shares
497,2024-07-13 07:29:19,AMZN,NEGATIVE,0.9982660412788392,"Whether an employee is paid in cash or shares, it is an expense for the company."
498,2024-07-13 07:29:19,AMZN,NEGATIVE,0.9978132247924804,Yeah I mean a lot of the stuff was built before Amazon was streaming
499,2024-07-13 07:29:19,AMZN,POSITIVE,0.8972299098968506,"So I'm sure they want to move away from AWS, but it's so intertwined."
500,2024-07-13 07:29:19,AMZN,NEGATIVE,0.9972909092903136,"Given that the price of the stock is reduced by the stock exchange on the ex-dividend date by the amount of the dividend issued, it is mathematically the same had the stock not issued a dividend"
501,2024-07-13 07:29:19,AMZN,NEGATIVE,0.9957265853881836,"If a stock is trading at $100 and they issue a $1 dividend, on the ex-dividend date, the stock price is lowered to $99 and you receive $1 in cash"
502,2024-07-13 07:29:19,AMZN,NEGATIVE,0.9078001379966736,    Source:  [5330
503,2024-07-13 07:29:19,AMZN,NEGATIVE,0.982992708683014,Adjustment of Orders | FINRA.org](https://www.finra.org/rules-guidance/rulebooks/finra-rules/5330)
504,2024-07-13 07:29:19,AMZN,NEGATIVE,0.9969370365142822,>your share count is continually reduced  And the value per share is higher because Amazon reinvests instead of paying out
505,2024-07-13 07:29:19,AMZN,NEGATIVE,0.9886653423309326, Non-starter statement
506,2024-07-13 07:29:19,AMZN,NEGATIVE,0.9983373880386353,Dividends are only worthwhile if the company's potential ROI on that cash is below what you as an investor can otherwise achieve.
507,2024-07-13 07:29:19,AMZN,NEGATIVE,0.9966201782226562,Leveraging AI? HAHAHAHAHAHAHHAHAHAH   More specifically they pulled back heavily on investment and new warehouses
508,2024-07-13 07:29:19,AMZN,NEGATIVE,0.9970985651016236,"They’ve also gouged their primary sellers and forced regionalization of packaging, eating into the margins of small business sellers"
509,2024-07-13 07:29:19,AMZN,NEGATIVE,0.991749942302704,"This is a one time squeeze of the apple, no more juice left."
510,2024-07-13 07:29:19,AMZN,NEGATIVE,0.8628711104393005,Probably breakout of that range by 8/2.
511,2024-07-13 07:29:19,AMZN,NEGATIVE,0.998848557472229,It's only a theory that can change in a new york second
512,2024-07-13 07:29:19,AMZN,NEGATIVE,0.6357539296150208," And I""d only swing it if the conditions are perfect."
513,2024-07-13 07:29:19,AMZN,NEGATIVE,0.816256046295166,That's just the late arrival of competition in a still fast growing market
514,2024-07-13 07:29:19,AMZN,POSITIVE,0.7476047277450562,To be expected really.
515,2024-07-13 07:29:19,AMZN,POSITIVE,0.8507602214813232,I love the thought that a business that went from $17b to $100b in 6 years is “having its lunch eaten.”
516,2024-07-13 07:29:19,AMZN,NEGATIVE,0.6976655721664429,Amazon hasn't bought back shares in years
517,2024-07-13 07:29:19,AMZN,POSITIVE,0.9869520664215088,Look at their earnings reports to see shares outstanding increasing quarter after quarter.
518,2024-07-13 07:29:19,AMZN,NEGATIVE,0.9972455501556396,Uhh.
519,2024-07-13 07:29:19,AMZN,NEGATIVE,0.754581093788147,I hate to break this to you but companies do just “print” shares and “create them out of the ether” and it’s not illegal at all
520,2024-07-13 07:29:19,AMZN,NEGATIVE,0.9932112097740172,That’s what the vast majority of stock based comp is
521,2024-07-13 07:29:19,AMZN,POSITIVE,0.9962146878242492,They’re creating new shares.
522,2024-07-13 07:29:19,AMZN,NEGATIVE,0.9932525753974916,Maybe but they could have started the transition years ago.
523,2024-07-13 07:29:19,AMZN,POSITIVE,0.9977522492408752,Just like Walmart and their other competitors are doing
524,2024-07-13 07:29:19,AMZN,NEGATIVE,0.999215006828308,I don't see that as much of a differentiator.
525,2024-07-13 07:29:19,AMZN,POSITIVE,0.8514631986618042,"...Read any of their last 4 earnings calls, they discuss how AI is improving operational efficiency, reducing workforce and expanding operational margins (which you can literally see in earnings)"
526,2024-07-13 07:29:19,AMZN,POSITIVE,0.7934851050376892, No idea why that is so funny to you.
527,2024-07-13 07:29:19,AMZN,POSITIVE,0.7857514023780823,Competition is a relative word
528,2024-07-13 07:29:19,AMZN,NEGATIVE,0.9988460540771484, To change over to other cloud services involves more than you can imagine and makes it more than just prohibitive
529,2024-07-13 07:29:19,AMZN,POSITIVE,0.986855924129486,"   The term ""moat"" is huge and it is not down as others have stated"
530,2024-07-13 07:29:19,AMZN,NEGATIVE,0.9504126310348512," I dont give a toss what they say, I know what I know, Amazon cloud services has huge margins and the sky is the limit with management that is laser focused on increasing market share."
531,2024-07-13 07:29:19,AMZN,POSITIVE,0.9970732927322388,"What I said was correct, however."
532,2024-07-13 07:29:19,AMZN,POSITIVE,0.6524137854576111,Stocks are pricing in future growth not past.
533,2024-07-13 07:29:19,AMZN,NEGATIVE,0.5022844672203064,They are NOT just printing shares
534,2024-07-13 07:29:19,AMZN,POSITIVE,0.9402676224708556,They are distributing shares that they own
535,2024-07-13 07:29:19,AMZN,NEGATIVE,0.9995537400245668,"It would be completely illegal for a company to issue, for example, 1000 shares, and every year they just print up new fictitious shares to give to their employees instead of paying them"
536,2024-07-13 07:29:19,AMZN,NEGATIVE,0.9721859097480774,They have to purchase the shares that they give away
537,2024-07-13 07:29:19,AMZN,NEGATIVE,0.9990386962890624,There is no net change to the 10.4 billion shares in existence
538,2024-07-13 07:29:19,AMZN,NEGATIVE,0.9985600113868712,"Edit: You don't see buybacks that the company purchases for employee compensation, because the company isn't keeping those shares"
539,2024-07-13 07:29:19,AMZN,POSITIVE,0.8922266364097595,They buy them and immediately transfer ownership to the employee
540,2024-07-13 07:29:19,AMZN,NEGATIVE,0.8451035618782043,"This is different from a share buyback, where the company uses excess cash to buy shares"
541,2024-07-13 07:29:19,AMZN,NEGATIVE,0.9625144600868224,"This results in a net decrease in the total number of company shares, and a net increase in the per share value"
542,2024-07-13 07:29:19,AMZN,NEGATIVE,0.9981094598770142,I don't know where you are getting that the number of shares keeps increasing every quarter
543,2024-07-13 07:29:19,AMZN,NEGATIVE,0.999687671661377,"I have been owning Amazon stock for 23 years, and what you're saying just isn't happening."
544,2024-07-13 07:29:19,AMZN,POSITIVE,0.973663330078125,"Apparently, that is indeed the case"
545,2024-07-13 07:29:19,AMZN,POSITIVE,0.9165847897529602,TIL.
546,2024-07-13 07:29:19,AMZN,NEGATIVE,0.9990500807762146,None of the retailers are “leveraging AI” unless we have redefined machine learning as “AI”.
547,2024-07-13 07:29:19,AMZN,POSITIVE,0.9960129261016846,Machine Learning is not Artificial Intelligence
548,2024-07-13 07:29:19,AMZN,NEGATIVE,0.9963744282722472, This is like saying Kroger’s is an AI firm.
549,2024-07-13 07:29:19,AMZN,NEGATIVE,0.9995575547218324,This isn't true
550,2024-07-13 07:29:19,AMZN,NEGATIVE,0.9444352388381958,"They are ""just printing shares"", and this is not at all illegal"
551,2024-07-13 07:29:19,AMZN,NEGATIVE,0.9199283719062804,"This is from page 20 of their [most recent annual report](https://s2.q4cdn.com/299287126/files/doc_financials/2024/ar/Amazon-com-Inc-2023-Annual-Report.pdf):  >We seek to efficiently manage shareholder dilution while maintaining the flexibility to issue shares for strategic purposes, such as financings, acquisitions, and aligning employee compensation with shareholders’ interests"
552,2024-07-13 07:29:19,AMZN,NEGATIVE,0.969591736793518,We utilize restricted stock units as our primary vehicle for equity compensation because we believe this compensation model aligns the long-term interests of our shareholders and employees
553,2024-07-13 07:29:19,AMZN,POSITIVE,0.6075316667556763,"In measuring shareholder dilution, we include all vested and unvested stock awards outstanding, without regard to estimated forfeitures"
554,2024-07-13 07:29:19,AMZN,POSITIVE,0.9699869155883788,"Total shares outstanding plus outstanding stock awards were 10.6 billion and 10.8 billion as of December 31, 2022 and 2023"
555,2024-07-13 07:29:19,AMZN,NEGATIVE,0.8784714341163635," The board has to approve such dilutions, but they do this every year in order to continue to award employees RSUs"
556,2024-07-13 07:29:19,AMZN,NEGATIVE,0.9962454438209534,This is why employees are told at each compensation review that any RSUs granted are subject to board approval
557,2024-07-13 07:29:19,AMZN,POSITIVE,0.9962336421012878, And this is not necessarily a bad thing for shareholders: doing this allows Amazon to attract employees with 10s or hundreds of thousands (sometimes millions) of dollars of compensation without having to come up with the cash for it
558,2024-07-13 07:29:19,AMZN,POSITIVE,0.9971756935119628,"It increases free cash flow, which allows for more investment"
559,2024-07-13 07:29:19,AMZN,POSITIVE,0.9991722106933594,"As long as Amazon can use the money they save to grow the company faster than they dilute shares (which they seem to be quite good at), the board and shareholders will be happy to keep doing this."
560,2024-07-13 07:29:19,AMZN,POSITIVE,0.9921236634254456,I’m referring to their shares outstanding which are increasing
561,2024-07-13 07:29:19,AMZN,NEGATIVE,0.977708637714386,Read their earnings reports to check shares outstanding numbers increasing after each quarter.
562,2024-07-13 07:29:19,AMZN,POSITIVE,0.9996129870414734,Yeah these other commentators are absolutely correct
563,2024-07-13 07:29:19,AMZN,NEGATIVE,0.8737678527832031,They are actually just creating more shares
564,2024-07-13 07:29:19,AMZN,NEGATIVE,0.999787986278534,When buybacks happen the shares also basically just get destroyed
565,2024-07-13 07:29:19,AMZN,NEGATIVE,0.9938679337501526,It's not like it goes in some electronic vault for them to give to employees
566,2024-07-13 07:29:19,AMZN,POSITIVE,0.8205008506774902, This is my one gripe about Amazon
567,2024-07-13 07:29:19,AMZN,NEGATIVE,0.9996275901794434,They need to be buying shares back to keep the total outstanding shares flat or shrink it ideally
568,2024-07-13 07:29:19,AMZN,NEGATIVE,0.9988697171211244," The other big tech companies do this, and actually reduce share count or keep it flat."
569,2024-07-13 07:29:19,AMZN,NEGATIVE,0.9987630844116212,You have no idea what you're talking about
570,2024-07-13 07:29:19,AMZN,NEGATIVE,0.8745498061180115, Do some research before attacking.
571,2024-07-13 07:29:19,AMZN,NEGATIVE,0.9983402490615844,Where is this supposed “AI”?
572,2024-07-13 07:29:19,AMZN,NEGATIVE,0.963454246520996,They own part of Anthropic which is mainly for AWS customers
573,2024-07-13 07:29:19,AMZN,POSITIVE,0.8576997518539429,   They use it to optimize inventory management and supply chain (forecasting demand and delivery logistics)
574,2024-07-13 07:29:19,AMZN,POSITIVE,0.9682209491729736," Product recommendations, dynamic pricing, customer service (LLM's)"
575,2024-07-13 07:29:19,AMZN,NEGATIVE,0.9947391152381896,"   It shouldnt be surprising that Amazon is leveraging AI to improve their business, what should be surprising is major enterprises that are not"
576,2024-07-13 07:29:19,AMZN,NEGATIVE,0.9991546869277954,  I don't think this type of company will remain competitive for very long
577,2024-07-13 07:29:19,AMZN,NEGATIVE,0.9777196645736694,They were doing this far before Anthropic even existed
578,2024-07-13 07:29:19,AMZN,POSITIVE,0.9463154673576356,"You argued that they weren't using AI, and now that I tell you the areas in which they have improved efficiency (and margins) using AI, you claim they have always been doing this..."
579,2024-07-13 07:29:19,AMZN,NEGATIVE,0.993579626083374, Why don't you stop waisting both our time and go read an earnings call from the last 5 quarters
580,2024-07-13 07:29:19,AMZN,POSITIVE,0.996861219406128," The company will explain how they managed to expand their margins on retail operations so drastically, and they won't argue back if you try to talk in circles"
581,2024-07-13 07:29:19,AMZN,POSITIVE,0.9956455826759338,Machine Learning is not AI.
582,2024-07-13 07:29:19,AMZN,NEGATIVE,0.9418431520462036," Argue less, learn more"
583,2024-07-13 07:29:19,AMZN,POSITIVE,0.9964423775672911,Machine learning is not AI
584,2024-07-13 07:29:19,AMZN,POSITIVE,0.934600830078125,  Artificial Intelligence is not Machine Learning.
585,2024-05-28 02:36:20,AMZN,POSITIVE,0.998656153678894,"DOJ, that’s about it"
586,2024-05-28 02:36:20,AMZN,POSITIVE,0.979117512702942," Edit: For the people who don’t think Amazon is in the DOJ’s crosshairs, they are"
587,2024-05-28 02:36:20,AMZN,POSITIVE,0.9899391531944276,All of big tech is
588,2024-05-28 02:36:20,AMZN,POSITIVE,0.9984412789344788,Lina Khan of the FTC has made it her personal mission to bring down big tech
589,2024-05-28 02:36:20,AMZN,NEGATIVE,0.9889438152313232," Don’t forget they wouldn’t let Amazon buy a 200 million dollar market cap robot vacuum company, that’s all you need to know."
590,2024-05-28 02:36:20,AMZN,NEGATIVE,0.9786754250526428,Can be partioned because of anti-monopoly regulations.
591,2024-05-28 02:36:20,AMZN,NEGATIVE,0.9903942942619324,There is no bear case to be made
592,2024-05-28 02:36:20,AMZN,POSITIVE,0.9992914199829102," AMZN :   - 1st in retail, third party fast growing, more and more countries printing money   - 1st in Cloud, fast growing   - 3rd in advertising, very fast growing   - 2nd in streaming, fast growing    All of these businesses, especially advertising, Cloud and third party retail are high margin and have great operating leverage"
593,2024-05-28 02:36:20,AMZN,NEGATIVE,0.9996801614761353,They continue letting anyone selling any crap on their website and the retail part becomes an equivalent of Ebay where 90% of sellers are just trying to scam you
594,2024-05-28 02:36:20,AMZN,NEGATIVE,0.9995183944702148, Then lose consumer trust and seeing consumer go directly to manufacturers’ website instead of via Amazon.
595,2024-05-28 02:36:20,AMZN,NEGATIVE,0.99521142244339,The bear case is what happens to every company that grows like this
596,2024-05-28 02:36:20,AMZN,NEGATIVE,0.9661575555801392,Everybody is already a customer of the company or its competitors
597,2024-05-28 02:36:20,AMZN,NEGATIVE,0.9995827078819276,"Eventually, the company has to extend its activity to something new or stagnate."
598,2024-05-28 02:36:20,AMZN,NEGATIVE,0.9915192723274232,Maybe an escalation of the trade war between China and US? Almost all Amazon products are sourced from China.
599,2024-05-28 02:36:20,AMZN,NEGATIVE,0.9992795586586,"Growth slows down (ex.recession), AWS loses some market share to Azure and Google cloud, competition in many sectors (walmart for delivery, netflix for streaming...) squeezes margins and forces more investments and capex, overheated job market leads to increased salaries and forces Amazon to pay more stock options"
600,2024-05-28 02:36:20,AMZN,POSITIVE,0.8077824711799622,And regulations
601,2024-05-28 02:36:20,AMZN,NEGATIVE,0.9993725419044496,  I am very much bullish on the company buy the way 
