,date,stock,sent,score,comment
444,2024-07-13 09:24:53,MSFT,NEGATIVE,0.9859733581542968,I will be messaging you in 14 days on [**2024-07-31 02:50:37 UTC**](http://www.wolframalpha.com/input/?i=2024-07-31%2002:50:37%20UTC%20To%20Local%20Time) to remind you of [**this link**](https://www.reddit.com/r/wallstreetbets/comments/1e1x1q9/msft_yolo/ldjxbnv/?context=3)  [**CLICK THIS LINK**](https://www.reddit.com/message/compose/?to=RemindMeBot&subject=Reminder&message=%5Bhttps%3A%2F%2Fwww.reddit.com%2Fr%2Fwallstreetbets%2Fcomments%2F1e1x1q9%2Fmsft_yolo%2Fldjxbnv%2F%5D%0A%0ARemindMe%21%202024-07-31%2002%3A50%3A37%20UTC) to send a PM to also be reminded and to reduce spam
445,2024-07-13 09:24:53,MSFT,NEGATIVE,0.997776210308075, ^(Parent commenter can ) [^(delete this message to hide from others.)](https://www.reddit.com/message/compose/?to=RemindMeBot&subject=Delete%20Comment&message=Delete%21%201e1x1q9)  *****  |[^(Info)](https://www.reddit.com/r/RemindMeBot/comments/e1bko7/remindmebot_info_v21/)|[^(Custom)](https://www.reddit.com/message/compose/?to=RemindMeBot&subject=Reminder&message=%5BLink%20or%20message%20inside%20square%20brackets%5D%0A%0ARemindMe%21%20Time%20period%20here)|[^(Your Reminders)](https://www.reddit.com/message/compose/?to=RemindMeBot&subject=List%20Of%20Reminders&message=MyReminders%21)|[^(Feedback)](https://www.reddit.com/message/compose/?to=Watchful1&subject=RemindMeBot%20Feedback)| |-|-|-|-|
446,2024-07-13 09:24:53,MSFT,NEGATIVE,0.997660994529724,I’ve got MSFT $500 calls less than a month out
447,2024-07-13 09:24:53,MSFT,NEGATIVE,0.9725493788719176,"At their existing pace, they go up about $50 a month"
448,2024-07-13 09:24:53,MSFT,NEGATIVE,0.9975964426994324,Even at half that pace you’d make a killing by January.
449,2024-07-13 09:24:53,MSFT,NEGATIVE,0.9885364770889282,Got another 150 in my fidelity account ![img](emote|t5_2th52|4271)  https://preview.redd.it/yr1gflkfdgcd1.jpeg?width=1170&format=pjpg&auto=webp&s=73781448021ff786e1212f6250d887025a149577
450,2024-07-13 09:24:53,MSFT,NEGATIVE,0.9780805110931396,can you reply with your position?
451,2024-04-09 12:17:41,MSFT,NEGATIVE,0.9850912094116212,I would just invest going forward in XLK
452,2024-04-09 12:17:41,MSFT,NEGATIVE,0.9976535439491272,Leave the tax hit for another day.
453,2024-04-09 12:17:41,MSFT,NEGATIVE,0.9304521679878236,Keep Msft bruh
454,2024-04-09 12:17:41,MSFT,NEGATIVE,0.9708361625671388,Personally I wouldn’t sell
455,2024-04-09 12:17:41,MSFT,POSITIVE,0.999817669391632,Microsoft is one of the best and most diversified businesses in the world with a top tier CEO
456,2024-04-09 12:17:41,MSFT,NEGATIVE,0.9972878694534302,"I don’t see any reason to sell, this puppy is just going to continue to compound in my opinion"
457,2024-04-09 12:17:41,MSFT,NEGATIVE,0.9986011385917664, Sometimes the toughest thing to do when owning a good company is to do nothing
458,2024-04-09 12:17:41,MSFT,POSITIVE,0.999226689338684, Whatever you decide to do good luck though!
459,2024-04-09 12:17:41,MSFT,NEGATIVE,0.9990966320037842,"Don’t sell good companies, just accumulate over the years"
460,2024-04-09 12:17:41,MSFT,POSITIVE,0.9540781378746032,Keep and sell covered calls for entertainment
461,2024-04-09 12:17:41,MSFT,NEGATIVE,0.9992555975914,Don’t sell be happy
462,2024-04-09 12:17:41,MSFT,POSITIVE,0.9185762405395508,i'd hold it as long as the CEO and the AI phase stays
463,2024-04-09 12:17:41,MSFT,NEGATIVE,0.9995132684707642,You’ll lose a chunk to taxes if you sell
464,2024-04-09 12:17:41,MSFT,NEGATIVE,0.9790096282958984,Keep your money in MSFT and it’ll keep compounding
465,2024-04-09 12:17:41,MSFT,NEGATIVE,0.9983999133110046,I locked in a $33k profit last year in SMCI and NVDA but it could have been close to 180k if I would've held it a few months longer
466,2024-04-09 12:17:41,MSFT,POSITIVE,0.9994927644729614,The profit sounded good at the time though
467,2024-04-09 12:17:41,MSFT,NEGATIVE,0.9816821813583374,😆  $85k is 85k though
468,2024-04-09 12:17:41,MSFT,NEGATIVE,0.9987452030181884,You can double up or lose a good chunk of it
469,2024-04-09 12:17:41,MSFT,NEGATIVE,0.9953019618988036,Don’t trade your star athlete… make him stronger or get a good teammate
470,2024-04-09 12:17:41,MSFT,NEGATIVE,0.9953318238258362,"Nothing wrong with selling some, but I wouldn’t sell more than a third of it"
471,2024-04-09 12:17:41,MSFT,NEGATIVE,0.9982864260673524,The tax hit will be $10-15k if you sell it all
472,2024-04-09 12:17:41,MSFT,NEGATIVE,0.9981486797332764,Is it worth taking this tax hit just to re-invest it? I personally would only do that if I had to make a big purchase that year
473,2024-04-09 12:17:41,MSFT,NEGATIVE,0.5108173489570618,"Jesus, you haven’t heard? Keep MSFT, they’ll for sure become the next MSFT"
474,2024-04-09 12:17:41,MSFT,NEGATIVE,0.9997445940971376,No reason to sell Microsoft for XLK with a 43$ dollar cost basis
475,2024-04-09 12:17:41,MSFT,NEGATIVE,0.9951074123382568,You never sell MSFT.
476,2024-04-09 12:17:41,MSFT,NEGATIVE,0.9996844530105592,MSFT is going nowhere
477,2024-04-09 12:17:41,MSFT,POSITIVE,0.9991063475608826,Hold onto it.
478,2024-04-09 12:17:41,MSFT,POSITIVE,0.991999626159668,"Secure gains, VTI and chill."
479,2024-04-09 12:17:41,MSFT,NEGATIVE,0.9629828333854676,Do you have any losers to offset that you can realize and want to buy back for holding? You can offset some of your gains..
480,2024-04-09 12:17:41,MSFT,NEGATIVE,0.999429166316986,Why not keep MSFT and also buy XLK?
481,2024-04-09 12:17:41,MSFT,NEGATIVE,0.9973674416542052,You don’t get wealthy from diversifying
482,2024-04-09 12:17:41,MSFT,POSITIVE,0.9989615678787231,It’s about focus and conviction
483,2024-04-09 12:17:41,MSFT,POSITIVE,0.999004065990448,Microsoft is on the leading edge of AI development
484,2024-04-09 12:17:41,MSFT,NEGATIVE,0.9981968998908995,Don’t sell a winner to add laggards to your portfolio.
485,2024-04-09 12:17:41,MSFT,NEGATIVE,0.9892503023147584,i wouldn't sell im in the same boat as you
486,2024-04-09 12:17:41,MSFT,NEGATIVE,0.9979986548423768,we get dividends and I don't see it taking a huge dump anytime soon.
487,2024-04-09 12:17:41,MSFT,NEGATIVE,0.9925038814544678,I wouldn’t take the entire tax hit
488,2024-04-09 12:17:41,MSFT,NEGATIVE,0.9961987137794496,If you really want to diversify why not sell like 20/30k and buy s&p500 and keep the rest of Microsoft
489,2024-04-09 12:17:41,MSFT,NEGATIVE,0.9991486072540284,"Do you want everything else in XLK? If not, just pick your own stocks to own"
490,2024-04-09 12:17:41,MSFT,POSITIVE,0.9770594239234924,Seems like youre a newbie overall tho.
491,2024-04-09 12:17:41,MSFT,NEGATIVE,0.9974766373634338,"Sell your loser stocks, not winners"
492,2024-04-09 12:17:41,MSFT,NEGATIVE,0.999390721321106,Dumbest thing I ever heard
493,2024-04-09 12:17:41,MSFT,POSITIVE,0.991417109966278,Keep it foreverrrr
494,2024-04-09 12:17:41,MSFT,NEGATIVE,0.9993250370025636,No unless you think Msft is ridiculously overpriced
495,2024-04-09 12:17:41,MSFT,NEGATIVE,0.9998062252998352,The tax hit doesn’t make enough sense to take
496,2024-04-09 12:17:41,MSFT,NEGATIVE,0.9939106702804564,You may be diversifying but idk if I would call it taking a gain if you’re just reinvesting right away anyway in something similar.
497,2024-04-09 12:17:41,MSFT,NEGATIVE,0.8764013648033142,Just sit on your Microsoft shares
498,2024-04-09 12:17:41,MSFT,NEGATIVE,0.9852046966552734,"But sell short dated covered calls, otm, so they don't hit, to make income and use that to broaden you portfolio."
499,2024-04-09 12:17:41,MSFT,NEGATIVE,0.9991798996925354,Why would you want to pay that much tax?
500,2024-04-09 12:17:41,MSFT,POSITIVE,0.999826967716217,Sounds like you made up your mind
501,2024-04-09 12:17:41,MSFT,POSITIVE,0.9949532151222228,It’s all long term gains so you could easily sell a little this year and a little in 2025 to lower the amount of taxes.
502,2024-04-09 12:17:41,MSFT,NEGATIVE,0.99900621175766,"Don’t sell, just put new money in to XLK"
503,2024-04-09 12:17:41,MSFT,NEGATIVE,0.9978511333465576,After filing my taxes last night the last thing I’d be thinking about is another taxable event.
504,2024-04-09 12:17:41,MSFT,NEGATIVE,0.999778926372528,To me it doesn't make sense to sell msft for a big tax hit and then buy an ETF that's overweight what you just sold
505,2024-04-09 12:17:41,MSFT,NEGATIVE,0.9981297850608826,Can't advise without knowing your whole financial situation but if you feel like you're over allocated msft sell a smaller piece and buy a more diversified ETF
506,2024-04-09 12:17:41,MSFT,NEGATIVE,0.9985658526420592,"Personally I don't like the idea of paying for an ETF with any one stock so heavily weighted, if you're that bullish just buy the stock and hold it individually without paying the managing fee"
507,2024-04-09 12:17:41,MSFT,NEGATIVE,0.7992978692054749,  Ideally you leave it all and reinvest the dividends into other companies or diversified etfs.
508,2024-04-09 12:17:41,MSFT,NEGATIVE,0.9956943988800048,DONT sell 100% if you want XLK sell 50% of msft
509,2024-04-09 12:17:41,MSFT,NEGATIVE,0.9706006050109864,I bought about 35 shares at 40 something dollars/share
510,2024-04-09 12:17:41,MSFT,POSITIVE,0.9546916484832764,So a smaller version of what you did
511,2024-04-09 12:17:41,MSFT,NEGATIVE,0.5338802337646484,I still have them and dividend reinvest
512,2024-04-09 12:17:41,MSFT,POSITIVE,0.7579110264778137,But over the past few years I built a portfolio around Microsoft (and others)
513,2024-04-09 12:17:41,MSFT,NEGATIVE,0.9628502130508424,I went pretty much all index etfs
514,2024-04-09 12:17:41,MSFT,NEGATIVE,0.9997549653053284,Im definitely not selling Microsoft
515,2024-04-09 12:17:41,MSFT,NEGATIVE,0.8777092695236206,Do you think it's suddenly going to drop a lot and never get to this level again?   Like others have said..
516,2024-04-09 12:17:41,MSFT,POSITIVE,0.9967089891433716,Just start diversifying in the direction you want to go and keep the Microsoft
517,2024-04-09 12:17:41,MSFT,NEGATIVE,0.9438020586967468,A few stocks I likely won't sell until I retire...
518,2024-04-09 12:17:41,MSFT,POSITIVE,0.8291745781898499,"Amazon, Microsoft, Apple"
519,2024-04-09 12:17:41,MSFT,NEGATIVE,0.9738438129425048,"You're up like 700% percent, no telling where it will end up!"
520,2024-04-09 12:17:41,MSFT,POSITIVE,0.9997572302818298,Holding several shares of XLK since 120$ it’s the best investment I made and held
521,2024-04-09 12:17:41,MSFT,NEGATIVE,0.9997610449790956,If Microsoft tanks for some reason it's probably during a correction or market downturn
522,2024-04-09 12:17:41,MSFT,NEGATIVE,0.9995408058166504,You'll lose either way.
523,2024-04-09 12:17:41,MSFT,POSITIVE,0.7685258984565735,See VGT
524,2024-04-09 12:17:41,MSFT,NEGATIVE,0.996444284915924,"I wouldnt sell all  200 shares, i would trim the position since you already have a high ROI in it maybe get your initial invesment plus 100% of return on it and hold the rest or sell half so 100 shares and take the Tax hit and re-invest it"
525,2024-04-09 12:17:41,MSFT,NEGATIVE,0.968738615512848, MSFT and XLK have an almost identical 1-5yr chart yet MSFT has had over a 250% gain in the last 5 years
526,2024-04-09 12:17:41,MSFT,NEGATIVE,0.9925011992454528, You are reaping higher ROI in MSFT then if you sell all and move to XLK.
527,2024-04-09 12:17:41,MSFT,NEGATIVE,0.9897288084030152,Would it make sense to own both qqq and xlk
528,2024-04-09 12:17:41,MSFT,NEGATIVE,0.8037614822387695,I know it has some overlap
529,2024-04-09 12:17:41,MSFT,NEGATIVE,0.9923465251922609,Copilot and chatgpt and ai will send Microsoft to 1 k a share
530,2024-04-09 12:17:41,MSFT,NEGATIVE,0.98815256357193,Don't sell
531,2024-04-09 12:17:41,MSFT,POSITIVE,0.9909265041351318,Keep msft
532,2024-04-09 12:17:41,MSFT,NEGATIVE,0.9975591897964478,Maybe don’t sell all 🤷🏻‍♀️ Microsoft will pop soon…
533,2024-04-09 12:17:41,MSFT,POSITIVE,0.9478681087493896,It’s got its tentacles in everything and head start on the future of everything
534,2024-04-09 12:17:41,MSFT,POSITIVE,0.998627543449402,key word : EVERYTHING
535,2024-04-09 12:17:41,MSFT,POSITIVE,0.999250590801239,It’s gonna pop
536,2024-04-09 12:17:41,MSFT,NEGATIVE,0.9983173608779908,Just wait
537,2024-04-09 12:17:41,MSFT,POSITIVE,0.989427387714386,More than it already has …
538,2024-04-09 12:17:41,MSFT,POSITIVE,0.977406084537506,"Ok case you sell , sell a call  and buy with that XLk ,"
539,2024-04-09 12:17:41,MSFT,NEGATIVE,0.9923492670059204,"I currently have 1,166 shares of msft at an average cost basis of $113"
540,2024-04-09 12:17:41,MSFT,NEGATIVE,0.9976434111595154,Do not sell
541,2024-04-09 12:17:41,MSFT,NEGATIVE,0.9982252717018129,You’ll very likely regret it in a couple years.
542,2024-04-09 12:17:41,MSFT,NEGATIVE,0.9896777868270874,Personally I wouldn’t sell MSFT
543,2024-04-09 12:17:41,MSFT,POSITIVE,0.7022705674171448,However if you are trying to “rebalance” your portfolio to manage risks then that’s a different story
544,2024-04-09 12:17:41,MSFT,NEGATIVE,0.9971604347229004," However, that doesn’t sound like what you are planning to do buying XLK instead though"
545,2024-04-09 12:17:41,MSFT,NEGATIVE,0.999572217464447,"Microsoft will never be cheaper than it is right now, and at some point current price will be its 52 week low."
546,2024-04-09 12:17:41,MSFT,NEGATIVE,0.6048452258110046,Msft will outperform XLK forever
547,2024-04-09 12:17:41,MSFT,NEGATIVE,0.9677104949951172,Tax free account right? So just take the gain.
548,2024-04-09 12:17:41,MSFT,POSITIVE,0.9996591806411744,Keep it
549,2024-04-09 12:17:41,MSFT,NEGATIVE,0.9990699887275696,"If you don’t mind selling it, you could sell covered calls against it with a lowish delta if you don’t see MSFT gaining too much more"
550,2024-04-09 12:17:41,MSFT,NEGATIVE,0.9977779984474182,"Collect a little extra money, if it sells you can reorganize your portfolio"
551,2024-04-09 12:17:41,MSFT,POSITIVE,0.9996447563171388,Seems like a win win
552,2024-04-09 12:17:41,MSFT,NEGATIVE,0.9976835250854492,"A monthly OTM call is going for a little over 1000-1200 at the moment, so you could be pocketing 2-2.5k a month while doing nothing, and if it sells (10$ above current price) you’ll make an extra 2k on the 77k profit you’ve got"
553,2024-04-09 12:17:41,MSFT,NEGATIVE,0.9962716102600098,"Their quarterly earning report is coming soon, and I just sold all my MSFT and bought MSFU in my Roth."
554,2024-04-09 12:17:41,MSFT,NEGATIVE,0.998469054698944,"If that’s the plan, then invest in an index that isn’t 20% MSFT so the diversification comes more quickly."
555,2024-04-09 12:17:41,MSFT,POSITIVE,0.9504457116127014,it’s also got a dividend
556,2024-04-09 12:17:41,MSFT,NEGATIVE,0.9909173846244812,just sit and collect and use that for something else
557,2024-04-09 12:17:41,MSFT,POSITIVE,0.9973878264427184,MSFT always goes up (mostly)
558,2024-04-09 12:17:41,MSFT,NEGATIVE,0.9973905682563782,This ![gif](emote|free_emotes_pack|upvote)
559,2024-04-09 12:17:41,MSFT,NEGATIVE,0.9627864360809326,I did pretty much the exact same thing
560,2024-04-09 12:17:41,MSFT,NEGATIVE,0.999172866344452,Probably would do the same again unless I had a Time Machine.
561,2024-04-09 12:17:41,MSFT,NEGATIVE,0.9987523555755616,"I bought some envidia back when it was 400, thinking I had caught the tail end of a pump and dump and might be able to make a few % profit"
562,2024-04-09 12:17:41,MSFT,NEGATIVE,0.9991264939308168,It dropped ~10% so I figured I'd cut my losses
563,2024-04-09 12:17:41,MSFT,NEGATIVE,0.6374928951263428,I'm still kicking myself for that one.
564,2024-04-09 12:17:41,MSFT,NEGATIVE,0.9987713694572448,Why would the cost basis matter when evaluating future investments?
565,2024-04-09 12:17:41,MSFT,POSITIVE,0.9997920393943788,elaborate please
566,2024-04-09 12:17:41,MSFT,NEGATIVE,0.9928812980651855,But that wasn’t the options offered
567,2024-04-09 12:17:41,MSFT,NEGATIVE,0.9959112405776978,It was XLK or MSFT
568,2024-04-09 12:17:41,MSFT,NEGATIVE,0.9993537068367004,Little diversification or all in on MSFT.
569,2024-04-09 12:17:41,MSFT,NEGATIVE,0.9973750114440918,XLK's dividend looks to be nearly identical.
570,2024-04-09 12:17:41,MSFT,NEGATIVE,0.9988378882408142,"Bro, dividend is just forced selling to pay ordinary income tax"
571,2024-04-09 12:17:41,MSFT,NEGATIVE,0.9946247935295104,"Don't get me wrong, I own a lot of MSFT shares but I hate their dividend, I pay a lot of tax on those dividend."
572,2024-04-09 12:17:41,MSFT,POSITIVE,0.989656925201416,Except when… Developers! Developers! Developers!
573,2024-04-09 12:17:41,MSFT,NEGATIVE,0.999804437160492,"Because to some people it's ""house money"", which obviously is a bad thought process"
574,2024-04-09 12:17:41,MSFT,NEGATIVE,0.9720946550369264,"Can't find a great example off the top of my head, but imagine getting Disney at $80 a share in 2014, seeing it rise to almost $200 in 2021, not selling any of it, now seeing it at $120"
575,2024-04-09 12:17:41,MSFT,NEGATIVE,0.9993295669555664,I'd be pissed if I lost 50% off the peak of a stock
576,2024-04-09 12:17:41,MSFT,NEGATIVE,0.9997548460960388,Really not much add
577,2024-04-09 12:17:41,MSFT,NEGATIVE,0.9994856119155884,"If he wants to be at 20% Microsoft, then he could get there quicker (still without recognizing capital gains) by investing any new dollars into an index that includes zero Microsoft"
578,2024-04-09 12:17:41,MSFT,NEGATIVE,0.9960286617279052,He could still stop when he gets to 20% Microsoft on a blended basis
579,2024-04-09 12:17:41,MSFT,NEGATIVE,0.999366581439972,  Not sure why you think this would not be an option.
580,2024-04-09 12:17:41,MSFT,NEGATIVE,0.9953808784484864,How do you pay almost 50%? The highest marginal tax rate is 37% if theyre unqualified
581,2024-04-09 12:17:41,MSFT,NEGATIVE,0.9981809854507446,"If theyre qualified, which they should be if youre talking about paying taxes on them for more than one year, you shouldnt be paying more than 20%, 15% if you make less than $500k."
582,2024-04-09 12:17:41,MSFT,NEGATIVE,0.9991664886474608,Can't you just drip them back into the stock?
583,2024-04-09 12:17:41,MSFT,NEGATIVE,0.5754062533378601,So...
584,2024-04-09 12:17:41,MSFT,NEGATIVE,0.9991115927696228,you hate free money because you only get most of the free money?
585,2024-04-09 12:17:41,MSFT,NEGATIVE,0.994089901447296,Thankfully Balmer doesn’t seem interested in his old job
586,2024-04-09 12:17:41,MSFT,POSITIVE,0.5307967662811279,Satya knocking it out of the park.
587,2024-04-09 12:17:41,MSFT,POSITIVE,0.9985976815223694,That’s emotional investing.
588,2024-04-09 12:17:41,MSFT,POSITIVE,0.8157035708427429,"37% plus 3.8%, plus state taxes"
589,2024-04-09 12:17:41,MSFT,POSITIVE,0.9937295913696288,It can go up to 50% in a lot of states.
590,2024-04-09 12:17:41,MSFT,NEGATIVE,0.9990906715393066,"For tax purposes, it makes no difference what you do with the dividends; they are still considered income even if you reinvest them in the same asset."
591,2024-04-09 12:17:41,MSFT,NEGATIVE,0.9861090779304504,Free money only if they don't cause the price to drop to compensate the dividend payout.
592,2024-04-09 12:17:41,MSFT,NEGATIVE,0.9936892986297609,"Stock went up more under Balmer as official CEO, no? Even with dotcom and 2008."
593,2024-04-09 12:17:41,MSFT,NEGATIVE,0.9993209838867188,"Whos doing your taxes? After a certain amount of time, dividends should be taxed at the capital gains rate"
594,2024-04-09 12:17:41,MSFT,POSITIVE,0.999637484550476,Look it up
595,2024-04-09 12:17:41,MSFT,NEGATIVE,0.9994750618934632,"Oh I had no idea it worked that way, I just assumed it was only on dividends taken as cash payment"
596,2024-04-09 12:17:41,MSFT,POSITIVE,0.9995213747024536,Thanks for clarifying.
597,2024-04-09 12:17:41,MSFT,NEGATIVE,0.9985142350196838,This assumes that stock price has anything to do with the value of a company lol
598,2024-04-09 12:17:41,MSFT,NEGATIVE,0.9873402714729308,[https://www.businessinsider.com/ballmer-era-stock-price-2013-8](https://www.businessinsider.com/ballmer-era-stock-price-2013-8)
599,2024-04-09 12:17:41,MSFT,POSITIVE,0.9514590501785278,Not all dividends
600,2024-04-09 12:17:41,MSFT,NEGATIVE,0.9831554889678956,  Only qualified dividends.
601,2024-04-09 12:17:41,MSFT,NEGATIVE,0.98675936460495,"Even if you reinvest (DRIP), the dividend is basically still a cash payment—you’re just automatically using that cash to buy more shares."
602,2024-04-09 12:17:41,MSFT,POSITIVE,0.5606716871261597,The market value of any public company is literally the share price times number of share
603,2024-04-09 12:17:41,MSFT,NEGATIVE,0.9475797414779664,Lolol
604,2024-04-09 12:17:41,MSFT,NEGATIVE,0.6707965135574341,How tf does this have upvotes
605,2024-04-09 12:17:41,MSFT,NEGATIVE,0.9114162921905518,Dang Ballmer got handed the reigns at peak of dotcom bubble lmao
606,2024-04-09 12:17:41,MSFT,POSITIVE,0.9993269443511964,Yeah
607,2024-04-09 12:17:41,MSFT,POSITIVE,0.9959527254104614,Im pretty sure Microsoft is in that category
608,2024-04-09 12:17:41,MSFT,NEGATIVE,0.9993821382522584,They dont meet any if the exclusions I know about
609,2024-04-09 12:17:41,MSFT,NEGATIVE,0.9922348260879515,"Id have to double check my returns, but I paid cap gains on every corporate stock dividend  Ive been holding for over a year IIRC."
610,2024-04-09 12:17:41,MSFT,POSITIVE,0.9982510209083556,That is indeed what they tell you in freshman year econ
611,2024-04-09 12:17:41,MSFT,NEGATIVE,0.9975324869155884,3 days of watching the market should disillusion you of that.
612,2024-04-09 12:17:41,MSFT,POSITIVE,0.8920803666114807,I was talking about divideds in general
613,2024-04-09 12:17:41,MSFT,NEGATIVE,0.9876984357833862,"I took the original question to be about all dividends, not just Microsoft"
614,2024-04-09 12:17:41,MSFT,NEGATIVE,0.9965077042579652,I may have misunderstood.
615,2024-04-09 12:17:41,MSFT,POSITIVE,0.9988734126091005,Educate me bro
616,2024-04-09 12:17:41,MSFT,NEGATIVE,0.9768975973129272,I just double checked it
617,2024-04-09 12:17:41,MSFT,NEGATIVE,0.9964157342910768,"The original comment was someone saying theyre paying ""almost 50%"" specifically on their Microsoft dividends"
618,2024-04-09 12:17:41,MSFT,NEGATIVE,0.9920071363449096,That was not you though
619,2024-04-09 12:17:41,MSFT,NEGATIVE,0.9839854836463928,Ive actually been thinking about switching my non retirement investments to more corporate stocks to lessen my tax liability for that.
620,2024-04-09 12:17:41,MSFT,NEGATIVE,0.9994506239891052,"When an airplane has a door fall off, do you believe that the value of that company goes down by billions of dollars overnight?"
621,2024-04-09 12:17:41,MSFT,POSITIVE,0.9986634254455566,Of course
622,2024-04-09 12:17:41,MSFT,NEGATIVE,0.9997877478599548,"When buyers or investors see bad news about a company, the potential value that buyers are willing to pay will go lower"
623,2024-04-09 12:17:41,MSFT,POSITIVE,0.9836304187774658,"It's the whole literal meaning of ""market value""; the value of something to their potential buyers in a ""market""."
