,comments,sent,score
120,"The EV sector charging Up towards 17 million sales in 2024, a new record. Tesla 11 % mth . Rivian 21 % mth..QS..43 % mth . FSRNQ.. Fisker 220 % week...Zapp 400 % mth..Joby 23 % mth..Chpt 45:% mth... Archer 33 % mth . Lillium 14 % mth... Lucid 29 % mth.. EVTL 36 % mth and more. Thumbs Up video/ comments.. Thanks",POSITIVE,0.9966036081314087
121,"Great job Mike. Keep up the good work. I might have to get me a bottle of that Tesla moonshine so we can toast to healthy and happy life. We knew this reset was coming, and my plan was to acquire more shares (catching falling knives) At the 220 mark and if it does go down to 185 due to the recession, high interest rates, etc. if it drops down to that level, my average price per share will be Under $200. Do you think it would be a smart idea to grab some shares at this price point Then wait to see if that 185 price point manifest itself then I pretty much go all in before the recovery or bounce hits us possibly August 4 or/and before 10/10? I know you’re not a financial advisor just looking To see how you might approach this next 6 to 12 weeks. HUGE Tesla BULL but I’m hoping the Price drops again so I can average down my PPS… this is strictly for educational purposes. Thank you for your time and all the work you put into your podcast. Thank you for doing what you do",NEGATIVE,0.9838999509811401
122,The Sun Moon and Stars are priced in.,POSITIVE,0.9130437970161438
123,"You work for 40yrs to have $1M in your<br>retirement, meanwhile some people are putting just $10K in a bitcoin from just a few months ago and now they are multimillionaires.,.,..,",NEGATIVE,0.9980213642120361
124,I want TSLA to drop to 180 so I can load up!!!! Whoop whoop,NEGATIVE,0.9788641333580017
125,"!!!I recently sold some of my long-term position and currently sitting on about 250k, do you think Nvidia is a good buy right now or I have I missed out on a crucial buy period, any good stock recommendation on great performing stocks will be appreciated",POSITIVE,0.948893666267395
126,"FSD edging hard bro. So close.<br>► AG1 <a href=""https://drinkag1.com/SMR"">https://drinkAG1.com/SMR</a> (FREE 1 Yr Supply of Vitamin D + 5 AG1 Travel Packs) <br>► Want More Content? Join Patreon: <a href=""https://www.patreon.com/solvingthemoneyproblem"">https://www.patreon.com/solvingthemoneyproblem</a><br>► Subscribe on X (Twitter): <a href=""https://twitter.com/stevenmarkryan"">https://twitter.com/stevenmarkryan</a> <br>► Oura Ring <a href=""https://ouraring.com/smr"">https://ouraring.com/smr</a> (Track your sleep, readiness &amp; activity) <br>► Browse MERCH: <a href=""https://solving-the-money-problem.creator-spring.com/"">https://solving-the-money-problem.creator-spring.com/</a> <br>► TSLA Fair Value aka “Price Targets” (2024-2033) <a href=""https://www.patreon.com/posts/tesla-stock-fair-96573364"">https://www.patreon.com/posts/tesla-stock-fair-96573364</a> <br>👕 Don’t bet against Elon MERCH <a href=""https://solving-the-money-problem.creator-spring.com/listing/new-don-t-bet-against-elon"">https://solving-the-money-problem.creator-spring.com/listing/new-don-t-bet-against-elon</a> <br>👕 TSLA HODLR MERCH: <a href=""https://solving-the-money-problem.creator-spring.com/listing/new-tsla-hodlr?product=46"">https://solving-the-money-problem.creator-spring.com/listing/new-tsla-hodlr?product=46</a> <br>👕 Traders FOLD. Investor HOLD. Merch: <a href=""https://solving-the-money-problem.creator-spring.com/listing/traders-fold-investors-hold"">https://solving-the-money-problem.creator-spring.com/listing/traders-fold-investors-hold</a><br>👕  420 Funding Secured MERCH: <a href=""https://solving-the-money-problem.creator-spring.com/listing/420-funding-secured-merch"">https://solving-the-money-problem.creator-spring.com/listing/420-funding-secured-merch</a> <br>👕 I’m ALL IN on TSLA MERCH <a href=""https://bit.ly/30nh2S7"">https://bit.ly/30nh2S7</a> <br>👕 Buy $TSLA MERCH <a href=""https://bit.ly/3Gh8wUw"">https://bit.ly/3Gh8wUw</a> <br>👕 TSLA to the mooooooon MERCH <a href=""https://bit.ly/3iagHHZ"">https://bit.ly/3iagHHZ</a> <br>👕 Cybertruck Light Strip MERCH <a href=""https://bit.ly/3FNLq7L"">https://bit.ly/3FNLq7L</a> <br>👕 Mars awaits MERCH <a href=""https://bit.ly/3yUnKdb"">https://bit.ly/3yUnKdb</a> <br>👕 Make Manufacturing Great Again <a href=""https://solving-the-money-problem.creator-spring.com/listing/make-manufacturing-great-again"">https://solving-the-money-problem.creator-spring.com/listing/make-manufacturing-great-again</a> <br>➡ SEND BITCOIN: bc1q386gs0uhzr5l5zatwz5u28t3f729zpsa9p8t0k <br>➡ SEND ETHEREUM: 0xb3F81537394344DF1d21a0e0CB6DFdF7bFBBA0A3 <br>➡ DONATE <a href=""https://paypal.me/stevenmarkryan"">https://paypal.me/stevenmarkryan</a><br>AFFILIATE DISCLOSURE: I earn a commission on every purchase made through my links.",NEGATIVE,0.9986901879310608
127,The most bullish thing about this is that increasing the parameter count means that they solidified their architecture. You don&#39;t increase parameters early on because you&#39;ll incur heavy training costs if you&#39;re wrong. You have to prove you have the right architecture to get the results you want before you increase the model size. This is the biggest indicator that FSD from an architectural standpoint is solved internally. All thats left is training.,NEGATIVE,0.9917638301849365
128,Been driving 12.5 around for the first time today in Canada. This is a different beast. It is confident and actually assertive. It knows what it&#39;s doing. I also set the speed to auto and it keeps pace with traffic,POSITIVE,0.9997937083244324
129,I have been using 12.3.6 for a few months now and got 12.5 this week. I use it every day for my 80 miles round trip. It genuinely feels amazing. There are a few rough edges still but the improvements are amazing. We are very close!,POSITIVE,0.9998655319213867
130,"first the dog, then the car, then the house, but eventually got my XAI600T",NEGATIVE,0.9844464659690857
131,"Tesla’s loves cats lol.  A model 3 was driving on 12.5 FSD.  A cat was walking in the road at night, car quickly stopped, cat didn’t move.  10s later another car started coming the other way, so it inched towards the cat until it ran away then it continued.  Did exactly what I do with my cat in the driveway when I get home from work",NEGATIVE,0.9866053462028503
132,"Just drove from Redding to San Luis Obispo.  6.5 hours, 429 miles and never touched the wheel!!!  <br><br>Most impressive is my wife drove a 1/3 of the distance and I was able to sleep in the pasgr seat knowing the safest driver anywhere in California was piloting the car!  Her fear of FSD was finally broken!",NEGATIVE,0.5218192338943481
133,When Tesla gets this FSD or chauffeur mode right that operating system will be worth more than the car company,NEGATIVE,0.8813073635101318
134,We need that in Europe asap,NEGATIVE,0.9127939343452454
135,Buy TSLA. Then buy more . Then back the truck up and buy a ton more . Buy any and all dips. Accumulate vigorously. Buy soon and buy often .,POSITIVE,0.9453081488609314
136,"The best solar company in Australia just installed my new solar system. Check them out here: <a href=""https://www.resinc.com.au/electricviking"">https://www.resinc.com.au/electricviking</a>",POSITIVE,0.9629920125007629
137,"Sometimes cars in Europe are still very nice after 200k miles, however the engine is broken or not up to environmental standards any more. I wish companies would step in and massively replace engines for an electric drivetrain and batteries",NEGATIVE,0.9981081485748291
138,"<a href=""https://www.youtube.com/watch?v=EYK3rYMDnK8&amp;t=86"">1:26</a> Damn, that thing is going like 200mph!",NEGATIVE,0.9989124536514282
139,Musk was asked about upcoming battery innovations at a Tesla takeover in Texas. He basically said the current battery tech was good enough and he’s focused on reducing costs.,POSITIVE,0.9590901136398315
140,Exciting!,POSITIVE,0.9998757839202881
141,"Sam david Brisbane Australia here great video. By the way two guys I know that have evaluated electric cars . Three types of electric vehicles in Victoria have decided to buy the BYD seal instead of the Tesla. Here is why no radar and the camera can’t handle fog., and if the windscreen in front of the camera is dirty everything stuff up also no turning indicator stalks both guys drive and high density traffic manoeuvering in an out of shopping centres et cetera et cetera and I totally agree with them. The push button on the steering wheel sometimes is hard to push and just a nuisance when you are manoeuvering anyway have a good day.",NEGATIVE,0.9032544493675232
142,"I wish the politicians would educate themselves. If the CATL tech is better than 4680. Then that is what we should embrace. Does NOT mean we stop working on better stuff. Companies in Asia spent the last 5 decades acquiring Western (USA) technology. We surrendered consumer electronics to Japan in the 60s/70s. Followed by small cars in the 70s/80s. If we get the lead in cars through Tesla, and the best thing we can do is get battery tech from China to keep that lead all the better. Local production is important.",POSITIVE,0.9054067730903625
143,What is the timeline for the new CATL batteries? Could they come in the Model Y Juniper coming out late this year or early next year?,NEGATIVE,0.9993871450424194
144,"Along with car batteries, we desperately need affordable home and small business-scale, storage batteries!!!!!! Put a battery in every business and home as bd you won’t have to do as much to upgrade the grid. And then you will be set up for more robust energy production snd storage. And, we need to include actual citizens in the solar and battery revolution, and enable us to profit too!",POSITIVE,0.928983211517334
145,They just added more 4680 lines at Giga TX. With the dry electrode version 4680 to start going into cybertrucks at the end of the year. So no Tesla is not &quot;giving up&quot; on the 4680.,NEGATIVE,0.9971229434013367
146,"RIP.<br>► AG1 <a href=""https://drinkag1.com/SMR"">https://drinkAG1.com/SMR</a> (FREE 1 Yr Supply of Vitamin D + 5 AG1 Travel Packs) <br>► Want More Content? Join Patreon: <a href=""https://www.patreon.com/solvingthemoneyproblem"">https://www.patreon.com/solvingthemoneyproblem</a><br>► Subscribe on X (Twitter): <a href=""https://twitter.com/stevenmarkryan"">https://twitter.com/stevenmarkryan</a> <br>► Oura Ring <a href=""https://ouraring.com/smr"">https://ouraring.com/smr</a> (Track your sleep, readiness &amp; activity) <br>► Browse MERCH: <a href=""https://solving-the-money-problem.creator-spring.com/"">https://solving-the-money-problem.creator-spring.com/</a> <br>► TSLA Fair Value aka “Price Targets” (2024-2033) <a href=""https://www.patreon.com/posts/tesla-stock-fair-96573364"">https://www.patreon.com/posts/tesla-stock-fair-96573364</a> <br>👕 Don’t bet against Elon MERCH <a href=""https://solving-the-money-problem.creator-spring.com/listing/new-don-t-bet-against-elon"">https://solving-the-money-problem.creator-spring.com/listing/new-don-t-bet-against-elon</a> <br>👕 TSLA HODLR MERCH: <a href=""https://solving-the-money-problem.creator-spring.com/listing/new-tsla-hodlr?product=46"">https://solving-the-money-problem.creator-spring.com/listing/new-tsla-hodlr?product=46</a> <br>👕 Traders FOLD. Investor HOLD. Merch: <a href=""https://solving-the-money-problem.creator-spring.com/listing/traders-fold-investors-hold"">https://solving-the-money-problem.creator-spring.com/listing/traders-fold-investors-hold</a><br>👕  420 Funding Secured MERCH: <a href=""https://solving-the-money-problem.creator-spring.com/listing/420-funding-secured-merch"">https://solving-the-money-problem.creator-spring.com/listing/420-funding-secured-merch</a> <br>👕 I’m ALL IN on TSLA MERCH <a href=""https://bit.ly/30nh2S7"">https://bit.ly/30nh2S7</a> <br>👕 Buy $TSLA MERCH <a href=""https://bit.ly/3Gh8wUw"">https://bit.ly/3Gh8wUw</a> <br>👕 TSLA to the mooooooon MERCH <a href=""https://bit.ly/3iagHHZ"">https://bit.ly/3iagHHZ</a> <br>👕 Cybertruck Light Strip MERCH <a href=""https://bit.ly/3FNLq7L"">https://bit.ly/3FNLq7L</a> <br>👕 Mars awaits MERCH <a href=""https://bit.ly/3yUnKdb"">https://bit.ly/3yUnKdb</a> <br>👕 Make Manufacturing Great Again <a href=""https://solving-the-money-problem.creator-spring.com/listing/make-manufacturing-great-again"">https://solving-the-money-problem.creator-spring.com/listing/make-manufacturing-great-again</a> <br>➡ SEND BITCOIN: bc1q386gs0uhzr5l5zatwz5u28t3f729zpsa9p8t0k <br>➡ SEND ETHEREUM: 0xb3F81537394344DF1d21a0e0CB6DFdF7bFBBA0A3 <br>➡ DONATE <a href=""https://paypal.me/stevenmarkryan"">https://paypal.me/stevenmarkryan</a><br>AFFILIATE DISCLOSURE: I earn a commission on every purchase made through my links.",NEGATIVE,0.9988003969192505
147,"Once NVDA16K passes $1, it may NEVER see that low again",NEGATIVE,0.9939286708831787
148,It is a well written fact NVDA16K is underestimated and underrated.,POSITIVE,0.9792128205299377
149,This is the worst thing that has ever happened to Tesla,NEGATIVE,0.9997743964195251
150,Why is NVDA16K doing so well? That is concerning to me.,NEGATIVE,0.6408861875534058
151,Why do people think you need to top off ev’s in 2 minutes? The point is to charge the car at home and not at a gas station. There is no fixing stupid.,NEGATIVE,0.9990197420120239
152,"Maybe Cramer&#39;s doing a reverse-reverse psychology thing, where he&#39;s aware that everyone knows they should do the opposite of what he says, and now it&#39;s a curveball to do the opposite-of-the-opposite of what he says",NEGATIVE,0.9985398054122925
153,That old video of Jim was absolutely wild.   At least he was speaking the truth,POSITIVE,0.7975291013717651
154,"Wow, love that you let that old video play in its entirety. Brutal. “Market has nothing to do with the stock”. “A good game”",POSITIVE,0.99846351146698
155,"When I think of blindingly intelligent people, I can&#39;t think of one who would willingly sleep under a desk on a factory floor. <br><br>Of those, I can think of Leonardo DaVinci, Michaelangelo, Mozart, Einstein, Edison, Ford and of course Nikola Tesla himself, etc. <br><br>It&#39;s more than &#39;intelligence&#39; it&#39;s the tortured genius syndrome. It&#39;s the sense that you have so much to do and so little time to achieve it.😂❤",NEGATIVE,0.9927533268928528
156,"3 DAYS LEFT!!! Deposit $100 and get 5 FREE STOCKS: <br><a href=""https://j.moomoo.com/00a7YQ"">https://j.moomoo.com/00a7YQ</a>",NEGATIVE,0.9940669536590576
157,"Tesla bouncing 216, if it can hold then it will go up. Musk had a great interview on X. That xAI is going to be huge.",POSITIVE,0.9989063739776611
158,Who got here before me? 😂,NEGATIVE,0.995376467704773
159,"At the age of 27, I recently opened an ROTH IRA and made the full commitment possible for 2024. How long it took me to straighten out my life makes me feel terrible. How to invest the money to grow for retirement is the issue here",NEGATIVE,0.9972755312919617
160,Ty Sir.,POSITIVE,0.9069564342498779
161,Thanks very much,POSITIVE,0.9998106360435486
162,Thanks,POSITIVE,0.9998080134391785
163,That&#39;s a good report 👌,POSITIVE,0.9990383386611938
164,The cyber truck is honestly one of my favorite cars I’ve ever seen like the design looks so cool,POSITIVE,0.9996374845504761
165,"Dream car, but i can ´t afford it 😢 and it is Not approved in germany",NEGATIVE,0.9994877576828003
166,Give telsa credit for making something that looks that nothing remotely like it.,NEGATIVE,0.9982989430427551
167,2024 Mercedes Maybach S680 Red or black colour please make the detail video 20 to 25 minutes,NEGATIVE,0.9665965437889099
168,That trunk is beautiful 🤩,POSITIVE,0.9998421669006348
169,"Nice truck! I was supposed to get one, but they bumped me to October due to other people wanting my truck more than me. I hope they have more in stock in October like they told me. If only...",NEGATIVE,0.9915931224822998
170,What&#39;s the music name???? Video background music,NEGATIVE,0.9977846741676331
171,This car looks cool in my opinion,POSITIVE,0.999535083770752
172,"Технологии в нашем парке, на назком уровне . Маск знает об этому,  и мало кто знает об этом. Все высокие технологии скрыты от нас,  и он знает об этом. Выдают по чуть чуть, чтоб думали что развитие идёт. Просто шоу и точка, а он актёр Ну а с салоно конечно беда. Могли бы включить головы",NEGATIVE,0.9014564156532288
173,The single motor model!,POSITIVE,0.9884103536605835
174,Guy get new car as often as I get new phone 😂😂😂,NEGATIVE,0.9776903986930847
175,Cybertruck has left the chat.,NEGATIVE,0.999667763710022
176,Man the nostalgia all these years Brandon you were different from each years,POSITIVE,0.9961313009262085
177,Why did you regret purchasing the Model S Plaid?,NEGATIVE,0.9968133568763733
178,Why do you buy so many Teslas when they are the same 😅,NEGATIVE,0.9959790706634521
179,Guy got a new car as often as I get rejected. 😂,NEGATIVE,0.9955807328224182
180,"So apparently my family got our Tesla model 3 dual motor in 2018 and have loved it ever since before you bought your first Tesla in 2019 lol. Also, thank you so much for making this video for us by the way.",POSITIVE,0.9996415376663208
181,You get a new car every time I get a new phone 😅😂❤,NEGATIVE,0.9871636629104614
182,you&#39;re def gonna lose money again on that model 3 performance,NEGATIVE,0.9966061115264893
183,How did it pay for itself multiple times?,NEGATIVE,0.9989262223243713
184,That&#39;s. Seal. Not a Dolphin.,NEGATIVE,0.9827975034713745
185,Finally an even slower and more complicated door handle.,NEGATIVE,0.9988332390785217
186,Good car! <br>I will take the girl.,POSITIVE,0.9998301267623901
187,"They need to change the door handle, if you get chased by a weirdo, he will get you while you waiting for the handle lol",NEGATIVE,0.9922558069229126
188,Dear lord the shift lever is an atrocity in the BYD,POSITIVE,0.8776485919952393
189,The dolphin going 0 to bomb in like 6 seconds,NEGATIVE,0.9907885193824768
190,They make life more complicated😂,POSITIVE,0.995335042476654
191,BYD door handle takes forever to come out people has no chance while getting robbed,NEGATIVE,0.99815434217453
192,Someone spent extra money to turn her white tesla to pink,NEGATIVE,0.9988621473312378
193,That byd sunroof is crazy,NEGATIVE,0.7196601629257202
194,"Farzad Clips: <a href=""https://www.youtube.com/@farzadmesbahiclips"">https://www.youtube.com/@farzadmesbahiclips</a>",NEGATIVE,0.9778681993484497
195,"No one believed Tesla, SpaceX, Neuralink, etc. were possible, yet here we are. I&#39;d never ever bet against Elon.",POSITIVE,0.9969486594200134
196,I believe him.  I believe enough to have bought more Tesla yesterday as soon as I saw the dip -,POSITIVE,0.7343375086784363
197,Companies have ups and downs.  Tesla can ignore short term investors and invest in its future.  I don’t see other U.S. auto companies long term outlook to be as good as Tesla.,NEGATIVE,0.9910598397254944
198,"FARZAD!! Tesla Lovers!! Do not let the FUD deter your passion for this amazing company!! Stay calm and carry on!! Riches await in the long term!! Greetings from the amazing  shores of Lake Huron!! Ontario , Canada!! GIDDYUP!!",POSITIVE,0.9993699193000793
199,TSLA will 10x from here over the years. Don’t get fudded out people!,NEGATIVE,0.5274007320404053
200,People love to freak out and so easily forget the past and future.,POSITIVE,0.8291677236557007
201,Mc Donalds needs Robots so we can keep 5.00 meals,NEGATIVE,0.9990135431289673
202,A robot “Changing a diaper” I see you have a lot of real life experience 😂,POSITIVE,0.997704803943634
203,The masses of drivers are not interested in a self driving car that they have to babysit. As soon as it can drive itself with no one in the car THEN the demand will be incredible. <br>Everyone wants a chauffeur that can take the kids to soccer practice or pick up groceries for you. No one wants to sit behind a wheel and have to concentrate on what is happening all the time. If you have to do that then you might as well drive yourself since driving can be enjoyable. <br>    This is the singular reason for the low adoption rate of FSD. As soon as it becomes truly non-supervised  demand will explode.,POSITIVE,0.8854009509086609
204,"Factoring in the 7500 tax credit for purchase on M3P trim 55k or less, the price gap vs. BMW more than doubles.  Sentry mode is a very important feature to me.  I do wish the M3P was a lift back like the BMW.",POSITIVE,0.9365801215171814
205,I’m never going back to ice cars because it’s a waste of my time. I still have to do oil changes for my wife’s Infiniti and sometimes fuel up her car. Those things cost you lots of time as the years go by that you can’t get back.,NEGATIVE,0.9940376281738281
206,One correction - BMW does not yet have access to the Tesla network. Only Rivian and Ford have access currently. GM is next - then others. Magic dock locations will work though.,POSITIVE,0.5872815251350403
207,Can you control all the functions of the Bmw from your smart phone?,NEGATIVE,0.9950950145721436
208,"I purchased my wife the BMW i4 M50 and the sub trunk storage area is almost completely consumed by the factory-installed sub-woofer. The sound system is great, but this seriously limits trunk storage because now the factory-supplied charger now needs to reside in the relatively small trunk. The car is fantastic, but the rear seat room is nearly non-existent. The front seats are comfortable and have just enough room (still tighter than my M3P). The mileage in the M3P is better and because it has a smaller battery the charging is faster. The driving experience of the BMW is fabulous, but so is the Tesla. I like the Tesla interior design language, so I vote for the M3P, but the interior of the BMW is more classically incredible, so my wife voted for the i4 M50. If one did not care about car brands, the M3P is by far and away the best car and deal.",POSITIVE,0.9930405616760254
209,I  like how people brought up the trunk/opening. One reason I bought MYP instead of M3P was the hatchback.,NEGATIVE,0.6584954261779785
210,BMW&#39;s new front end is one of the biggest misses in automotive history. What a mess.,NEGATIVE,0.9998045563697815
211,"The BMW trunk is absolutely superior. If the model 3 had that trunk, the model 3 would be perfect 😢",POSITIVE,0.9979554414749146
212,I blame the glass greenhouse of the tesla for the lack of cooling on super hot days,NEGATIVE,0.9994377493858337
213,"I am a huge fan of BMW&#39;s cars. They make great vehicles in terms of performance and styling. However, I have to admit that when it comes to electric vehicles, BMW has some catching up to do. At this point in time, their i4s are not even close to matching the Tesla Model 3 long-range, let alone the Model 3 performance. I need to say that TESLA&#39;s technology, range, and overall performance are setting a high standard in the EV market.",POSITIVE,0.9877331256866455
214,"This new aspect ratio (2:1) should look better on a phone. Do you like it? <br><br>Sponsored:<br>Use my special link <a href=""https://www.piavpn.com/AIDRIVR"">https://www.piavpn.com/AIDRIVR</a> for an 83% discount, 4 months free and 30-day money-back guarantee on the best VPN - Private Internet Access",NEGATIVE,0.9957428574562073
215,That cat scenario was incredible!!!,POSITIVE,0.9998555183410645
216,"When FSD Beta first came out, I was obsessed with it. I used to watch every video every day. It used to be a thrilling experience to watch, never knowing when it would make a mistake, rooting for it to complete every maneuver. <br><br>Fast forward a few years and it got very boring since interventions became so rare. Youtubers that just post driving videos seemed like a waste of time. But you are the only one that I&#39;ve never stopped watching! No boring stuff here. You make comparisons, you edit out the fluff, and your commentary is always smart and on point. I can&#39;t think of anyone better to be a tester for this technology. Congrats!",POSITIVE,0.9579388499259949
217,One of the few FSD channels I don&#39;t watch with 2x speed! Good job!,POSITIVE,0.9964765906333923
218,The best part is that it gets better from here 😊,POSITIVE,0.9515246748924255
219,"Still with Tesla stock, investors can never be sure what will happen next, bearish periods ultimately establish a new set of stocks to buy and watch while setting the stage for a robust new uptrend. I have been reading articles of people that grossed profits up to $250k during this crash, what are the best stocks to buy now or put on a watchlist?",POSITIVE,0.996572732925415
220,I asked Claude 3.5 Sonnet to count how many times you mention smoothness. <br><br>&quot;Smooth&quot; appears 11 times.<br>&quot;Smoothness&quot; appears 10 times.<br><br>So pretty smooth I guess!,POSITIVE,0.998204231262207
221,You were very quick with this version,POSITIVE,0.9698008894920349
222,GET IN HERE BOYS AND GIRLS.,POSITIVE,0.9967585206031799
223,"Got my Tesla 2 days ago, came with 12.3.6, but I just got 12.5 notification on the app",NEGATIVE,0.9890398979187012
224,Wtf I was so hyped by the idea of a real quad and it&#39;s a dumb kid toy,NEGATIVE,0.9991156458854675
225,“It actually has REAL rubber wheels”<br>I would hope so for $1700💀,NEGATIVE,0.9669675827026367
226,give this to my uncle for 2 hours and he&#39;d make it go 60mph using his tinker magic lol,NEGATIVE,0.9559059143066406
227,"About 2 n a half months ago I bought a used Buick with only 87k miles, working AC ....... I paid $1900 for that",NEGATIVE,0.9964373111724854
