,comments,sent,score
228,Bruh I thought it was a real quad at first. My disappointment is immeasurable and my day is ruined.,NEGATIVE,0.999796450138092
229,The Cyberquad Is Cool Looking But ($1900) SOLD OUT ($3000) Aftermarket. . . Nah,POSITIVE,0.9036042094230652
230,"Perfect analogy for anything Tesla/Elon; overpromise, overprice and under deliver.",NEGATIVE,0.9912943243980408
231,There&#39;s nothing better than the experience of driving a gas 4 wheeler at 70mph on a freezing night,NEGATIVE,0.9966539144515991
232,“You can buy on their website”<br>“They sold out so you can’t buy it on their website”<br><b>So that was a lie.</b>,NEGATIVE,0.9959923624992371
233,“It only goes 10 mph” “it has this powerful motor”,POSITIVE,0.997280478477478
234,"I hope this video helped you get brighter about Tesla!<br><br>My website: <a href=""https://www.herbertong.com/"">https://www.HerbertOng.com</a><br><br>See the MOST comprehensive resource for the $TSLA Investor<br><br>Join this channel or my Patreon to get free access to 15+ modules of TSLA investor resources<br><br>Join this channel: <a href=""https://www.youtube.com/channel/UC4DBLlq1x0AKmip1QJUcbXg/join"">https://www.youtube.com/channel/UC4DBLlq1x0AKmip1QJUcbXg/join</a><br>Join my Patreon: <a href=""https://www.patreon.com/brighterwithherbert"">https://www.patreon.com/brighterwithherbert</a><br><br>Thank you for supporting this channel! I really do appreciate your likes, subscribes and comments. <br><br>Let&#39;s get brighter!<br>Herbert",POSITIVE,0.9877054691314697
235,Hit 200k today. Thank you for all the knowledge and nuggets you had thrown my way over the last months. Started with 17k in last month 2024.,POSITIVE,0.9930847883224487
236,Warren is great. Love his comments.,POSITIVE,0.9998824596405029
237,I think Warren is absolutely correct about wireless charging. The latest wireless charging technology has much faster charging speeds than before. The newest technology is only slightly slower than conventional wired charging.,NEGATIVE,0.6033799052238464
238,"The example of lowering consumer price by using robots is the same as a coder using example ChatGPT, with the AI the proce of &#39;building a website&#39; drops drastically as code is fast and easy to produce. The same shift will inevitably happen when Optimus gets released, people using them will be able to drastically drop the price and increase the output, as well as build automated companies. Take alsointo account the rappid speed of AI.",NEGATIVE,0.9989705085754395
239,What?!?! The initial cost of the robobtaxi is a rounding error.  Agree with you Herbert for the first time.,NEGATIVE,0.9794507622718811
240,"My Optimus Vision: The Robot Revolution<br><br>1. Base: All-round assistant worker skills<br>2. Specialist firms develop expert programs<br>3. Programs hosted by firms, not stored on robots<br>4. On-demand access to special skills (Gourmet chef at the push of a button!)<br>5. Companies guarantee safety &amp; legal compliance<br>6. Future: One multi-talented robot per household<br><br>I believe these specialized programs will be the new internet - like apps, but for robots. Anyone with special skills should contribute to training these open-source programs.<br><br>I also think the Texas company is training Optimus on Fridays and weekends when no employees are present. Goal: Full automation of production!",NEGATIVE,0.9893413186073303
241,Midnight to 6:00 AM for charging. I don&#39;t  think he realises the size of the bars are closing drunks and staff taxi market. Not to mention all of the other late shift industries out there.,NEGATIVE,0.9900712966918945
242,Great guest. Have him more. Less of echo an chamber!!! Thanks to both of you:),POSITIVE,0.9331079721450806
243,Tesla should make their own air jet,POSITIVE,0.5365853905677795
244,"3 DAYS LEFT!!! Deposit $100 and get 5 FREE STOCKS: <br><a href=""https://j.moomoo.com/00a7YQ"">https://j.moomoo.com/00a7YQ</a>",NEGATIVE,0.9940669536590576
245,"Thanks Mate,  the sad truth is that no one has a clue, we all react to what happens as it happens and try to analyse it but can’t predict an iota of what is going to unfold in the markets… content creators are like amplifiers, when times are good they affirm it and try to tell you why it’s good and that it’s looking bullish but then all of a sudden the market turns bearish and everyone affirms it again and try to analyse why… it’s so sad that many are so powerless and it&#39;s not about guessing the market&#39;s next move; it&#39;s about playing it smart and steady during trading...managed to grow a nest egg of around 2.3Bitcoin to a decent 19Bitcoin in the space of a few months... I&#39;m especially grateful to Linda Wilburn, whose deep expertise and traditional trading acumen have been invaluable in this challenging, ever-evolving financial landscape.",NEGATIVE,0.9688104391098022
246,Thank you for your information will use it for tomorrow morning.,POSITIVE,0.9989882111549377
247,Thanks for your info! Very helpful,POSITIVE,0.9998186230659485
248,Thank you,POSITIVE,0.9998352527618408
249,"Thanks for the analysis, man.",POSITIVE,0.9997003078460693
250,Thank you!,POSITIVE,0.9998581409454346
251,Thanks‼️‼️‼️,POSITIVE,0.9989891648292542
252,Do you think Reddit is good stock?,NEGATIVE,0.9977505803108215
253,"Part 2 of movie FM trailer --&gt; <a href=""https://www.youtube.com/watch?v=nV8j2bf3gys"">https://youtu.be/nV8j2bf3gys?si=20ELz6KmBRU5Gq4F</a>",NEGATIVE,0.9910284876823425
254,when Elon musk flips a switch,POSITIVE,0.79424649477005
255,Getting out of the road: no<br>Dodging every Tesla ahead: ✓,NEGATIVE,0.9960501790046692
256,Zombie apocalypse ❎Tesla apocalypse ✅,NEGATIVE,0.9903948903083801
257,"Настоящие американцы , развернулись и езжайте по обочине, тем более ваша машина это позволяет . Так нет они будут ехать по трассе уклоняясь от встречных машин 🤦🏻‍♂️ Задорнов был прав 😏",NEGATIVE,0.7353412508964539
258,<b>”Execute Order 66”</b><br>~ Elon Musk probably,NEGATIVE,0.9604411125183105
259,Director got serious issues with Elon Musk 😂,NEGATIVE,0.9931423664093018
260,You know the film industry is running out of ideas when they drop a zombie CAR movie.,NEGATIVE,0.9997645020484924
261,"Это кстати прогноз на будущее, а не фантастика. Через 10-20 лет лучше жить в Сибири и ехать на лошади или эндурике, чем подыхать в мегаполисе от цифрового рабства и уколов от непонятных болезней.",NEGATIVE,0.5989568829536438
262,Her decision to drive on the road in oncoming traffic is as smart as the person who made this movie.,POSITIVE,0.9981992840766907
263,It’s like a brand new iPhone 📱,POSITIVE,0.9835706949234009
264,Rides so much nicer than the older 2023 Generation!,POSITIVE,0.9997664093971252
265,They are stunning so futuristic just awesome cars.,POSITIVE,0.9998794794082642
266,I vastly prefer the facelift design. Looks a lot better and less boring. The only thing i don’t like is how they did the turn signals. They should have done it like Ferrari where the left indicator is on the left and the right one on the right side of the steering wheel.,NEGATIVE,0.9986982345581055
267,Wow so beautiful,POSITIVE,0.9998747110366821
268,My dream is to have a Tesla! The best electric car brand! But I&#39;m only 12 years old.... And I live in Brazil! I hope Tesla comes to Brazil one day!,POSITIVE,0.9995527863502502
269,This is my dream car I want it so bad,NEGATIVE,0.9997895359992981
270,"Meu carros dos sonhos, espero um dia conseguir importar um aqui para o Brasil 🙏🏽",POSITIVE,0.583103597164154
271,"Ah yes, knocking on the headlight... All I need to make a decision that that is a car for me.",NEGATIVE,0.9648405313491821
272,Very good:-) 👍,POSITIVE,0.999855637550354
273,"As a person on HW3, I personally would like to see you continuing to do your testing on your current car, even after version 12.5 of FSD, so that it can be determined just how far HW3 can take us. Big fan of your channel.",POSITIVE,0.9966078996658325
274,"My intent is only to watch 12.5 videos, but Black Tesla provides such a great commentary that I click whenever he posts a video.",POSITIVE,0.9938511848449707
275,"FYI - 12.5 came to the &#39;new&#39; Model 3 as well so it&#39;s deployed to HW4 (release notes mention the Cybertruck)<br>Hope HW3 gets it soon because I believe it&#39;s a significant leap forward when compared to 12.3.6.<br>BTW, I keep saying it and repeating it: for years already: none of the HW3 cars will ever be a Robotaxi. Not sure about HW4/AI4 either but we shall see.",POSITIVE,0.5239173769950867
276,The problem is that some of us are still stuck on 12.3.6,NEGATIVE,0.9992552399635315
277,I think you&#39;re the first YouTuber to address that question! <br>Thanks!,POSITIVE,0.9996422529220581
278,You’re the only FSD reviewer I trust at the moment. Shame you’re delaying in receiving the update.,NEGATIVE,0.998034656047821
279,"12.5 is definitely a complete rebuild. Action around stop signs is so much better. It still does a complete stop behind the sign but then it just creeps and goes in one motion, no more slow creeps stopping 2-3 times and hesitating. The 5x parameters are very apparent in its smoothness. It seems to have opened a whole new world of possibilities. It drives like a cross between a limo driver and a grandma. Just about the perfect balance between safety and smoothness, imo. <br><br>Don&#39;t worry about the HW3 situation. James Douma explained how it is not close to maxed out yet. There are many things that can be done to optimize the software. It will just take a little extra time going forward.",POSITIVE,0.5355314612388611
280,I gues it&#39;s GPT-4o vs GPT-4o-mini kinda thing. It will run on HW3 as a smaller version yet will likely still be really good -- very comparable to HW4 etc.  Will be very curious to see!,POSITIVE,0.9987836480140686
281,"Yep, looks like we will be waiting for 12.5 with our HW3 cars (2022 MSLR). I have been driving on 12.3.6 for quite a while now and would really like to get an improved version of FSD.",POSITIVE,0.8314846754074097
282,Thanks for your update and explanation!  I was wondering why I didn’t see a FSD 12.5 video from “Black Tesla”.  Hope you and your family had a great vacation.  I look forward to your next test drive video whenever that happens.  Best wishes.,POSITIVE,0.9986786246299744
